results/c500-e928d862973e-20260722/c500-search-space.json
{
  "schema_version": 1,
  "warning": "estimated shared-memory filtering only; validate with the C500 compiler",
  "constraints": {
    "shared_memory_budget_bytes": 65536,
    "allowed_warps": [
      2,
      4,
      8
    ],
    "max_stages": 3
  },
  "candidates": [
    {
      "block_size_m": 16,
      "block_size_n": 32,
      "block_size_k": 32,
      "group_size_m": 1,
      "num_warps": 2,
      "num_stages": 1,
      "align_block_size": 8
    },
    {
      "block_size_m": 16,
      "block_size_n": 32,
      "block_size_k": 32,
      "group_size_m": 1,
      "num_warps": 2,
      "num_stages": 1,
      "align_block_size": 16
    },
    {
      "block_size_m": 16,
      "block_size_n": 32,
      "block_size_k": 32,
      "group_size_m": 1,
      "num_warps": 2,
      "num_stages": 1,
      "align_block_size": 32
    },
    {
      "block_size_m": 16,
      "block_size_n": 32,
      "block_size_k": 32,
      "group_size_m": 1,
      "num_warps": 2,
      "num_stages": 1,
      "align_block_size": 64
    },
    {
      "block_size_m": 16,
      "block_size_n": 32,
      "block_size_k": 32,
      "group_size_m": 1,
      "num_warps": 2,
      "num_stages": 2,
      "align_block_size": 8
    },
    {
      "block_size_m": 16,
      "block_size_n": 32,
      "block_size_k": 32,
      "group_size_m": 1,
      "num_warps": 2,
      "num_stages": 2,
      "align_block_size": 16
    },
    {
      "block_size_m": 16,
      "block_size_n": 32,
      "block_size_k": 32,
      "group_size_m": 1,
      "num_warps": 2,
      "num_stages": 2,
      "align_block_size": 32
    },
    {
      "block_size_m": 16,
      "block_size_n": 32,
      "block_size_k": 32,
      "group_size_m": 1,
      "num_warps": 2,
      "num_stages": 2,
      "align_block_size": 64
    },
    {
      "block_size_m": 16,
      "block_size_n": 32,
      "block_size_k": 32,
      "group_size_m": 1,
      "num_warps": 2,
      "num_stages": 3,
      "align_block_size": 8
    },
    {
      "block_size_m": 16,
      "block_size_n": 32,
      "block_size_k": 32,
      "group_size_m": 1,
      "num_warps": 2,
      "num_stages": 3,
      "align_block_size": 16
    },
    {
      "block_size_m": 16,
      "block_size_n": 32,
      "block_size_k": 32,
      "group_size_m": 1,
      "num_warps": 2,
      "num_stages": 3,
      "align_block_size": 32
    },
    {
      "block_size_m": 16,
      "block_size_n": 32,
      "block_size_k": 32,
      "group_size_m": 1,
      "num_warps": 2,
      "num_stages": 3,
      "align_block_size": 64
    },
    {
      "block_size_m": 16,
      "block_size_n": 32,
      "block_size_k": 32,
      "group_size_m": 1,
      "num_warps": 4,
      "num_stages": 1,
      "align_block_size": 8
    },
    {
      "block_size_m": 16,
      "block_size_n": 32,
      "block_size_k": 32,
      "group_size_m": 1,
      "num_warps": 4,
      "num_stages": 1,
      "align_block_size": 16
    },
    {
      "block_size_m": 16,
      "block_size_n": 32,
      "block_size_k": 32,
      "group_size_m": 1,
      "num_warps": 4,
      "num_stages": 1,
      "align_block_size": 32
    },
    {
      "block_size_m": 16,
      "block_size_n": 32,
      "block_size_k": 32,
      "group_size_m": 1,
      "num_warps": 4,
      "num_stages": 1,
      "align_block_size": 64
    },
    {
      "block_size_m": 16,
      "block_size_n": 32,
      "block_size_k": 32,
      "group_size_m": 1,
      "num_warps": 4,
      "num_stages": 2,
      "align_block_size": 8
    },
    {
      "block_size_m": 16,
      "block_size_n": 32,
      "block_size_k": 32,
      "group_size_m": 1,
      "num_warps": 4,
      "num_stages": 2,
      "align_block_size": 16
    },
    {
      "block_size_m": 16,
      "block_size_n": 32,
      "block_size_k": 32,
      "group_size_m": 1,
      "num_warps": 4,
      "num_stages": 2,
      "align_block_size": 32
    },
    {
      "block_size_m": 16,
      "block_size_n": 32,
      "block_size_k": 32,
      "group_size_m": 1,
      "num_warps": 4,
      "num_stages": 2,
      "align_block_size": 64
    },
    {
      "block_size_m": 16,
      "block_size_n": 32,
      "block_size_k": 32,
      "group_size_m": 1,
      "num_warps": 4,
      "num_stages": 3,
      "align_block_size": 8
    },
    {
      "block_size_m": 16,
      "block_size_n": 32,
      "block_size_k": 32,
      "group_size_m": 1,
      "num_warps": 4,
      "num_stages": 3,
      "align_block_size": 16
    },
    {
      "block_size_m": 16,
      "block_size_n": 32,
      "block_size_k": 32,
      "group_size_m": 1,
      "num_warps": 4,
      "num_stages": 3,
      "align_block_size": 32
    },
    {
      "block_size_m": 16,
      "block_size_n": 32,
      "block_size_k": 32,
      "group_size_m": 1,
      "num_warps": 4,
      "num_stages": 3,
      "align_block_size": 64
    },
    {
      "block_size_m": 16,
      "block_size_n": 32,
      "block_size_k": 32,
      "group_size_m": 1,
      "num_warps": 8,
      "num_stages": 1,
      "align_block_size": 8
    },
    {
      "block_size_m": 16,
      "block_size_n": 32,
      "block_size_k": 32,
      "group_size_m": 1,
      "num_warps": 8,
      "num_stages": 1,
      "align_block_size": 16
    },
    {
      "block_size_m": 16,
      "block_size_n": 32,
      "block_size_k": 32,
      "group_size_m": 1,
      "num_warps": 8,
      "num_stages": 1,
      "align_block_size": 32
    },
    {
      "block_size_m": 16,
      "block_size_n": 32,
      "block_size_k": 32,
      "group_size_m": 1,
      "num_warps": 8,
      "num_stages": 1,
      "align_block_size": 64
    },
    {
      "block_size_m": 16,
      "block_size_n": 32,
      "block_size_k": 32,
      "group_size_m": 1,
      "num_warps": 8,
      "num_stages": 2,
      "align_block_size": 8
    },
    {
      "block_size_m": 16,
      "block_size_n": 32,
      "block_size_k": 32,
      "group_size_m": 1,
      "num_warps": 8,
      "num_stages": 2,
      "align_block_size": 16
    },
    {
      "block_size_m": 16,
      "block_size_n": 32,
      "block_size_k": 32,
      "group_size_m": 1,
      "num_warps": 8,
      "num_stages": 2,
      "align_block_size": 32
    },
    {
      "block_size_m": 16,
      "block_size_n": 32,
      "block_size_k": 32,
      "group_size_m": 1,
      "num_warps": 8,
      "num_stages": 2,
      "align_block_size": 64
    },
    {
      "block_size_m": 16,
      "block_size_n": 32,
      "block_size_k": 32,
      "group_size_m": 1,
      "num_warps": 8,
      "num_stages": 3,
      "align_block_size": 8
    },
    {
      "block_size_m": 16,
      "block_size_n": 32,
      "block_size_k": 32,
      "group_size_m": 1,
      "num_warps": 8,
      "num_stages": 3,
      "align_block_size": 16
    },
    {
      "block_size_m": 16,
      "block_size_n": 32,
      "block_size_k": 32,
      "group_size_m": 1,
      "num_warps": 8,
      "num_stages": 3,
      "align_block_size": 32
    },
    {
      "block_size_m": 16,
      "block_size_n": 32,
      "block_size_k": 32,
      "group_size_m": 1,
      "num_warps": 8,
      "num_stages": 3,
      "align_block_size": 64
    },
    {
      "block_size_m": 16,
      "block_size_n": 32,
      "block_size_k": 32,
      "group_size_m": 4,
      "num_warps": 2,
      "num_stages": 1,
      "align_block_size": 8
    },
    {
      "block_size_m": 16,
      "block_size_n": 32,
      "block_size_k": 32,
      "group_size_m": 4,
      "num_warps": 2,
      "num_stages": 1,
      "align_block_size": 16
    },
    {
      "block_size_m": 16,
      "block_size_n": 32,
      "block_size_k": 32,
      "group_size_m": 4,
      "num_warps": 2,
      "num_stages": 1,
      "align_block_size": 32
    },
    {
      "block_size_m": 16,
      "block_size_n": 32,
      "block_size_k": 32,
      "group_size_m": 4,
      "num_warps": 2,
      "num_stages": 1,
      "align_block_size": 64
    },
    {
      "block_size_m": 16,
      "block_size_n": 32,
      "block_size_k": 32,
      "group_size_m": 4,
      "num_warps": 2,
      "num_stages": 2,
      "align_block_size": 8
    },
    {
      "block_size_m": 16,
      "block_size_n": 32,
      "block_size_k": 32,
      "group_size_m": 4,
      "num_warps": 2,
      "num_stages": 2,
      "align_block_size": 16
    },
    {
      "block_size_m": 16,
      "block_size_n": 32,
      "block_size_k": 32,
      "group_size_m": 4,
      "num_warps": 2,
      "num_stages": 2,
      "align_block_size": 32
    },
    {
      "block_size_m": 16,
      "block_size_n": 32,
      "block_size_k": 32,
      "group_size_m": 4,
      "num_warps": 2,
      "num_stages": 2,
      "align_block_size": 64
    },
    {
      "block_size_m": 16,
      "block_size_n": 32,
      "block_size_k": 32,
      "group_size_m": 4,
      "num_warps": 2,
      "num_stages": 3,
      "align_block_size": 8
    },
    {
      "block_size_m": 16,
      "block_size_n": 32,
      "block_size_k": 32,
      "group_size_m": 4,
      "num_warps": 2,
      "num_stages": 3,
      "align_block_size": 16
    },
    {
      "block_size_m": 16,
      "block_size_n": 32,
      "block_size_k": 32,
      "group_size_m": 4,
      "num_warps": 2,
      "num_stages": 3,
      "align_block_size": 32
    },
    {
      "block_size_m": 16,
      "block_size_n": 32,
      "block_size_k": 32,
      "group_size_m": 4,
      "num_warps": 2,
      "num_stages": 3,
      "align_block_size": 64
    },
    {
      "block_size_m": 16,
      "block_size_n": 32,
      "block_size_k": 32,
      "group_size_m": 4,
      "num_warps": 4,
      "num_stages": 1,
      "align_block_size": 8
    },
    {
      "block_size_m": 16,
      "block_size_n": 32,
      "block_size_k": 32,
      "group_size_m": 4,
      "num_warps": 4,
      "num_stages": 1,
      "align_block_size": 16
    },
    {
      "block_size_m": 16,
      "block_size_n": 32,
      "block_size_k": 32,
      "group_size_m": 4,
      "num_warps": 4,
      "num_stages": 1,
      "align_block_size": 32
    },
    {
      "block_size_m": 16,
      "block_size_n": 32,
      "block_size_k": 32,
      "group_size_m": 4,
      "num_warps": 4,
      "num_stages": 1,
      "align_block_size": 64
    },
    {
      "block_size_m": 16,
      "block_size_n": 32,
      "block_size_k": 32,
      "group_size_m": 4,
      "num_warps": 4,
      "num_stages": 2,
      "align_block_size": 8
    },
    {
      "block_size_m": 16,
      "block_size_n": 32,
      "block_size_k": 32,
      "group_size_m": 4,
      "num_warps": 4,
      "num_stages": 2,
      "align_block_size": 16
    },
    {
      "block_size_m": 16,
      "block_size_n": 32,
      "block_size_k": 32,
      "group_size_m": 4,
      "num_warps": 4,
      "num_stages": 2,
      "align_block_size": 32
    },
    {
      "block_size_m": 16,
      "block_size_n": 32,
      "block_size_k": 32,
      "group_size_m": 4,
      "num_warps": 4,
      "num_stages": 2,
      "align_block_size": 64
    },
    {
      "block_size_m": 16,
      "block_size_n": 32,
      "block_size_k": 32,
      "group_size_m": 4,
      "num_warps": 4,
      "num_stages": 3,
      "align_block_size": 8
    },
    {
      "block_size_m": 16,
      "block_size_n": 32,
      "block_size_k": 32,
      "group_size_m": 4,
      "num_warps": 4,
      "num_stages": 3,
      "align_block_size": 16
    },
    {
      "block_size_m": 16,
      "block_size_n": 32,
      "block_size_k": 32,
      "group_size_m": 4,
      "num_warps": 4,
      "num_stages": 3,
      "align_block_size": 32
    },
    {
      "block_size_m": 16,
      "block_size_n": 32,
      "block_size_k": 32,
      "group_size_m": 4,
      "num_warps": 4,
      "num_stages": 3,
      "align_block_size": 64
    },
    {
      "block_size_m": 16,
      "block_size_n": 32,
      "block_size_k": 32,
      "group_size_m": 4,
      "num_warps": 8,
      "num_stages": 1,
      "align_block_size": 8
    },
    {
      "block_size_m": 16,
      "block_size_n": 32,
      "block_size_k": 32,
      "group_size_m": 4,
      "num_warps": 8,
      "num_stages": 1,
      "align_block_size": 16
    },
    {
      "block_size_m": 16,
      "block_size_n": 32,
      "block_size_k": 32,
      "group_size_m": 4,
      "num_warps": 8,
      "num_stages": 1,
      "align_block_size": 32
    },
    {
      "block_size_m": 16,
      "block_size_n": 32,
      "block_size_k": 32,
      "group_size_m": 4,
      "num_warps": 8,
      "num_stages": 1,
      "align_block_size": 64
    },
    {
      "block_size_m": 16,
      "block_size_n": 32,
      "block_size_k": 32,
      "group_size_m": 4,
      "num_warps": 8,
      "num_stages": 2,
      "align_block_size": 8
    },
    {
      "block_size_m": 16,
      "block_size_n": 32,
      "block_size_k": 32,
      "group_size_m": 4,
      "num_warps": 8,
      "num_stages": 2,
      "align_block_size": 16
    },
    {
      "block_size_m": 16,
      "block_size_n": 32,
      "block_size_k": 32,
      "group_size_m": 4,
      "num_warps": 8,
      "num_stages": 2,
      "align_block_size": 32
    },
    {
      "block_size_m": 16,
      "block_size_n": 32,
      "block_size_k": 32,
      "group_size_m": 4,
      "num_warps": 8,
      "num_stages": 2,
      "align_block_size": 64
    },
    {
      "block_size_m": 16,
      "block_size_n": 32,
      "block_size_k": 32,
      "group_size_m": 4,
      "num_warps": 8,
      "num_stages": 3,
      "align_block_size": 8
    },
    {
      "block_size_m": 16,
      "block_size_n": 32,
      "block_size_k": 32,
      "group_size_m": 4,
      "num_warps": 8,
      "num_stages": 3,
      "align_block_size": 16
    },
    {
      "block_size_m": 16,
      "block_size_n": 32,
      "block_size_k": 32,
      "group_size_m": 4,
      "num_warps": 8,
      "num_stages": 3,
      "align_block_size": 32
    },
    {
      "block_size_m": 16,
      "block_size_n": 32,
      "block_size_k": 32,
      "group_size_m": 4,
      "num_warps": 8,
      "num_stages": 3,
      "align_block_size": 64
    },
    {
      "block_size_m": 16,
      "block_size_n": 32,
      "block_size_k": 32,
      "group_size_m": 8,
      "num_warps": 2,
      "num_stages": 1,
      "align_block_size": 8
    },
    {
      "block_size_m": 16,
      "block_size_n": 32,
      "block_size_k": 32,
      "group_size_m": 8,
      "num_warps": 2,
      "num_stages": 1,
      "align_block_size": 16
    },
    {
      "block_size_m": 16,
      "block_size_n": 32,
      "block_size_k": 32,
      "group_size_m": 8,
      "num_warps": 2,
      "num_stages": 1,
      "align_block_size": 32
    },
    {
      "block_size_m": 16,
      "block_size_n": 32,
      "block_size_k": 32,
      "group_size_m": 8,
      "num_warps": 2,
      "num_stages": 1,
      "align_block_size": 64
    },
    {
      "block_size_m": 16,
      "block_size_n": 32,
      "block_size_k": 32,
      "group_size_m": 8,
      "num_warps": 2,
      "num_stages": 2,
      "align_block_size": 8
    },
    {
      "block_size_m": 16,
      "block_size_n": 32,
      "block_size_k": 32,
      "group_size_m": 8,
      "num_warps": 2,
      "num_stages": 2,
      "align_block_size": 16
    },
    {
      "block_size_m": 16,
      "block_size_n": 32,
      "block_size_k": 32,
      "group_size_m": 8,
      "num_warps": 2,
      "num_stages": 2,
      "align_block_size": 32
    },
    {
      "block_size_m": 16,
      "block_size_n": 32,
      "block_size_k": 32,
      "group_size_m": 8,
      "num_warps": 2,
      "num_stages": 2,
      "align_block_size": 64
    },
    {
      "block_size_m": 16,
      "block_size_n": 32,
      "block_size_k": 32,
      "group_size_m": 8,
      "num_warps": 2,
      "num_stages": 3,
      "align_block_size": 8
    },
    {
      "block_size_m": 16,
      "block_size_n": 32,
      "block_size_k": 32,
      "group_size_m": 8,
      "num_warps": 2,
      "num_stages": 3,
      "align_block_size": 16
    },
    {
      "block_size_m": 16,
      "block_size_n": 32,
      "block_size_k": 32,
      "group_size_m": 8,
      "num_warps": 2,
      "num_stages": 3,
      "align_block_size": 32
    },
    {
      "block_size_m": 16,
      "block_size_n": 32,
      "block_size_k": 32,
      "group_size_m": 8,
      "num_warps": 2,
      "num_stages": 3,
      "align_block_size": 64
    },
    {
      "block_size_m": 16,
      "block_size_n": 32,
      "block_size_k": 32,
      "group_size_m": 8,
      "num_warps": 4,
      "num_stages": 1,
      "align_block_size": 8
    },
    {
      "block_size_m": 16,
      "block_size_n": 32,
      "block_size_k": 32,
      "group_size_m": 8,
      "num_warps": 4,
      "num_stages": 1,
      "align_block_size": 16
    },
    {
      "block_size_m": 16,
      "block_size_n": 32,
      "block_size_k": 32,
      "group_size_m": 8,
      "num_warps": 4,
      "num_stages": 1,
      "align_block_size": 32
    },
    {
      "block_size_m": 16,
      "block_size_n": 32,
      "block_size_k": 32,
      "group_size_m": 8,
      "num_warps": 4,
      "num_stages": 1,
      "align_block_size": 64
    },
    {
      "block_size_m": 16,
      "block_size_n": 32,
      "block_size_k": 32,
      "group_size_m": 8,
      "num_warps": 4,
      "num_stages": 2,
      "align_block_size": 8
    },
    {
      "block_size_m": 16,
      "block_size_n": 32,
      "block_size_k": 32,
      "group_size_m": 8,
      "num_warps": 4,
      "num_stages": 2,
      "align_block_size": 16
    },
    {
      "block_size_m": 16,
      "block_size_n": 32,
      "block_size_k": 32,
      "group_size_m": 8,
      "num_warps": 4,
      "num_stages": 2,
      "align_block_size": 32
    },
    {
      "block_size_m": 16,
      "block_size_n": 32,
      "block_size_k": 32,
      "group_size_m": 8,
      "num_warps": 4,
      "num_stages": 2,
      "align_block_size": 64
    },
    {
      "block_size_m": 16,
      "block_size_n": 32,
      "block_size_k": 32,
      "group_size_m": 8,
      "num_warps": 4,
      "num_stages": 3,
      "align_block_size": 8
    },
    {
      "block_size_m": 16,
      "block_size_n": 32,
      "block_size_k": 32,
      "group_size_m": 8,
      "num_warps": 4,
      "num_stages": 3,
      "align_block_size": 16
    },
    {
      "block_size_m": 16,
      "block_size_n": 32,
      "block_size_k": 32,
      "group_size_m": 8,
      "num_warps": 4,
      "num_stages": 3,
      "align_block_size": 32
    },
    {
      "block_size_m": 16,
      "block_size_n": 32,
      "block_size_k": 32,
      "group_size_m": 8,
      "num_warps": 4,
      "num_stages": 3,
      "align_block_size": 64
    },
    {
      "block_size_m": 16,
      "block_size_n": 32,
      "block_size_k": 32,
      "group_size_m": 8,
      "num_warps": 8,
      "num_stages": 1,
      "align_block_size": 8
    },
    {
      "block_size_m": 16,
      "block_size_n": 32,
      "block_size_k": 32,
      "group_size_m": 8,
      "num_warps": 8,
      "num_stages": 1,
      "align_block_size": 16
    },
    {
      "block_size_m": 16,
      "block_size_n": 32,
      "block_size_k": 32,
      "group_size_m": 8,
      "num_warps": 8,
      "num_stages": 1,
      "align_block_size": 32
    },
    {
      "block_size_m": 16,
      "block_size_n": 32,
      "block_size_k": 32,
      "group_size_m": 8,
      "num_warps": 8,
      "num_stages": 1,
      "align_block_size": 64
    },
    {
      "block_size_m": 16,
      "block_size_n": 32,
      "block_size_k": 32,
      "group_size_m": 8,
      "num_warps": 8,
      "num_stages": 2,
      "align_block_size": 8
    },
    {
      "block_size_m": 16,
      "block_size_n": 32,
      "block_size_k": 32,
      "group_size_m": 8,
      "num_warps": 8,
      "num_stages": 2,
      "align_block_size": 16
    },
    {
      "block_size_m": 16,
      "block_size_n": 32,
      "block_size_k": 32,
      "group_size_m": 8,
      "num_warps": 8,
      "num_stages": 2,
      "align_block_size": 32
    },
    {
      "block_size_m": 16,
      "block_size_n": 32,
      "block_size_k": 32,
      "group_size_m": 8,
      "num_warps": 8,
      "num_stages": 2,
      "align_block_size": 64
    },
    {
      "block_size_m": 16,
      "block_size_n": 32,
      "block_size_k": 32,
      "group_size_m": 8,
      "num_warps": 8,
      "num_stages": 3,
      "align_block_size": 8
    },
    {
      "block_size_m": 16,
      "block_size_n": 32,
      "block_size_k": 32,
      "group_size_m": 8,
      "num_warps": 8,
      "num_stages": 3,
      "align_block_size": 16
    },
    {
      "block_size_m": 16,
      "block_size_n": 32,
      "block_size_k": 32,
      "group_size_m": 8,
      "num_warps": 8,
      "num_stages": 3,
      "align_block_size": 32
    },
    {
      "block_size_m": 16,
      "block_size_n": 32,
      "block_size_k": 32,
      "group_size_m": 8,
      "num_warps": 8,
      "num_stages": 3,
      "align_block_size": 64
    },
    {
      "block_size_m": 16,
      "block_size_n": 32,
      "block_size_k": 32,
      "group_size_m": 16,
      "num_warps": 2,
      "num_stages": 1,
      "align_block_size": 8
    },
    {
      "block_size_m": 16,
      "block_size_n": 32,
      "block_size_k": 32,
      "group_size_m": 16,
      "num_warps": 2,
      "num_stages": 1,
      "align_block_size": 16
    },
    {
      "block_size_m": 16,
      "block_size_n": 32,
      "block_size_k": 32,
      "group_size_m": 16,
      "num_warps": 2,
      "num_stages": 1,
      "align_block_size": 32
    },
    {
      "block_size_m": 16,
      "block_size_n": 32,
      "block_size_k": 32,
      "group_size_m": 16,
      "num_warps": 2,
      "num_stages": 1,
      "align_block_size": 64
    },
    {
      "block_size_m": 16,
      "block_size_n": 32,
      "block_size_k": 32,
      "group_size_m": 16,
      "num_warps": 2,
      "num_stages": 2,
      "align_block_size": 8
    },
    {
      "block_size_m": 16,
      "block_size_n": 32,
      "block_size_k": 32,
      "group_size_m": 16,
      "num_warps": 2,
      "num_stages": 2,
      "align_block_size": 16
    },
    {
      "block_size_m": 16,
      "block_size_n": 32,
      "block_size_k": 32,
      "group_size_m": 16,
      "num_warps": 2,
      "num_stages": 2,
      "align_block_size": 32
    },
    {
      "block_size_m": 16,
      "block_size_n": 32,
      "block_size_k": 32,
      "group_size_m": 16,
      "num_warps": 2,
      "num_stages": 2,
      "align_block_size": 64
    },
    {
      "block_size_m": 16,
      "block_size_n": 32,
      "block_size_k": 32,
      "group_size_m": 16,
      "num_warps": 2,
      "num_stages": 3,
      "align_block_size": 8
    },
    {
      "block_size_m": 16,
      "block_size_n": 32,
      "block_size_k": 32,
      "group_size_m": 16,
      "num_warps": 2,
      "num_stages": 3,
      "align_block_size": 16
    },
    {
      "block_size_m": 16,
      "block_size_n": 32,
      "block_size_k": 32,
      "group_size_m": 16,
      "num_warps": 2,
      "num_stages": 3,
      "align_block_size": 32
    },
    {
      "block_size_m": 16,
      "block_size_n": 32,
      "block_size_k": 32,
      "group_size_m": 16,
      "num_warps": 2,
      "num_stages": 3,
      "align_block_size": 64
    },
    {
      "block_size_m": 16,
      "block_size_n": 32,
      "block_size_k": 32,
      "group_size_m": 16,
      "num_warps": 4,
      "num_stages": 1,
      "align_block_size": 8
    },
    {
      "block_size_m": 16,
      "block_size_n": 32,
      "block_size_k": 32,
      "group_size_m": 16,
      "num_warps": 4,
      "num_stages": 1,
      "align_block_size": 16
    },
    {
      "block_size_m": 16,
      "block_size_n": 32,
      "block_size_k": 32,
      "group_size_m": 16,
      "num_warps": 4,
      "num_stages": 1,
      "align_block_size": 32
    },
    {
      "block_size_m": 16,
      "block_size_n": 32,
      "block_size_k": 32,
      "group_size_m": 16,
      "num_warps": 4,
      "num_stages": 1,
      "align_block_size": 64
    },
    {
      "block_size_m": 16,
      "block_size_n": 32,
      "block_size_k": 32,
      "group_size_m": 16,
      "num_warps": 4,
      "num_stages": 2,
      "align_block_size": 8
    },
    {
      "block_size_m": 16,
      "block_size_n": 32,
      "block_size_k": 32,
      "group_size_m": 16,
      "num_warps": 4,
      "num_stages": 2,
      "align_block_size": 16
    },
    {
      "block_size_m": 16,
      "block_size_n": 32,
      "block_size_k": 32,
      "group_size_m": 16,
      "num_warps": 4,
      "num_stages": 2,
      "align_block_size": 32
    },
    {
      "block_size_m": 16,
      "block_size_n": 32,
      "block_size_k": 32,
      "group_size_m": 16,
      "num_warps": 4,
      "num_stages": 2,
      "align_block_size": 64
    },
    {
      "block_size_m": 16,
      "block_size_n": 32,
      "block_size_k": 32,
      "group_size_m": 16,
      "num_warps": 4,
      "num_stages": 3,
      "align_block_size": 8
    },
    {
      "block_size_m": 16,
      "block_size_n": 32,
      "block_size_k": 32,
      "group_size_m": 16,
      "num_warps": 4,
      "num_stages": 3,
      "align_block_size": 16
    },
    {
      "block_size_m": 16,
      "block_size_n": 32,
      "block_size_k": 32,
      "group_size_m": 16,
      "num_warps": 4,
      "num_stages": 3,
      "align_block_size": 32
    },
    {
      "block_size_m": 16,
      "block_size_n": 32,
      "block_size_k": 32,
      "group_size_m": 16,
      "num_warps": 4,
      "num_stages": 3,
      "align_block_size": 64
    },
    {
      "block_size_m": 16,
      "block_size_n": 32,
      "block_size_k": 32,
      "group_size_m": 16,
      "num_warps": 8,
      "num_stages": 1,
      "align_block_size": 8
    },
    {
      "block_size_m": 16,
      "block_size_n": 32,
      "block_size_k": 32,
      "group_size_m": 16,
      "num_warps": 8,
      "num_stages": 1,
      "align_block_size": 16
    },
    {
      "block_size_m": 16,
      "block_size_n": 32,
      "block_size_k": 32,
      "group_size_m": 16,
      "num_warps": 8,
      "num_stages": 1,
      "align_block_size": 32
    },
    {
      "block_size_m": 16,
      "block_size_n": 32,
      "block_size_k": 32,
      "group_size_m": 16,
      "num_warps": 8,
      "num_stages": 1,
      "align_block_size": 64
    },
    {
      "block_size_m": 16,
      "block_size_n": 32,
      "block_size_k": 32,
      "group_size_m": 16,
      "num_warps": 8,
      "num_stages": 2,
      "align_block_size": 8
    },
    {
      "block_size_m": 16,
      "block_size_n": 32,
      "block_size_k": 32,
      "group_size_m": 16,
      "num_warps": 8,
      "num_stages": 2,
      "align_block_size": 16
    },
    {
      "block_size_m": 16,
      "block_size_n": 32,
      "block_size_k": 32,
      "group_size_m": 16,
      "num_warps": 8,
      "num_stages": 2,
      "align_block_size": 32
    },
    {
      "block_size_m": 16,
      "block_size_n": 32,
      "block_size_k": 32,
      "group_size_m": 16,
      "num_warps": 8,
      "num_stages": 2,
      "align_block_size": 64
    },
    {
      "block_size_m": 16,
      "block_size_n": 32,
      "block_size_k": 32,
      "group_size_m": 16,
      "num_warps": 8,
      "num_stages": 3,
      "align_block_size": 8
    },
    {
      "block_size_m": 16,
      "block_size_n": 32,
      "block_size_k": 32,
      "group_size_m": 16,
      "num_warps": 8,
      "num_stages": 3,
      "align_block_size": 16
    },
    {
      "block_size_m": 16,
      "block_size_n": 32,
      "block_size_k": 32,
      "group_size_m": 16,
      "num_warps": 8,
      "num_stages": 3,
      "align_block_size": 32
    },
    {
      "block_size_m": 16,
      "block_size_n": 32,
      "block_size_k": 32,
      "group_size_m": 16,
      "num_warps": 8,
      "num_stages": 3,
      "align_block_size": 64
    },
    {
      "block_size_m": 16,
      "block_size_n": 32,
      "block_size_k": 64,
      "group_size_m": 1,
      "num_warps": 2,
      "num_stages": 1,
      "align_block_size": 8
    },
    {
      "block_size_m": 16,
      "block_size_n": 32,
      "block_size_k": 64,
      "group_size_m": 1,
      "num_warps": 2,
      "num_stages": 1,
      "align_block_size": 16
    },
    {
      "block_size_m": 16,
      "block_size_n": 32,
      "block_size_k": 64,
      "group_size_m": 1,
      "num_warps": 2,
      "num_stages": 1,
      "align_block_size": 32
    },
    {
      "block_size_m": 16,
      "block_size_n": 32,
      "block_size_k": 64,
      "group_size_m": 1,
      "num_warps": 2,
      "num_stages": 1,
      "align_block_size": 64
    },
    {
      "block_size_m": 16,
      "block_size_n": 32,
      "block_size_k": 64,
      "group_size_m": 1,
      "num_warps": 2,
      "num_stages": 2,
      "align_block_size": 8
    },
    {
      "block_size_m": 16,
      "block_size_n": 32,
      "block_size_k": 64,
      "group_size_m": 1,
      "num_warps": 2,
      "num_stages": 2,
      "align_block_size": 16
    },
    {
      "block_size_m": 16,
      "block_size_n": 32,
      "block_size_k": 64,
      "group_size_m": 1,
      "num_warps": 2,
      "num_stages": 2,
      "align_block_size": 32
    },
    {
      "block_size_m": 16,
      "block_size_n": 32,
      "block_size_k": 64,
      "group_size_m": 1,
      "num_warps": 2,
      "num_stages": 2,
      "align_block_size": 64
    },
    {
      "block_size_m": 16,
      "block_size_n": 32,
      "block_size_k": 64,
      "group_size_m": 1,
      "num_warps": 2,
      "num_stages": 3,
      "align_block_size": 8
    },
    {
      "block_size_m": 16,
      "block_size_n": 32,
      "block_size_k": 64,
      "group_size_m": 1,
      "num_warps": 2,
      "num_stages": 3,
      "align_block_size": 16
    },
    {
      "block_size_m": 16,
      "block_size_n": 32,
      "block_size_k": 64,
      "group_size_m": 1,
      "num_warps": 2,
      "num_stages": 3,
      "align_block_size": 32
    },
    {
      "block_size_m": 16,
      "block_size_n": 32,
      "block_size_k": 64,
      "group_size_m": 1,
      "num_warps": 2,
      "num_stages": 3,
      "align_block_size": 64
    },
    {
      "block_size_m": 16,
      "block_size_n": 32,
      "block_size_k": 64,
      "group_size_m": 1,
      "num_warps": 4,
      "num_stages": 1,
      "align_block_size": 8
    },
    {
      "block_size_m": 16,
      "block_size_n": 32,
      "block_size_k": 64,
      "group_size_m": 1,
      "num_warps": 4,
      "num_stages": 1,
      "align_block_size": 16
    },
    {
      "block_size_m": 16,
      "block_size_n": 32,
      "block_size_k": 64,
      "group_size_m": 1,
      "num_warps": 4,
      "num_stages": 1,
      "align_block_size": 32
    },
    {
      "block_size_m": 16,
      "block_size_n": 32,
      "block_size_k": 64,
      "group_size_m": 1,
      "num_warps": 4,
      "num_stages": 1,
      "align_block_size": 64
    },
    {
      "block_size_m": 16,
      "block_size_n": 32,
      "block_size_k": 64,
      "group_size_m": 1,
      "num_warps": 4,
      "num_stages": 2,
      "align_block_size": 8
    },
    {
      "block_size_m": 16,
      "block_size_n": 32,
      "block_size_k": 64,
      "group_size_m": 1,
      "num_warps": 4,
      "num_stages": 2,
      "align_block_size": 16
    },
    {
      "block_size_m": 16,
      "block_size_n": 32,
      "block_size_k": 64,
      "group_size_m": 1,
      "num_warps": 4,
      "num_stages": 2,
      "align_block_size": 32
    },
    {
      "block_size_m": 16,
      "block_size_n": 32,
      "block_size_k": 64,
      "group_size_m": 1,
      "num_warps": 4,
      "num_stages": 2,
      "align_block_size": 64
    },
    {
      "block_size_m": 16,
      "block_size_n": 32,
      "block_size_k": 64,
      "group_size_m": 1,
      "num_warps": 4,
      "num_stages": 3,
      "align_block_size": 8
    },
    {
      "block_size_m": 16,
      "block_size_n": 32,
      "block_size_k": 64,
      "group_size_m": 1,
      "num_warps": 4,
      "num_stages": 3,
      "align_block_size": 16
    },
    {
      "block_size_m": 16,
      "block_size_n": 32,
      "block_size_k": 64,
      "group_size_m": 1,
      "num_warps": 4,
      "num_stages": 3,
      "align_block_size": 32
    },
    {
      "block_size_m": 16,
      "block_size_n": 32,
      "block_size_k": 64,
      "group_size_m": 1,
      "num_warps": 4,
      "num_stages": 3,
      "align_block_size": 64
    },
    {
      "block_size_m": 16,
      "block_size_n": 32,
      "block_size_k": 64,
      "group_size_m": 1,
      "num_warps": 8,
      "num_stages": 1,
      "align_block_size": 8
    },
    {
      "block_size_m": 16,
      "block_size_n": 32,
      "block_size_k": 64,
      "group_size_m": 1,
      "num_warps": 8,
      "num_stages": 1,
      "align_block_size": 16
    },
    {
      "block_size_m": 16,
      "block_size_n": 32,
      "block_size_k": 64,
      "group_size_m": 1,
      "num_warps": 8,
      "num_stages": 1,
      "align_block_size": 32
    },
    {
      "block_size_m": 16,
      "block_size_n": 32,
      "block_size_k": 64,
      "group_size_m": 1,
      "num_warps": 8,
      "num_stages": 1,
      "align_block_size": 64
    },
    {
      "block_size_m": 16,
      "block_size_n": 32,
      "block_size_k": 64,
      "group_size_m": 1,
      "num_warps": 8,
      "num_stages": 2,
      "align_block_size": 8
    },
    {
      "block_size_m": 16,
      "block_size_n": 32,
      "block_size_k": 64,
      "group_size_m": 1,
      "num_warps": 8,
      "num_stages": 2,
      "align_block_size": 16
    },
    {
      "block_size_m": 16,
      "block_size_n": 32,
      "block_size_k": 64,
      "group_size_m": 1,
      "num_warps": 8,
      "num_stages": 2,
      "align_block_size": 32
    },
    {
      "block_size_m": 16,
      "block_size_n": 32,
      "block_size_k": 64,
      "group_size_m": 1,
      "num_warps": 8,
      "num_stages": 2,
      "align_block_size": 64
    },
    {
      "block_size_m": 16,
      "block_size_n": 32,
      "block_size_k": 64,
      "group_size_m": 1,
      "num_warps": 8,
      "num_stages": 3,
      "align_block_size": 8
    },
    {
      "block_size_m": 16,
      "block_size_n": 32,
      "block_size_k": 64,
      "group_size_m": 1,
      "num_warps": 8,
      "num_stages": 3,
      "align_block_size": 16
    },
    {
      "block_size_m": 16,
      "block_size_n": 32,
      "block_size_k": 64,
      "group_size_m": 1,
      "num_warps": 8,
      "num_stages": 3,
      "align_block_size": 32
    },
    {
      "block_size_m": 16,
      "block_size_n": 32,
      "block_size_k": 64,
      "group_size_m": 1,
      "num_warps": 8,
      "num_stages": 3,
      "align_block_size": 64
    },
    {
      "block_size_m": 16,
      "block_size_n": 32,
      "block_size_k": 64,
      "group_size_m": 4,
      "num_warps": 2,
      "num_stages": 1,
      "align_block_size": 8
    },
    {
      "block_size_m": 16,
      "block_size_n": 32,
      "block_size_k": 64,
      "group_size_m": 4,
      "num_warps": 2,
      "num_stages": 1,
      "align_block_size": 16
    },
    {
      "block_size_m": 16,
      "block_size_n": 32,
      "block_size_k": 64,
      "group_size_m": 4,
      "num_warps": 2,
      "num_stages": 1,
      "align_block_size": 32
    },
    {
      "block_size_m": 16,
      "block_size_n": 32,
      "block_size_k": 64,
      "group_size_m": 4,
      "num_warps": 2,
      "num_stages": 1,
      "align_block_size": 64
    },
    {
      "block_size_m": 16,
      "block_size_n": 32,
      "block_size_k": 64,
      "group_size_m": 4,
      "num_warps": 2,
      "num_stages": 2,
      "align_block_size": 8
    },
    {
      "block_size_m": 16,
      "block_size_n": 32,
      "block_size_k": 64,
      "group_size_m": 4,
      "num_warps": 2,
      "num_stages": 2,
      "align_block_size": 16
    },
    {
      "block_size_m": 16,
      "block_size_n": 32,
      "block_size_k": 64,
      "group_size_m": 4,
      "num_warps": 2,
      "num_stages": 2,
      "align_block_size": 32
    },
    {
      "block_size_m": 16,
      "block_size_n": 32,
      "block_size_k": 64,
      "group_size_m": 4,
      "num_warps": 2,
      "num_stages": 2,
      "align_block_size": 64
    },
    {
      "block_size_m": 16,
      "block_size_n": 32,
      "block_size_k": 64,
      "group_size_m": 4,
      "num_warps": 2,
      "num_stages": 3,
      "align_block_size": 8
    },
    {
      "block_size_m": 16,
      "block_size_n": 32,
      "block_size_k": 64,
      "group_size_m": 4,
      "num_warps": 2,
      "num_stages": 3,
      "align_block_size": 16
    },
    {
      "block_size_m": 16,
      "block_size_n": 32,
      "block_size_k": 64,
      "group_size_m": 4,
      "num_warps": 2,
      "num_stages": 3,
      "align_block_size": 32
    },
    {
      "block_size_m": 16,
      "block_size_n": 32,
      "block_size_k": 64,
      "group_size_m": 4,
      "num_warps": 2,
      "num_stages": 3,
      "align_block_size": 64
    },
    {
      "block_size_m": 16,
      "block_size_n": 32,
      "block_size_k": 64,
      "group_size_m": 4,
      "num_warps": 4,
      "num_stages": 1,
      "align_block_size": 8
    },
    {
      "block_size_m": 16,
      "block_size_n": 32,
      "block_size_k": 64,
      "group_size_m": 4,
      "num_warps": 4,
      "num_stages": 1,
      "align_block_size": 16
    },
    {
      "block_size_m": 16,
      "block_size_n": 32,
      "block_size_k": 64,
      "group_size_m": 4,
      "num_warps": 4,
      "num_stages": 1,
      "align_block_size": 32
    },
    {
      "block_size_m": 16,
      "block_size_n": 32,
      "block_size_k": 64,
      "group_size_m": 4,
      "num_warps": 4,
      "num_stages": 1,
      "align_block_size": 64
    },
    {
      "block_size_m": 16,
      "block_size_n": 32,
      "block_size_k": 64,
      "group_size_m": 4,
      "num_warps": 4,
      "num_stages": 2,
      "align_block_size": 8
    },
    {
      "block_size_m": 16,
      "block_size_n": 32,
      "block_size_k": 64,
      "group_size_m": 4,
      "num_warps": 4,
      "num_stages": 2,
      "align_block_size": 16
    },
    {
      "block_size_m": 16,
      "block_size_n": 32,
      "block_size_k": 64,
      "group_size_m": 4,
      "num_warps": 4,
      "num_stages": 2,
      "align_block_size": 32
    },
    {
      "block_size_m": 16,
      "block_size_n": 32,
      "block_size_k": 64,
      "group_size_m": 4,
      "num_warps": 4,
      "num_stages": 2,
      "align_block_size": 64
    },
    {
      "block_size_m": 16,
      "block_size_n": 32,
      "block_size_k": 64,
      "group_size_m": 4,
      "num_warps": 4,
      "num_stages": 3,
      "align_block_size": 8
    },
    {
      "block_size_m": 16,
      "block_size_n": 32,
      "block_size_k": 64,
      "group_size_m": 4,
      "num_warps": 4,
      "num_stages": 3,
      "align_block_size": 16
    },
    {
      "block_size_m": 16,
      "block_size_n": 32,
      "block_size_k": 64,
      "group_size_m": 4,
      "num_warps": 4,
      "num_stages": 3,
      "align_block_size": 32
    },
    {
      "block_size_m": 16,
      "block_size_n": 32,
      "block_size_k": 64,
      "group_size_m": 4,
      "num_warps": 4,
      "num_stages": 3,
      "align_block_size": 64
    },
    {
      "block_size_m": 16,
      "block_size_n": 32,
      "block_size_k": 64,
      "group_size_m": 4,
      "num_warps": 8,
      "num_stages": 1,
      "align_block_size": 8
    },
    {
      "block_size_m": 16,
      "block_size_n": 32,
      "block_size_k": 64,
      "group_size_m": 4,
      "num_warps": 8,
      "num_stages": 1,
      "align_block_size": 16
    },
    {
      "block_size_m": 16,
      "block_size_n": 32,
      "block_size_k": 64,
      "group_size_m": 4,
      "num_warps": 8,
      "num_stages": 1,
      "align_block_size": 32
    },
    {
      "block_size_m": 16,
      "block_size_n": 32,
      "block_size_k": 64,
      "group_size_m": 4,
      "num_warps": 8,
      "num_stages": 1,
      "align_block_size": 64
    },
    {
      "block_size_m": 16,
      "block_size_n": 32,
      "block_size_k": 64,
      "group_size_m": 4,
      "num_warps": 8,
      "num_stages": 2,
      "align_block_size": 8
    },
    {
      "block_size_m": 16,
      "block_size_n": 32,
      "block_size_k": 64,
      "group_size_m": 4,
      "num_warps": 8,
      "num_stages": 2,
      "align_block_size": 16
    },
    {
      "block_size_m": 16,
      "block_size_n": 32,
      "block_size_k": 64,
      "group_size_m": 4,
      "num_warps": 8,
      "num_stages": 2,
      "align_block_size": 32
    },
    {
      "block_size_m": 16,
      "block_size_n": 32,
      "block_size_k": 64,
      "group_size_m": 4,
      "num_warps": 8,
      "num_stages": 2,
      "align_block_size": 64
    },
    {
      "block_size_m": 16,
      "block_size_n": 32,
      "block_size_k": 64,
      "group_size_m": 4,
      "num_warps": 8,
      "num_stages": 3,
      "align_block_size": 8
    },
    {
      "block_size_m": 16,
      "block_size_n": 32,
      "block_size_k": 64,
      "group_size_m": 4,
      "num_warps": 8,
      "num_stages": 3,
      "align_block_size": 16
    },
    {
      "block_size_m": 16,
      "block_size_n": 32,
      "block_size_k": 64,
      "group_size_m": 4,
      "num_warps": 8,
      "num_stages": 3,
      "align_block_size": 32
    },
    {
      "block_size_m": 16,
      "block_size_n": 32,
      "block_size_k": 64,
      "group_size_m": 4,
      "num_warps": 8,
      "num_stages": 3,
      "align_block_size": 64
    },
    {
      "block_size_m": 16,
      "block_size_n": 32,
      "block_size_k": 64,
      "group_size_m": 8,
      "num_warps": 2,
      "num_stages": 1,
      "align_block_size": 8
    },
    {
      "block_size_m": 16,
      "block_size_n": 32,
      "block_size_k": 64,
      "group_size_m": 8,
      "num_warps": 2,
      "num_stages": 1,
      "align_block_size": 16
    },
    {
      "block_size_m": 16,
      "block_size_n": 32,
      "block_size_k": 64,
      "group_size_m": 8,
      "num_warps": 2,
      "num_stages": 1,
      "align_block_size": 32
    },
    {
      "block_size_m": 16,
      "block_size_n": 32,
      "block_size_k": 64,
      "group_size_m": 8,
      "num_warps": 2,
      "num_stages": 1,
      "align_block_size": 64
    },
    {
      "block_size_m": 16,
      "block_size_n": 32,
      "block_size_k": 64,
      "group_size_m": 8,
      "num_warps": 2,
      "num_stages": 2,
      "align_block_size": 8
    },
    {
      "block_size_m": 16,
      "block_size_n": 32,
      "block_size_k": 64,
      "group_size_m": 8,
      "num_warps": 2,
      "num_stages": 2,
      "align_block_size": 16
    },
    {
      "block_size_m": 16,
      "block_size_n": 32,
      "block_size_k": 64,
      "group_size_m": 8,
      "num_warps": 2,
      "num_stages": 2,
      "align_block_size": 32
    },
    {
      "block_size_m": 16,
      "block_size_n": 32,
      "block_size_k": 64,
      "group_size_m": 8,
      "num_warps": 2,
      "num_stages": 2,
      "align_block_size": 64
    },
    {
      "block_size_m": 16,
      "block_size_n": 32,
      "block_size_k": 64,
      "group_size_m": 8,
      "num_warps": 2,
      "num_stages": 3,
      "align_block_size": 8
    },
    {
      "block_size_m": 16,
      "block_size_n": 32,
      "block_size_k": 64,
      "group_size_m": 8,
      "num_warps": 2,
      "num_stages": 3,
      "align_block_size": 16
    },
    {
      "block_size_m": 16,
      "block_size_n": 32,
      "block_size_k": 64,
      "group_size_m": 8,
      "num_warps": 2,
      "num_stages": 3,
      "align_block_size": 32
    },
    {
      "block_size_m": 16,
      "block_size_n": 32,
      "block_size_k": 64,
      "group_size_m": 8,
      "num_warps": 2,
      "num_stages": 3,
      "align_block_size": 64
    },
    {
      "block_size_m": 16,
      "block_size_n": 32,
      "block_size_k": 64,
      "group_size_m": 8,
      "num_warps": 4,
      "num_stages": 1,
      "align_block_size": 8
    },
    {
      "block_size_m": 16,
      "block_size_n": 32,
      "block_size_k": 64,
      "group_size_m": 8,
      "num_warps": 4,
      "num_stages": 1,
      "align_block_size": 16
    },
    {
      "block_size_m": 16,
      "block_size_n": 32,
      "block_size_k": 64,
      "group_size_m": 8,
      "num_warps": 4,
      "num_stages": 1,
      "align_block_size": 32
    },
    {
      "block_size_m": 16,
      "block_size_n": 32,
      "block_size_k": 64,
      "group_size_m": 8,
      "num_warps": 4,
      "num_stages": 1,
      "align_block_size": 64
    },
    {
      "block_size_m": 16,
      "block_size_n": 32,
      "block_size_k": 64,
      "group_size_m": 8,
      "num_warps": 4,
      "num_stages": 2,
      "align_block_size": 8
    },
    {
      "block_size_m": 16,
      "block_size_n": 32,
      "block_size_k": 64,
      "group_size_m": 8,
      "num_warps": 4,
      "num_stages": 2,
      "align_block_size": 16
    },
    {
      "block_size_m": 16,
      "block_size_n": 32,
      "block_size_k": 64,
      "group_size_m": 8,
      "num_warps": 4,
      "num_stages": 2,
      "align_block_size": 32
    },
    {
      "block_size_m": 16,
      "block_size_n": 32,
      "block_size_k": 64,
      "group_size_m": 8,
      "num_warps": 4,
      "num_stages": 2,
      "align_block_size": 64
    },
    {
      "block_size_m": 16,
      "block_size_n": 32,
      "block_size_k": 64,
      "group_size_m": 8,
      "num_warps": 4,
      "num_stages": 3,
      "align_block_size": 8
    },
    {
      "block_size_m": 16,
      "block_size_n": 32,
      "block_size_k": 64,
      "group_size_m": 8,
      "num_warps": 4,
      "num_stages": 3,
      "align_block_size": 16
    },
    {
      "block_size_m": 16,
      "block_size_n": 32,
      "block_size_k": 64,
      "group_size_m": 8,
      "num_warps": 4,
      "num_stages": 3,
      "align_block_size": 32
    },
    {
      "block_size_m": 16,
      "block_size_n": 32,
      "block_size_k": 64,
      "group_size_m": 8,
      "num_warps": 4,
      "num_stages": 3,
      "align_block_size": 64
    },
    {
      "block_size_m": 16,
      "block_size_n": 32,
      "block_size_k": 64,
      "group_size_m": 8,
      "num_warps": 8,
      "num_stages": 1,
      "align_block_size": 8
    },
    {
      "block_size_m": 16,
      "block_size_n": 32,
      "block_size_k": 64,
      "group_size_m": 8,
      "num_warps": 8,
      "num_stages": 1,
      "align_block_size": 16
    },
    {
      "block_size_m": 16,
      "block_size_n": 32,
      "block_size_k": 64,
      "group_size_m": 8,
      "num_warps": 8,
      "num_stages": 1,
      "align_block_size": 32
    },
    {
      "block_size_m": 16,
      "block_size_n": 32,
      "block_size_k": 64,
      "group_size_m": 8,
      "num_warps": 8,
      "num_stages": 1,
      "align_block_size": 64
    },
    {
      "block_size_m": 16,
      "block_size_n": 32,
      "block_size_k": 64,
      "group_size_m": 8,
      "num_warps": 8,
      "num_stages": 2,
      "align_block_size": 8
    },
    {
      "block_size_m": 16,
      "block_size_n": 32,
      "block_size_k": 64,
      "group_size_m": 8,
      "num_warps": 8,
      "num_stages": 2,
      "align_block_size": 16
    },
    {
      "block_size_m": 16,
      "block_size_n": 32,
      "block_size_k": 64,
      "group_size_m": 8,
      "num_warps": 8,
      "num_stages": 2,
      "align_block_size": 32
    },
    {
      "block_size_m": 16,
      "block_size_n": 32,
      "block_size_k": 64,
      "group_size_m": 8,
      "num_warps": 8,
      "num_stages": 2,
      "align_block_size": 64
    },
    {
      "block_size_m": 16,
      "block_size_n": 32,
      "block_size_k": 64,
      "group_size_m": 8,
      "num_warps": 8,
      "num_stages": 3,
      "align_block_size": 8
    },
    {
      "block_size_m": 16,
      "block_size_n": 32,
      "block_size_k": 64,
      "group_size_m": 8,
      "num_warps": 8,
      "num_stages": 3,
      "align_block_size": 16
    },
    {
      "block_size_m": 16,
      "block_size_n": 32,
      "block_size_k": 64,
      "group_size_m": 8,
      "num_warps": 8,
      "num_stages": 3,
      "align_block_size": 32
    },
    {
      "block_size_m": 16,
      "block_size_n": 32,
      "block_size_k": 64,
      "group_size_m": 8,
      "num_warps": 8,
      "num_stages": 3,
      "align_block_size": 64
    },
    {
      "block_size_m": 16,
      "block_size_n": 32,
      "block_size_k": 64,
      "group_size_m": 16,
      "num_warps": 2,
      "num_stages": 1,
      "align_block_size": 8
    },
    {
      "block_size_m": 16,
      "block_size_n": 32,
      "block_size_k": 64,
      "group_size_m": 16,
      "num_warps": 2,
      "num_stages": 1,
      "align_block_size": 16
    },
    {
      "block_size_m": 16,
      "block_size_n": 32,
      "block_size_k": 64,
      "group_size_m": 16,
      "num_warps": 2,
      "num_stages": 1,
      "align_block_size": 32
    },
    {
      "block_size_m": 16,
      "block_size_n": 32,
      "block_size_k": 64,
      "group_size_m": 16,
      "num_warps": 2,
      "num_stages": 1,
      "align_block_size": 64
    },
    {
      "block_size_m": 16,
      "block_size_n": 32,
      "block_size_k": 64,
      "group_size_m": 16,
      "num_warps": 2,
      "num_stages": 2,
      "align_block_size": 8
    },
    {
      "block_size_m": 16,
      "block_size_n": 32,
      "block_size_k": 64,
      "group_size_m": 16,
      "num_warps": 2,
      "num_stages": 2,
      "align_block_size": 16
    },
    {
      "block_size_m": 16,
      "block_size_n": 32,
      "block_size_k": 64,
      "group_size_m": 16,
      "num_warps": 2,
      "num_stages": 2,
      "align_block_size": 32
    },
    {
      "block_size_m": 16,
      "block_size_n": 32,
      "block_size_k": 64,
      "group_size_m": 16,
      "num_warps": 2,
      "num_stages": 2,
      "align_block_size": 64
    },
    {
      "block_size_m": 16,
      "block_size_n": 32,
      "block_size_k": 64,
      "group_size_m": 16,
      "num_warps": 2,
      "num_stages": 3,
      "align_block_size": 8
    },
    {
      "block_size_m": 16,
      "block_size_n": 32,
      "block_size_k": 64,
      "group_size_m": 16,
      "num_warps": 2,
      "num_stages": 3,
      "align_block_size": 16
    },
    {
      "block_size_m": 16,
      "block_size_n": 32,
      "block_size_k": 64,
      "group_size_m": 16,
      "num_warps": 2,
      "num_stages": 3,
      "align_block_size": 32
    },
    {
      "block_size_m": 16,
      "block_size_n": 32,
      "block_size_k": 64,
      "group_size_m": 16,
      "num_warps": 2,
      "num_stages": 3,
      "align_block_size": 64
    },
    {
      "block_size_m": 16,
      "block_size_n": 32,
      "block_size_k": 64,
      "group_size_m": 16,
      "num_warps": 4,
      "num_stages": 1,
      "align_block_size": 8
    },
    {
      "block_size_m": 16,
      "block_size_n": 32,
      "block_size_k": 64,
      "group_size_m": 16,
      "num_warps": 4,
      "num_stages": 1,
      "align_block_size": 16
    },
    {
      "block_size_m": 16,
      "block_size_n": 32,
      "block_size_k": 64,
      "group_size_m": 16,
      "num_warps": 4,
      "num_stages": 1,
      "align_block_size": 32
    },
    {
      "block_size_m": 16,
      "block_size_n": 32,
      "block_size_k": 64,
      "group_size_m": 16,
      "num_warps": 4,
      "num_stages": 1,
      "align_block_size": 64
    },
    {
      "block_size_m": 16,
      "block_size_n": 32,
      "block_size_k": 64,
      "group_size_m": 16,
      "num_warps": 4,
      "num_stages": 2,
      "align_block_size": 8
    },
    {
      "block_size_m": 16,
      "block_size_n": 32,
      "block_size_k": 64,
      "group_size_m": 16,
      "num_warps": 4,
      "num_stages": 2,
      "align_block_size": 16
    },
    {
      "block_size_m": 16,
      "block_size_n": 32,
      "block_size_k": 64,
      "group_size_m": 16,
      "num_warps": 4,
      "num_stages": 2,
      "align_block_size": 32
    },
    {
      "block_size_m": 16,
      "block_size_n": 32,
      "block_size_k": 64,
      "group_size_m": 16,
      "num_warps": 4,
      "num_stages": 2,
      "align_block_size": 64
    },
    {
      "block_size_m": 16,
      "block_size_n": 32,
      "block_size_k": 64,
      "group_size_m": 16,
      "num_warps": 4,
      "num_stages": 3,
      "align_block_size": 8
    },
    {
      "block_size_m": 16,
      "block_size_n": 32,
      "block_size_k": 64,
      "group_size_m": 16,
      "num_warps": 4,
      "num_stages": 3,
      "align_block_size": 16
    },
    {
      "block_size_m": 16,
      "block_size_n": 32,
      "block_size_k": 64,
      "group_size_m": 16,
      "num_warps": 4,
      "num_stages": 3,
      "align_block_size": 32
    },
    {
      "block_size_m": 16,
      "block_size_n": 32,
      "block_size_k": 64,
      "group_size_m": 16,
      "num_warps": 4,
      "num_stages": 3,
      "align_block_size": 64
    },
    {
      "block_size_m": 16,
      "block_size_n": 32,
      "block_size_k": 64,
      "group_size_m": 16,
      "num_warps": 8,
      "num_stages": 1,
      "align_block_size": 8
    },
    {
      "block_size_m": 16,
      "block_size_n": 32,
      "block_size_k": 64,
      "group_size_m": 16,
      "num_warps": 8,
      "num_stages": 1,
      "align_block_size": 16
    },
    {
      "block_size_m": 16,
      "block_size_n": 32,
      "block_size_k": 64,
      "group_size_m": 16,
      "num_warps": 8,
      "num_stages": 1,
      "align_block_size": 32
    },
    {
      "block_size_m": 16,
      "block_size_n": 32,
      "block_size_k": 64,
      "group_size_m": 16,
      "num_warps": 8,
      "num_stages": 1,
      "align_block_size": 64
    },
    {
      "block_size_m": 16,
      "block_size_n": 32,
      "block_size_k": 64,
      "group_size_m": 16,
      "num_warps": 8,
      "num_stages": 2,
      "align_block_size": 8
    },
    {
      "block_size_m": 16,
      "block_size_n": 32,
      "block_size_k": 64,
      "group_size_m": 16,
      "num_warps": 8,
      "num_stages": 2,
      "align_block_size": 16
    },
    {
      "block_size_m": 16,
      "block_size_n": 32,
      "block_size_k": 64,
      "group_size_m": 16,
      "num_warps": 8,
      "num_stages": 2,
      "align_block_size": 32
    },
    {
      "block_size_m": 16,
      "block_size_n": 32,
      "block_size_k": 64,
      "group_size_m": 16,
      "num_warps": 8,
      "num_stages": 2,
      "align_block_size": 64
    },
    {
      "block_size_m": 16,
      "block_size_n": 32,
      "block_size_k": 64,
      "group_size_m": 16,
      "num_warps": 8,
      "num_stages": 3,
      "align_block_size": 8
    },
    {
      "block_size_m": 16,
      "block_size_n": 32,
      "block_size_k": 64,
      "group_size_m": 16,
      "num_warps": 8,
      "num_stages": 3,
      "align_block_size": 16
    },
    {
      "block_size_m": 16,
      "block_size_n": 32,
      "block_size_k": 64,
      "group_size_m": 16,
      "num_warps": 8,
      "num_stages": 3,
      "align_block_size": 32
    },
    {
      "block_size_m": 16,
      "block_size_n": 32,
      "block_size_k": 64,
      "group_size_m": 16,
      "num_warps": 8,
      "num_stages": 3,
      "align_block_size": 64
    },
    {
      "block_size_m": 16,
      "block_size_n": 32,
      "block_size_k": 128,
      "group_size_m": 1,
      "num_warps": 2,
      "num_stages": 1,
      "align_block_size": 8
    },
    {
      "block_size_m": 16,
      "block_size_n": 32,
      "block_size_k": 128,
      "group_size_m": 1,
      "num_warps": 2,
      "num_stages": 1,
      "align_block_size": 16
    },
    {
      "block_size_m": 16,
      "block_size_n": 32,
      "block_size_k": 128,
      "group_size_m": 1,
      "num_warps": 2,
      "num_stages": 1,
      "align_block_size": 32
    },
    {
      "block_size_m": 16,
      "block_size_n": 32,
      "block_size_k": 128,
      "group_size_m": 1,
      "num_warps": 2,
      "num_stages": 1,
      "align_block_size": 64
    },
    {
      "block_size_m": 16,
      "block_size_n": 32,
      "block_size_k": 128,
      "group_size_m": 1,
      "num_warps": 2,
      "num_stages": 2,
      "align_block_size": 8
    },
    {
      "block_size_m": 16,
      "block_size_n": 32,
      "block_size_k": 128,
      "group_size_m": 1,
      "num_warps": 2,
      "num_stages": 2,
      "align_block_size": 16
    },
    {
      "block_size_m": 16,
      "block_size_n": 32,
      "block_size_k": 128,
      "group_size_m": 1,
      "num_warps": 2,
      "num_stages": 2,
      "align_block_size": 32
    },
    {
      "block_size_m": 16,
      "block_size_n": 32,
      "block_size_k": 128,
      "group_size_m": 1,
      "num_warps": 2,
      "num_stages": 2,
      "align_block_size": 64
    },
    {
      "block_size_m": 16,
      "block_size_n": 32,
      "block_size_k": 128,
      "group_size_m": 1,
      "num_warps": 2,
      "num_stages": 3,
      "align_block_size": 8
    },
    {
      "block_size_m": 16,
      "block_size_n": 32,
      "block_size_k": 128,
      "group_size_m": 1,
      "num_warps": 2,
      "num_stages": 3,
      "align_block_size": 16
    },
    {
      "block_size_m": 16,
      "block_size_n": 32,
      "block_size_k": 128,
      "group_size_m": 1,
      "num_warps": 2,
      "num_stages": 3,
      "align_block_size": 32
    },
    {
      "block_size_m": 16,
      "block_size_n": 32,
      "block_size_k": 128,
      "group_size_m": 1,
      "num_warps": 2,
      "num_stages": 3,
      "align_block_size": 64
    },
    {
      "block_size_m": 16,
      "block_size_n": 32,
      "block_size_k": 128,
      "group_size_m": 1,
      "num_warps": 4,
      "num_stages": 1,
      "align_block_size": 8
    },
    {
      "block_size_m": 16,
      "block_size_n": 32,
      "block_size_k": 128,
      "group_size_m": 1,
      "num_warps": 4,
      "num_stages": 1,
      "align_block_size": 16
    },
    {
      "block_size_m": 16,
      "block_size_n": 32,
      "block_size_k": 128,
      "group_size_m": 1,
      "num_warps": 4,
      "num_stages": 1,
      "align_block_size": 32
    },
    {
      "block_size_m": 16,
      "block_size_n": 32,
      "block_size_k": 128,
      "group_size_m": 1,
      "num_warps": 4,
      "num_stages": 1,
      "align_block_size": 64
    },
    {
      "block_size_m": 16,
      "block_size_n": 32,
      "block_size_k": 128,
      "group_size_m": 1,
      "num_warps": 4,
      "num_stages": 2,
      "align_block_size": 8
    },
    {
      "block_size_m": 16,
      "block_size_n": 32,
      "block_size_k": 128,
      "group_size_m": 1,
      "num_warps": 4,
      "num_stages": 2,
      "align_block_size": 16
    },
    {
      "block_size_m": 16,
      "block_size_n": 32,
      "block_size_k": 128,
      "group_size_m": 1,
      "num_warps": 4,
      "num_stages": 2,
      "align_block_size": 32
    },
    {
      "block_size_m": 16,
      "block_size_n": 32,
      "block_size_k": 128,
      "group_size_m": 1,
      "num_warps": 4,
      "num_stages": 2,
      "align_block_size": 64
    },
    {
      "block_size_m": 16,
      "block_size_n": 32,
      "block_size_k": 128,
      "group_size_m": 1,
      "num_warps": 4,
      "num_stages": 3,
      "align_block_size": 8
    },
    {
      "block_size_m": 16,
      "block_size_n": 32,
      "block_size_k": 128,
      "group_size_m": 1,
      "num_warps": 4,
      "num_stages": 3,
      "align_block_size": 16
    },
    {
      "block_size_m": 16,
      "block_size_n": 32,
      "block_size_k": 128,
      "group_size_m": 1,
      "num_warps": 4,
      "num_stages": 3,
      "align_block_size": 32
    },
    {
      "block_size_m": 16,
      "block_size_n": 32,
      "block_size_k": 128,
      "group_size_m": 1,
      "num_warps": 4,
      "num_stages": 3,
      "align_block_size": 64
    },
    {
      "block_size_m": 16,
      "block_size_n": 32,
      "block_size_k": 128,
      "group_size_m": 1,
      "num_warps": 8,
      "num_stages": 1,
      "align_block_size": 8
    },
    {
      "block_size_m": 16,
      "block_size_n": 32,
      "block_size_k": 128,
      "group_size_m": 1,
      "num_warps": 8,
      "num_stages": 1,
      "align_block_size": 16
    },
    {
      "block_size_m": 16,
      "block_size_n": 32,
      "block_size_k": 128,
      "group_size_m": 1,
      "num_warps": 8,
      "num_stages": 1,
      "align_block_size": 32
    },
    {
      "block_size_m": 16,
      "block_size_n": 32,
      "block_size_k": 128,
      "group_size_m": 1,
      "num_warps": 8,
      "num_stages": 1,
      "align_block_size": 64
    },
    {
      "block_size_m": 16,
      "block_size_n": 32,
      "block_size_k": 128,
      "group_size_m": 1,
      "num_warps": 8,
      "num_stages": 2,
      "align_block_size": 8
    },
    {
      "block_size_m": 16,
      "block_size_n": 32,
      "block_size_k": 128,
      "group_size_m": 1,
      "num_warps": 8,
      "num_stages": 2,
      "align_block_size": 16
    },
    {
      "block_size_m": 16,
      "block_size_n": 32,
      "block_size_k": 128,
      "group_size_m": 1,
      "num_warps": 8,
      "num_stages": 2,
      "align_block_size": 32
    },
    {
      "block_size_m": 16,
      "block_size_n": 32,
      "block_size_k": 128,
      "group_size_m": 1,
      "num_warps": 8,
      "num_stages": 2,
      "align_block_size": 64
    },
    {
      "block_size_m": 16,
      "block_size_n": 32,
      "block_size_k": 128,
      "group_size_m": 1,
      "num_warps": 8,
      "num_stages": 3,
      "align_block_size": 8
    },
    {
      "block_size_m": 16,
      "block_size_n": 32,
      "block_size_k": 128,
      "group_size_m": 1,
      "num_warps": 8,
      "num_stages": 3,
      "align_block_size": 16
    },
    {
      "block_size_m": 16,
      "block_size_n": 32,
      "block_size_k": 128,
      "group_size_m": 1,
      "num_warps": 8,
      "num_stages": 3,
      "align_block_size": 32
    },
    {
      "block_size_m": 16,
      "block_size_n": 32,
      "block_size_k": 128,
      "group_size_m": 1,
      "num_warps": 8,
      "num_stages": 3,
      "align_block_size": 64
    },
    {
      "block_size_m": 16,
      "block_size_n": 32,
      "block_size_k": 128,
      "group_size_m": 4,
      "num_warps": 2,
      "num_stages": 1,
      "align_block_size": 8
    },
    {
      "block_size_m": 16,
      "block_size_n": 32,
      "block_size_k": 128,
      "group_size_m": 4,
      "num_warps": 2,
      "num_stages": 1,
      "align_block_size": 16
    },
    {
      "block_size_m": 16,
      "block_size_n": 32,
      "block_size_k": 128,
      "group_size_m": 4,
      "num_warps": 2,
      "num_stages": 1,
      "align_block_size": 32
    },
    {
      "block_size_m": 16,
      "block_size_n": 32,
      "block_size_k": 128,
      "group_size_m": 4,
      "num_warps": 2,
      "num_stages": 1,
      "align_block_size": 64
    },
    {
      "block_size_m": 16,
      "block_size_n": 32,
      "block_size_k": 128,
      "group_size_m": 4,
      "num_warps": 2,
      "num_stages": 2,
      "align_block_size": 8
    },
    {
      "block_size_m": 16,
      "block_size_n": 32,
      "block_size_k": 128,
      "group_size_m": 4,
      "num_warps": 2,
      "num_stages": 2,
      "align_block_size": 16
    },
    {
      "block_size_m": 16,
      "block_size_n": 32,
      "block_size_k": 128,
      "group_size_m": 4,
      "num_warps": 2,
      "num_stages": 2,
      "align_block_size": 32
    },
    {
      "block_size_m": 16,
      "block_size_n": 32,
      "block_size_k": 128,
      "group_size_m": 4,
      "num_warps": 2,
      "num_stages": 2,
      "align_block_size": 64
    },
    {
      "block_size_m": 16,
      "block_size_n": 32,
      "block_size_k": 128,
      "group_size_m": 4,
      "num_warps": 2,
      "num_stages": 3,
      "align_block_size": 8
    },
    {
      "block_size_m": 16,
      "block_size_n": 32,
      "block_size_k": 128,
      "group_size_m": 4,
      "num_warps": 2,
      "num_stages": 3,
      "align_block_size": 16
    },
    {
      "block_size_m": 16,
      "block_size_n": 32,
      "block_size_k": 128,
      "group_size_m": 4,
      "num_warps": 2,
      "num_stages": 3,
      "align_block_size": 32
    },
    {
      "block_size_m": 16,
      "block_size_n": 32,
      "block_size_k": 128,
      "group_size_m": 4,
      "num_warps": 2,
      "num_stages": 3,
      "align_block_size": 64
    },
    {
      "block_size_m": 16,
      "block_size_n": 32,
      "block_size_k": 128,
      "group_size_m": 4,
      "num_warps": 4,
      "num_stages": 1,
      "align_block_size": 8
    },
    {
      "block_size_m": 16,
      "block_size_n": 32,
      "block_size_k": 128,
      "group_size_m": 4,
      "num_warps": 4,
      "num_stages": 1,
      "align_block_size": 16
    },
    {
      "block_size_m": 16,
      "block_size_n": 32,
      "block_size_k": 128,
      "group_size_m": 4,
      "num_warps": 4,
      "num_stages": 1,
      "align_block_size": 32
    },
    {
      "block_size_m": 16,
      "block_size_n": 32,
      "block_size_k": 128,
      "group_size_m": 4,
      "num_warps": 4,
      "num_stages": 1,
      "align_block_size": 64
    },
    {
      "block_size_m": 16,
      "block_size_n": 32,
      "block_size_k": 128,
      "group_size_m": 4,
      "num_warps": 4,
      "num_stages": 2,
      "align_block_size": 8
    },
    {
      "block_size_m": 16,
      "block_size_n": 32,
      "block_size_k": 128,
      "group_size_m": 4,
      "num_warps": 4,
      "num_stages": 2,
      "align_block_size": 16
    },
    {
      "block_size_m": 16,
      "block_size_n": 32,
      "block_size_k": 128,
      "group_size_m": 4,
      "num_warps": 4,
      "num_stages": 2,
      "align_block_size": 32
    },
    {
      "block_size_m": 16,
      "block_size_n": 32,
      "block_size_k": 128,
      "group_size_m": 4,
      "num_warps": 4,
      "num_stages": 2,
      "align_block_size": 64
    },
    {
      "block_size_m": 16,
      "block_size_n": 32,
      "block_size_k": 128,
      "group_size_m": 4,
      "num_warps": 4,
      "num_stages": 3,
      "align_block_size": 8
    },
    {
      "block_size_m": 16,
      "block_size_n": 32,
      "block_size_k": 128,
      "group_size_m": 4,
      "num_warps": 4,
      "num_stages": 3,
      "align_block_size": 16
    },
    {
      "block_size_m": 16,
      "block_size_n": 32,
      "block_size_k": 128,
      "group_size_m": 4,
      "num_warps": 4,
      "num_stages": 3,
      "align_block_size": 32
    },
    {
      "block_size_m": 16,
      "block_size_n": 32,
      "block_size_k": 128,
      "group_size_m": 4,
      "num_warps": 4,
      "num_stages": 3,
      "align_block_size": 64
    },
    {
      "block_size_m": 16,
      "block_size_n": 32,
      "block_size_k": 128,
      "group_size_m": 4,
      "num_warps": 8,
      "num_stages": 1,
      "align_block_size": 8
    },
    {
      "block_size_m": 16,
      "block_size_n": 32,
      "block_size_k": 128,
      "group_size_m": 4,
      "num_warps": 8,
      "num_stages": 1,
      "align_block_size": 16
    },
    {
      "block_size_m": 16,
      "block_size_n": 32,
      "block_size_k": 128,
      "group_size_m": 4,
      "num_warps": 8,
      "num_stages": 1,
      "align_block_size": 32
    },
    {
      "block_size_m": 16,
      "block_size_n": 32,
      "block_size_k": 128,
      "group_size_m": 4,
      "num_warps": 8,
      "num_stages": 1,
      "align_block_size": 64
    },
    {
      "block_size_m": 16,
      "block_size_n": 32,
      "block_size_k": 128,
      "group_size_m": 4,
      "num_warps": 8,
      "num_stages": 2,
      "align_block_size": 8
    },
    {
      "block_size_m": 16,
      "block_size_n": 32,
      "block_size_k": 128,
      "group_size_m": 4,
      "num_warps": 8,
      "num_stages": 2,
      "align_block_size": 16
    },
    {
      "block_size_m": 16,
      "block_size_n": 32,
      "block_size_k": 128,
      "group_size_m": 4,
      "num_warps": 8,
      "num_stages": 2,
      "align_block_size": 32
    },
    {
      "block_size_m": 16,
      "block_size_n": 32,
      "block_size_k": 128,
      "group_size_m": 4,
      "num_warps": 8,
      "num_stages": 2,
      "align_block_size": 64
    },
    {
      "block_size_m": 16,
      "block_size_n": 32,
      "block_size_k": 128,
      "group_size_m": 4,
      "num_warps": 8,
      "num_stages": 3,
      "align_block_size": 8
    },
    {
      "block_size_m": 16,
      "block_size_n": 32,
      "block_size_k": 128,
      "group_size_m": 4,
      "num_warps": 8,
      "num_stages": 3,
      "align_block_size": 16
    },
    {
      "block_size_m": 16,
      "block_size_n": 32,
      "block_size_k": 128,
      "group_size_m": 4,
      "num_warps": 8,
      "num_stages": 3,
      "align_block_size": 32
    },
    {
      "block_size_m": 16,
      "block_size_n": 32,
      "block_size_k": 128,
      "group_size_m": 4,
      "num_warps": 8,
      "num_stages": 3,
      "align_block_size": 64
    },
    {
      "block_size_m": 16,
      "block_size_n": 32,
      "block_size_k": 128,
      "group_size_m": 8,
      "num_warps": 2,
      "num_stages": 1,
      "align_block_size": 8
    },
    {
      "block_size_m": 16,
      "block_size_n": 32,
      "block_size_k": 128,
      "group_size_m": 8,
      "num_warps": 2,
      "num_stages": 1,
      "align_block_size": 16
    },
    {
      "block_size_m": 16,
      "block_size_n": 32,
      "block_size_k": 128,
      "group_size_m": 8,
      "num_warps": 2,
      "num_stages": 1,
      "align_block_size": 32
    },
    {
      "block_size_m": 16,
      "block_size_n": 32,
      "block_size_k": 128,
      "group_size_m": 8,
      "num_warps": 2,
      "num_stages": 1,
      "align_block_size": 64
    },
    {
      "block_size_m": 16,
      "block_size_n": 32,
      "block_size_k": 128,
      "group_size_m": 8,
      "num_warps": 2,
      "num_stages": 2,
      "align_block_size": 8
    },
    {
      "block_size_m": 16,
      "block_size_n": 32,
      "block_size_k": 128,
      "group_size_m": 8,
      "num_warps": 2,
      "num_stages": 2,
      "align_block_size": 16
    },
    {
      "block_size_m": 16,
      "block_size_n": 32,
      "block_size_k": 128,
      "group_size_m": 8,
      "num_warps": 2,
      "num_stages": 2,
      "align_block_size": 32
    },
    {
      "block_size_m": 16,
      "block_size_n": 32,
      "block_size_k": 128,
      "group_size_m": 8,
      "num_warps": 2,
      "num_stages": 2,
      "align_block_size": 64
    },
    {
      "block_size_m": 16,
      "block_size_n": 32,
      "block_size_k": 128,
      "group_size_m": 8,
      "num_warps": 2,
      "num_stages": 3,
      "align_block_size": 8
    },
    {
      "block_size_m": 16,
      "block_size_n": 32,
      "block_size_k": 128,
      "group_size_m": 8,
      "num_warps": 2,
      "num_stages": 3,
      "align_block_size": 16
    },
    {
      "block_size_m": 16,
      "block_size_n": 32,
      "block_size_k": 128,
      "group_size_m": 8,
      "num_warps": 2,
      "num_stages": 3,
      "align_block_size": 32
    },
    {
      "block_size_m": 16,
      "block_size_n": 32,
      "block_size_k": 128,
      "group_size_m": 8,
      "num_warps": 2,
      "num_stages": 3,
      "align_block_size": 64
    },
    {
      "block_size_m": 16,
      "block_size_n": 32,
      "block_size_k": 128,
      "group_size_m": 8,
      "num_warps": 4,
      "num_stages": 1,
      "align_block_size": 8
    },
    {
      "block_size_m": 16,
      "block_size_n": 32,
      "block_size_k": 128,
      "group_size_m": 8,
      "num_warps": 4,
      "num_stages": 1,
      "align_block_size": 16
    },
    {
      "block_size_m": 16,
      "block_size_n": 32,
      "block_size_k": 128,
      "group_size_m": 8,
      "num_warps": 4,
      "num_stages": 1,
      "align_block_size": 32
    },
    {
      "block_size_m": 16,
      "block_size_n": 32,
      "block_size_k": 128,
      "group_size_m": 8,
      "num_warps": 4,
      "num_stages": 1,
      "align_block_size": 64
    },
    {
      "block_size_m": 16,
      "block_size_n": 32,
      "block_size_k": 128,
      "group_size_m": 8,
      "num_warps": 4,
      "num_stages": 2,
      "align_block_size": 8
    },
    {
      "block_size_m": 16,
      "block_size_n": 32,
      "block_size_k": 128,
      "group_size_m": 8,
      "num_warps": 4,
      "num_stages": 2,
      "align_block_size": 16
    },
    {
      "block_size_m": 16,
      "block_size_n": 32,
      "block_size_k": 128,
      "group_size_m": 8,
      "num_warps": 4,
      "num_stages": 2,
      "align_block_size": 32
    },
    {
      "block_size_m": 16,
      "block_size_n": 32,
      "block_size_k": 128,
      "group_size_m": 8,
      "num_warps": 4,
      "num_stages": 2,
      "align_block_size": 64
    },
    {
      "block_size_m": 16,
      "block_size_n": 32,
      "block_size_k": 128,
      "group_size_m": 8,
      "num_warps": 4,
      "num_stages": 3,
      "align_block_size": 8
    },
    {
      "block_size_m": 16,
      "block_size_n": 32,
      "block_size_k": 128,
      "group_size_m": 8,
      "num_warps": 4,
      "num_stages": 3,
      "align_block_size": 16
    },
    {
      "block_size_m": 16,
      "block_size_n": 32,
      "block_size_k": 128,
      "group_size_m": 8,
      "num_warps": 4,
      "num_stages": 3,
      "align_block_size": 32
    },
    {
      "block_size_m": 16,
      "block_size_n": 32,
      "block_size_k": 128,
      "group_size_m": 8,
      "num_warps": 4,
      "num_stages": 3,
      "align_block_size": 64
    },
    {
      "block_size_m": 16,
      "block_size_n": 32,
      "block_size_k": 128,
      "group_size_m": 8,
      "num_warps": 8,
      "num_stages": 1,
      "align_block_size": 8
    },
    {
      "block_size_m": 16,
      "block_size_n": 32,
      "block_size_k": 128,
      "group_size_m": 8,
      "num_warps": 8,
      "num_stages": 1,
      "align_block_size": 16
    },
    {
      "block_size_m": 16,
      "block_size_n": 32,
      "block_size_k": 128,
      "group_size_m": 8,
      "num_warps": 8,
      "num_stages": 1,
      "align_block_size": 32
    },
    {
      "block_size_m": 16,
      "block_size_n": 32,
      "block_size_k": 128,
      "group_size_m": 8,
      "num_warps": 8,
      "num_stages": 1,
      "align_block_size": 64
    },
    {
      "block_size_m": 16,
      "block_size_n": 32,
      "block_size_k": 128,
      "group_size_m": 8,
      "num_warps": 8,
      "num_stages": 2,
      "align_block_size": 8
    },
    {
      "block_size_m": 16,
      "block_size_n": 32,
      "block_size_k": 128,
      "group_size_m": 8,
      "num_warps": 8,
      "num_stages": 2,
      "align_block_size": 16
    },
    {
      "block_size_m": 16,
      "block_size_n": 32,
      "block_size_k": 128,
      "group_size_m": 8,
      "num_warps": 8,
      "num_stages": 2,
      "align_block_size": 32
    },
    {
      "block_size_m": 16,
      "block_size_n": 32,
      "block_size_k": 128,
      "group_size_m": 8,
      "num_warps": 8,
      "num_stages": 2,
      "align_block_size": 64
    },
    {
      "block_size_m": 16,
      "block_size_n": 32,
      "block_size_k": 128,
      "group_size_m": 8,
      "num_warps": 8,
      "num_stages": 3,
      "align_block_size": 8
    },
    {
      "block_size_m": 16,
      "block_size_n": 32,
      "block_size_k": 128,
      "group_size_m": 8,
      "num_warps": 8,
      "num_stages": 3,
      "align_block_size": 16
    },
    {
      "block_size_m": 16,
      "block_size_n": 32,
      "block_size_k": 128,
      "group_size_m": 8,
      "num_warps": 8,
      "num_stages": 3,
      "align_block_size": 32
    },
    {
      "block_size_m": 16,
      "block_size_n": 32,
      "block_size_k": 128,
      "group_size_m": 8,
      "num_warps": 8,
      "num_stages": 3,
      "align_block_size": 64
    },
    {
      "block_size_m": 16,
      "block_size_n": 32,
      "block_size_k": 128,
      "group_size_m": 16,
      "num_warps": 2,
      "num_stages": 1,
      "align_block_size": 8
    },
    {
      "block_size_m": 16,
      "block_size_n": 32,
      "block_size_k": 128,
      "group_size_m": 16,
      "num_warps": 2,
      "num_stages": 1,
      "align_block_size": 16
    },
    {
      "block_size_m": 16,
      "block_size_n": 32,
      "block_size_k": 128,
      "group_size_m": 16,
      "num_warps": 2,
      "num_stages": 1,
      "align_block_size": 32
    },
    {
      "block_size_m": 16,
      "block_size_n": 32,
      "block_size_k": 128,
      "group_size_m": 16,
      "num_warps": 2,
      "num_stages": 1,
      "align_block_size": 64
    },
    {
      "block_size_m": 16,
      "block_size_n": 32,
      "block_size_k": 128,
      "group_size_m": 16,
      "num_warps": 2,
      "num_stages": 2,
      "align_block_size": 8
    },
    {
      "block_size_m": 16,
      "block_size_n": 32,
      "block_size_k": 128,
      "group_size_m": 16,
      "num_warps": 2,
      "num_stages": 2,
      "align_block_size": 16
    },
    {
      "block_size_m": 16,
      "block_size_n": 32,
      "block_size_k": 128,
      "group_size_m": 16,
      "num_warps": 2,
      "num_stages": 2,
      "align_block_size": 32
    },
    {
      "block_size_m": 16,
      "block_size_n": 32,
      "block_size_k": 128,
      "group_size_m": 16,
      "num_warps": 2,
      "num_stages": 2,
      "align_block_size": 64
    },
    {
      "block_size_m": 16,
      "block_size_n": 32,
      "block_size_k": 128,
      "group_size_m": 16,
      "num_warps": 2,
      "num_stages": 3,
      "align_block_size": 8
    },
    {
      "block_size_m": 16,
      "block_size_n": 32,
      "block_size_k": 128,
      "group_size_m": 16,
      "num_warps": 2,
      "num_stages": 3,
      "align_block_size": 16
    },
    {
      "block_size_m": 16,
      "block_size_n": 32,
      "block_size_k": 128,
      "group_size_m": 16,
      "num_warps": 2,
      "num_stages": 3,
      "align_block_size": 32
    },
    {
      "block_size_m": 16,
      "block_size_n": 32,
      "block_size_k": 128,
      "group_size_m": 16,
      "num_warps": 2,
      "num_stages": 3,
      "align_block_size": 64
    },
    {
      "block_size_m": 16,
      "block_size_n": 32,
      "block_size_k": 128,
      "group_size_m": 16,
      "num_warps": 4,
      "num_stages": 1,
      "align_block_size": 8
    },
    {
      "block_size_m": 16,
      "block_size_n": 32,
      "block_size_k": 128,
      "group_size_m": 16,
      "num_warps": 4,
      "num_stages": 1,
      "align_block_size": 16
    },
    {
      "block_size_m": 16,
      "block_size_n": 32,
      "block_size_k": 128,
      "group_size_m": 16,
      "num_warps": 4,
      "num_stages": 1,
      "align_block_size": 32
    },
    {
      "block_size_m": 16,
      "block_size_n": 32,
      "block_size_k": 128,
      "group_size_m": 16,
      "num_warps": 4,
      "num_stages": 1,
      "align_block_size": 64
    },
    {
      "block_size_m": 16,
      "block_size_n": 32,
      "block_size_k": 128,
      "group_size_m": 16,
      "num_warps": 4,
      "num_stages": 2,
      "align_block_size": 8
    },
    {
      "block_size_m": 16,
      "block_size_n": 32,
      "block_size_k": 128,
      "group_size_m": 16,
      "num_warps": 4,
      "num_stages": 2,
      "align_block_size": 16
    },
    {
      "block_size_m": 16,
      "block_size_n": 32,
      "block_size_k": 128,
      "group_size_m": 16,
      "num_warps": 4,
      "num_stages": 2,
      "align_block_size": 32
    },
    {
      "block_size_m": 16,
      "block_size_n": 32,
      "block_size_k": 128,
      "group_size_m": 16,
      "num_warps": 4,
      "num_stages": 2,
      "align_block_size": 64
    },
    {
      "block_size_m": 16,
      "block_size_n": 32,
      "block_size_k": 128,
      "group_size_m": 16,
      "num_warps": 4,
      "num_stages": 3,
      "align_block_size": 8
    },
    {
      "block_size_m": 16,
      "block_size_n": 32,
      "block_size_k": 128,
      "group_size_m": 16,
      "num_warps": 4,
      "num_stages": 3,
      "align_block_size": 16
    },
    {
      "block_size_m": 16,
      "block_size_n": 32,
      "block_size_k": 128,
      "group_size_m": 16,
      "num_warps": 4,
      "num_stages": 3,
      "align_block_size": 32
    },
    {
      "block_size_m": 16,
      "block_size_n": 32,
      "block_size_k": 128,
      "group_size_m": 16,
      "num_warps": 4,
      "num_stages": 3,
      "align_block_size": 64
    },
    {
      "block_size_m": 16,
      "block_size_n": 32,
      "block_size_k": 128,
      "group_size_m": 16,
      "num_warps": 8,
      "num_stages": 1,
      "align_block_size": 8
    },
    {
      "block_size_m": 16,
      "block_size_n": 32,
      "block_size_k": 128,
      "group_size_m": 16,
      "num_warps": 8,
      "num_stages": 1,
      "align_block_size": 16
    },
    {
      "block_size_m": 16,
      "block_size_n": 32,
      "block_size_k": 128,
      "group_size_m": 16,
      "num_warps": 8,
      "num_stages": 1,
      "align_block_size": 32
    },
    {
      "block_size_m": 16,
      "block_size_n": 32,
      "block_size_k": 128,
      "group_size_m": 16,
      "num_warps": 8,
      "num_stages": 1,
      "align_block_size": 64
    },
    {
      "block_size_m": 16,
      "block_size_n": 32,
      "block_size_k": 128,
      "group_size_m": 16,
      "num_warps": 8,
      "num_stages": 2,
      "align_block_size": 8
    },
    {
      "block_size_m": 16,
      "block_size_n": 32,
      "block_size_k": 128,
      "group_size_m": 16,
      "num_warps": 8,
      "num_stages": 2,
      "align_block_size": 16
    },
    {
      "block_size_m": 16,
      "block_size_n": 32,
      "block_size_k": 128,
      "group_size_m": 16,
      "num_warps": 8,
      "num_stages": 2,
      "align_block_size": 32
    },
    {
      "block_size_m": 16,
      "block_size_n": 32,
      "block_size_k": 128,
      "group_size_m": 16,
      "num_warps": 8,
      "num_stages": 2,
      "align_block_size": 64
    },
    {
      "block_size_m": 16,
      "block_size_n": 32,
      "block_size_k": 128,
      "group_size_m": 16,
      "num_warps": 8,
      "num_stages": 3,
      "align_block_size": 8
    },
    {
      "block_size_m": 16,
      "block_size_n": 32,
      "block_size_k": 128,
      "group_size_m": 16,
      "num_warps": 8,
      "num_stages": 3,
      "align_block_size": 16
    },
    {
      "block_size_m": 16,
      "block_size_n": 32,
      "block_size_k": 128,
      "group_size_m": 16,
      "num_warps": 8,
      "num_stages": 3,
      "align_block_size": 32
    },
    {
      "block_size_m": 16,
      "block_size_n": 32,
      "block_size_k": 128,
      "group_size_m": 16,
      "num_warps": 8,
      "num_stages": 3,
      "align_block_size": 64
    },
    {
      "block_size_m": 16,
      "block_size_n": 64,
      "block_size_k": 32,
      "group_size_m": 1,
      "num_warps": 2,
      "num_stages": 1,
      "align_block_size": 8
    },
    {
      "block_size_m": 16,
      "block_size_n": 64,
      "block_size_k": 32,
      "group_size_m": 1,
      "num_warps": 2,
      "num_stages": 1,
      "align_block_size": 16
    },
    {
      "block_size_m": 16,
      "block_size_n": 64,
      "block_size_k": 32,
      "group_size_m": 1,
      "num_warps": 2,
      "num_stages": 1,
      "align_block_size": 32
    },
    {
      "block_size_m": 16,
      "block_size_n": 64,
      "block_size_k": 32,
      "group_size_m": 1,
      "num_warps": 2,
      "num_stages": 1,
      "align_block_size": 64
    },
    {
      "block_size_m": 16,
      "block_size_n": 64,
      "block_size_k": 32,
      "group_size_m": 1,
      "num_warps": 2,
      "num_stages": 2,
      "align_block_size": 8
    },
    {
      "block_size_m": 16,
      "block_size_n": 64,
      "block_size_k": 32,
      "group_size_m": 1,
      "num_warps": 2,
      "num_stages": 2,
      "align_block_size": 16
    },
    {
      "block_size_m": 16,
      "block_size_n": 64,
      "block_size_k": 32,
      "group_size_m": 1,
      "num_warps": 2,
      "num_stages": 2,
      "align_block_size": 32
    },
    {
      "block_size_m": 16,
      "block_size_n": 64,
      "block_size_k": 32,
      "group_size_m": 1,
      "num_warps": 2,
      "num_stages": 2,
      "align_block_size": 64
    },
    {
      "block_size_m": 16,
      "block_size_n": 64,
      "block_size_k": 32,
      "group_size_m": 1,
      "num_warps": 2,
      "num_stages": 3,
      "align_block_size": 8
    },
    {
      "block_size_m": 16,
      "block_size_n": 64,
      "block_size_k": 32,
      "group_size_m": 1,
      "num_warps": 2,
      "num_stages": 3,
      "align_block_size": 16
    },
    {
      "block_size_m": 16,
      "block_size_n": 64,
      "block_size_k": 32,
      "group_size_m": 1,
      "num_warps": 2,
      "num_stages": 3,
      "align_block_size": 32
    },
    {
      "block_size_m": 16,
      "block_size_n": 64,
      "block_size_k": 32,
      "group_size_m": 1,
      "num_warps": 2,
      "num_stages": 3,
      "align_block_size": 64
    },
    {
      "block_size_m": 16,
      "block_size_n": 64,
      "block_size_k": 32,
      "group_size_m": 1,
      "num_warps": 4,
      "num_stages": 1,
      "align_block_size": 8
    },
    {
      "block_size_m": 16,
      "block_size_n": 64,
      "block_size_k": 32,
      "group_size_m": 1,
      "num_warps": 4,
      "num_stages": 1,
      "align_block_size": 16
    },
    {
      "block_size_m": 16,
      "block_size_n": 64,
      "block_size_k": 32,
      "group_size_m": 1,
      "num_warps": 4,
      "num_stages": 1,
      "align_block_size": 32
    },
    {
      "block_size_m": 16,
      "block_size_n": 64,
      "block_size_k": 32,
      "group_size_m": 1,
      "num_warps": 4,
      "num_stages": 1,
      "align_block_size": 64
    },
    {
      "block_size_m": 16,
      "block_size_n": 64,
      "block_size_k": 32,
      "group_size_m": 1,
      "num_warps": 4,
      "num_stages": 2,
      "align_block_size": 8
    },
    {
      "block_size_m": 16,
      "block_size_n": 64,
      "block_size_k": 32,
      "group_size_m": 1,
      "num_warps": 4,
      "num_stages": 2,
      "align_block_size": 16
    },
    {
      "block_size_m": 16,
      "block_size_n": 64,
      "block_size_k": 32,
      "group_size_m": 1,
      "num_warps": 4,
      "num_stages": 2,
      "align_block_size": 32
    },
    {
      "block_size_m": 16,
      "block_size_n": 64,
      "block_size_k": 32,
      "group_size_m": 1,
      "num_warps": 4,
      "num_stages": 2,
      "align_block_size": 64
    },
    {
      "block_size_m": 16,
      "block_size_n": 64,
      "block_size_k": 32,
      "group_size_m": 1,
      "num_warps": 4,
      "num_stages": 3,
      "align_block_size": 8
    },
    {
      "block_size_m": 16,
      "block_size_n": 64,
      "block_size_k": 32,
      "group_size_m": 1,
      "num_warps": 4,
      "num_stages": 3,
      "align_block_size": 16
    },
    {
      "block_size_m": 16,
      "block_size_n": 64,
      "block_size_k": 32,
      "group_size_m": 1,
      "num_warps": 4,
      "num_stages": 3,
      "align_block_size": 32
    },
    {
      "block_size_m": 16,
      "block_size_n": 64,
      "block_size_k": 32,
      "group_size_m": 1,
      "num_warps": 4,
      "num_stages": 3,
      "align_block_size": 64
    },
    {
      "block_size_m": 16,
      "block_size_n": 64,
      "block_size_k": 32,
      "group_size_m": 1,
      "num_warps": 8,
      "num_stages": 1,
      "align_block_size": 8
    },
    {
      "block_size_m": 16,
      "block_size_n": 64,
      "block_size_k": 32,
      "group_size_m": 1,
      "num_warps": 8,
      "num_stages": 1,
      "align_block_size": 16
    },
    {
      "block_size_m": 16,
      "block_size_n": 64,
      "block_size_k": 32,
      "group_size_m": 1,
      "num_warps": 8,
      "num_stages": 1,
      "align_block_size": 32
    },
    {
      "block_size_m": 16,
      "block_size_n": 64,
      "block_size_k": 32,
      "group_size_m": 1,
      "num_warps": 8,
      "num_stages": 1,
      "align_block_size": 64
    },
    {
      "block_size_m": 16,
      "block_size_n": 64,
      "block_size_k": 32,
      "group_size_m": 1,
      "num_warps": 8,
      "num_stages": 2,
      "align_block_size": 8
    },
    {
      "block_size_m": 16,
      "block_size_n": 64,
      "block_size_k": 32,
      "group_size_m": 1,
      "num_warps": 8,
      "num_stages": 2,
      "align_block_size": 16
    },
    {
      "block_size_m": 16,
      "block_size_n": 64,
      "block_size_k": 32,
      "group_size_m": 1,
      "num_warps": 8,
      "num_stages": 2,
      "align_block_size": 32
    },
    {
      "block_size_m": 16,
      "block_size_n": 64,
      "block_size_k": 32,
      "group_size_m": 1,
      "num_warps": 8,
      "num_stages": 2,
      "align_block_size": 64
    },
    {
      "block_size_m": 16,
      "block_size_n": 64,
      "block_size_k": 32,
      "group_size_m": 1,
      "num_warps": 8,
      "num_stages": 3,
      "align_block_size": 8
    },
    {
      "block_size_m": 16,
      "block_size_n": 64,
      "block_size_k": 32,
      "group_size_m": 1,
      "num_warps": 8,
      "num_stages": 3,
      "align_block_size": 16
    },
    {
      "block_size_m": 16,
      "block_size_n": 64,
      "block_size_k": 32,
      "group_size_m": 1,
      "num_warps": 8,
      "num_stages": 3,
      "align_block_size": 32
    },
    {
      "block_size_m": 16,
      "block_size_n": 64,
      "block_size_k": 32,
      "group_size_m": 1,
      "num_warps": 8,
      "num_stages": 3,
      "align_block_size": 64
    },
    {
      "block_size_m": 16,
      "block_size_n": 64,
      "block_size_k": 32,
      "group_size_m": 4,
      "num_warps": 2,
      "num_stages": 1,
      "align_block_size": 8
    },
    {
      "block_size_m": 16,
      "block_size_n": 64,
      "block_size_k": 32,
      "group_size_m": 4,
      "num_warps": 2,
      "num_stages": 1,
      "align_block_size": 16
    },
    {
      "block_size_m": 16,
      "block_size_n": 64,
      "block_size_k": 32,
      "group_size_m": 4,
      "num_warps": 2,
      "num_stages": 1,
      "align_block_size": 32
    },
    {
      "block_size_m": 16,
      "block_size_n": 64,
      "block_size_k": 32,
      "group_size_m": 4,
      "num_warps": 2,
      "num_stages": 1,
      "align_block_size": 64
    },
    {
      "block_size_m": 16,
      "block_size_n": 64,
      "block_size_k": 32,
      "group_size_m": 4,
      "num_warps": 2,
      "num_stages": 2,
      "align_block_size": 8
    },
    {
      "block_size_m": 16,
      "block_size_n": 64,
      "block_size_k": 32,
      "group_size_m": 4,
      "num_warps": 2,
      "num_stages": 2,
      "align_block_size": 16
    },
    {
      "block_size_m": 16,
      "block_size_n": 64,
      "block_size_k": 32,
      "group_size_m": 4,
      "num_warps": 2,
      "num_stages": 2,
      "align_block_size": 32
    },
    {
      "block_size_m": 16,
      "block_size_n": 64,
      "block_size_k": 32,
      "group_size_m": 4,
      "num_warps": 2,
      "num_stages": 2,
      "align_block_size": 64
    },
    {
      "block_size_m": 16,
      "block_size_n": 64,
      "block_size_k": 32,
      "group_size_m": 4,
      "num_warps": 2,
      "num_stages": 3,
      "align_block_size": 8
    },
    {
      "block_size_m": 16,
      "block_size_n": 64,
      "block_size_k": 32,
      "group_size_m": 4,
      "num_warps": 2,
      "num_stages": 3,
      "align_block_size": 16
    },
    {
      "block_size_m": 16,
      "block_size_n": 64,
      "block_size_k": 32,
      "group_size_m": 4,
      "num_warps": 2,
      "num_stages": 3,
      "align_block_size": 32
    },
    {
      "block_size_m": 16,
      "block_size_n": 64,
      "block_size_k": 32,
      "group_size_m": 4,
      "num_warps": 2,
      "num_stages": 3,
      "align_block_size": 64
    },
    {
      "block_size_m": 16,
      "block_size_n": 64,
      "block_size_k": 32,
      "group_size_m": 4,
      "num_warps": 4,
      "num_stages": 1,
      "align_block_size": 8
    },
    {
      "block_size_m": 16,
      "block_size_n": 64,
      "block_size_k": 32,
      "group_size_m": 4,
      "num_warps": 4,
      "num_stages": 1,
      "align_block_size": 16
    },
    {
      "block_size_m": 16,
      "block_size_n": 64,
      "block_size_k": 32,
      "group_size_m": 4,
      "num_warps": 4,
      "num_stages": 1,
      "align_block_size": 32
    },
    {
      "block_size_m": 16,
      "block_size_n": 64,
      "block_size_k": 32,
      "group_size_m": 4,
      "num_warps": 4,
      "num_stages": 1,
      "align_block_size": 64
    },
    {
      "block_size_m": 16,
      "block_size_n": 64,
      "block_size_k": 32,
      "group_size_m": 4,
      "num_warps": 4,
      "num_stages": 2,
      "align_block_size": 8
    },
    {
      "block_size_m": 16,
      "block_size_n": 64,
      "block_size_k": 32,
      "group_size_m": 4,
      "num_warps": 4,
      "num_stages": 2,
      "align_block_size": 16
    },
    {
      "block_size_m": 16,
      "block_size_n": 64,
      "block_size_k": 32,
      "group_size_m": 4,
      "num_warps": 4,
      "num_stages": 2,
      "align_block_size": 32
    },
    {
      "block_size_m": 16,
      "block_size_n": 64,
      "block_size_k": 32,
      "group_size_m": 4,
      "num_warps": 4,
      "num_stages": 2,
      "align_block_size": 64
    },
    {
      "block_size_m": 16,
      "block_size_n": 64,
      "block_size_k": 32,
      "group_size_m": 4,
      "num_warps": 4,
      "num_stages": 3,
      "align_block_size": 8
    },
    {
      "block_size_m": 16,
      "block_size_n": 64,
      "block_size_k": 32,
      "group_size_m": 4,
      "num_warps": 4,
      "num_stages": 3,
      "align_block_size": 16
    },
    {
      "block_size_m": 16,
      "block_size_n": 64,
      "block_size_k": 32,
      "group_size_m": 4,
      "num_warps": 4,
      "num_stages": 3,
      "align_block_size": 32
    },
    {
      "block_size_m": 16,
      "block_size_n": 64,
      "block_size_k": 32,
      "group_size_m": 4,
      "num_warps": 4,
      "num_stages": 3,
      "align_block_size": 64
    },
    {
      "block_size_m": 16,
      "block_size_n": 64,
      "block_size_k": 32,
      "group_size_m": 4,
      "num_warps": 8,
      "num_stages": 1,
      "align_block_size": 8
    },
    {
      "block_size_m": 16,
      "block_size_n": 64,
      "block_size_k": 32,
      "group_size_m": 4,
      "num_warps": 8,
      "num_stages": 1,
      "align_block_size": 16
    },
    {
      "block_size_m": 16,
      "block_size_n": 64,
      "block_size_k": 32,
      "group_size_m": 4,
      "num_warps": 8,
      "num_stages": 1,
      "align_block_size": 32
    },
    {
      "block_size_m": 16,
      "block_size_n": 64,
      "block_size_k": 32,
      "group_size_m": 4,
      "num_warps": 8,
      "num_stages": 1,
      "align_block_size": 64
    },
    {
      "block_size_m": 16,
      "block_size_n": 64,
      "block_size_k": 32,
      "group_size_m": 4,
      "num_warps": 8,
      "num_stages": 2,
      "align_block_size": 8
    },
    {
      "block_size_m": 16,
      "block_size_n": 64,
      "block_size_k": 32,
      "group_size_m": 4,
      "num_warps": 8,
      "num_stages": 2,
      "align_block_size": 16
    },
    {
      "block_size_m": 16,
      "block_size_n": 64,
      "block_size_k": 32,
      "group_size_m": 4,
      "num_warps": 8,
      "num_stages": 2,
      "align_block_size": 32
    },
    {
      "block_size_m": 16,
      "block_size_n": 64,
      "block_size_k": 32,
      "group_size_m": 4,
      "num_warps": 8,
      "num_stages": 2,
      "align_block_size": 64
    },
    {
      "block_size_m": 16,
      "block_size_n": 64,
      "block_size_k": 32,
      "group_size_m": 4,
      "num_warps": 8,
      "num_stages": 3,
      "align_block_size": 8
    },
    {
      "block_size_m": 16,
      "block_size_n": 64,
      "block_size_k": 32,
      "group_size_m": 4,
      "num_warps": 8,
      "num_stages": 3,
      "align_block_size": 16
    },
    {
      "block_size_m": 16,
      "block_size_n": 64,
      "block_size_k": 32,
      "group_size_m": 4,
      "num_warps": 8,
      "num_stages": 3,
      "align_block_size": 32
    },
    {
      "block_size_m": 16,
      "block_size_n": 64,
      "block_size_k": 32,
      "group_size_m": 4,
      "num_warps": 8,
      "num_stages": 3,
      "align_block_size": 64
    },
    {
      "block_size_m": 16,
      "block_size_n": 64,
      "block_size_k": 32,
      "group_size_m": 8,
      "num_warps": 2,
      "num_stages": 1,
      "align_block_size": 8
    },
    {
      "block_size_m": 16,
      "block_size_n": 64,
      "block_size_k": 32,
      "group_size_m": 8,
      "num_warps": 2,
      "num_stages": 1,
      "align_block_size": 16
    },
    {
      "block_size_m": 16,
      "block_size_n": 64,
      "block_size_k": 32,
      "group_size_m": 8,
      "num_warps": 2,
      "num_stages": 1,
      "align_block_size": 32
    },
    {
      "block_size_m": 16,
      "block_size_n": 64,
      "block_size_k": 32,
      "group_size_m": 8,
      "num_warps": 2,
      "num_stages": 1,
      "align_block_size": 64
    },
    {
      "block_size_m": 16,
      "block_size_n": 64,
      "block_size_k": 32,
      "group_size_m": 8,
      "num_warps": 2,
      "num_stages": 2,
      "align_block_size": 8
    },
    {
      "block_size_m": 16,
      "block_size_n": 64,
      "block_size_k": 32,
      "group_size_m": 8,
      "num_warps": 2,
      "num_stages": 2,
      "align_block_size": 16
    },
    {
      "block_size_m": 16,
      "block_size_n": 64,
      "block_size_k": 32,
      "group_size_m": 8,
      "num_warps": 2,
      "num_stages": 2,
      "align_block_size": 32
    },
    {
      "block_size_m": 16,
      "block_size_n": 64,
      "block_size_k": 32,
      "group_size_m": 8,
      "num_warps": 2,
      "num_stages": 2,
      "align_block_size": 64
    },
    {
      "block_size_m": 16,
      "block_size_n": 64,
      "block_size_k": 32,
      "group_size_m": 8,
      "num_warps": 2,
      "num_stages": 3,
      "align_block_size": 8
    },
    {
      "block_size_m": 16,
      "block_size_n": 64,
      "block_size_k": 32,
      "group_size_m": 8,
      "num_warps": 2,
      "num_stages": 3,
      "align_block_size": 16
    },
    {
      "block_size_m": 16,
      "block_size_n": 64,
      "block_size_k": 32,
      "group_size_m": 8,
      "num_warps": 2,
      "num_stages": 3,
      "align_block_size": 32
    },
    {
      "block_size_m": 16,
      "block_size_n": 64,
      "block_size_k": 32,
      "group_size_m": 8,
      "num_warps": 2,
      "num_stages": 3,
      "align_block_size": 64
    },
    {
      "block_size_m": 16,
      "block_size_n": 64,
      "block_size_k": 32,
      "group_size_m": 8,
      "num_warps": 4,
      "num_stages": 1,
      "align_block_size": 8
    },
    {
      "block_size_m": 16,
      "block_size_n": 64,
      "block_size_k": 32,
      "group_size_m": 8,
      "num_warps": 4,
      "num_stages": 1,
      "align_block_size": 16
    },
    {
      "block_size_m": 16,
      "block_size_n": 64,
      "block_size_k": 32,
      "group_size_m": 8,
      "num_warps": 4,
      "num_stages": 1,
      "align_block_size": 32
    },
    {
      "block_size_m": 16,
      "block_size_n": 64,
      "block_size_k": 32,
      "group_size_m": 8,
      "num_warps": 4,
      "num_stages": 1,
      "align_block_size": 64
    },
    {
      "block_size_m": 16,
      "block_size_n": 64,
      "block_size_k": 32,
      "group_size_m": 8,
      "num_warps": 4,
      "num_stages": 2,
      "align_block_size": 8
    },
    {
      "block_size_m": 16,
      "block_size_n": 64,
      "block_size_k": 32,
      "group_size_m": 8,
      "num_warps": 4,
      "num_stages": 2,
      "align_block_size": 16
    },
    {
      "block_size_m": 16,
      "block_size_n": 64,
      "block_size_k": 32,
      "group_size_m": 8,
      "num_warps": 4,
      "num_stages": 2,
      "align_block_size": 32
    },
    {
      "block_size_m": 16,
      "block_size_n": 64,
      "block_size_k": 32,
      "group_size_m": 8,
      "num_warps": 4,
      "num_stages": 2,
      "align_block_size": 64
    },
    {
      "block_size_m": 16,
      "block_size_n": 64,
      "block_size_k": 32,
      "group_size_m": 8,
      "num_warps": 4,
      "num_stages": 3,
      "align_block_size": 8
    },
    {
      "block_size_m": 16,
      "block_size_n": 64,
      "block_size_k": 32,
      "group_size_m": 8,
      "num_warps": 4,
      "num_stages": 3,
      "align_block_size": 16
    },
    {
      "block_size_m": 16,
      "block_size_n": 64,
      "block_size_k": 32,
      "group_size_m": 8,
      "num_warps": 4,
      "num_stages": 3,
      "align_block_size": 32
    },
    {
      "block_size_m": 16,
      "block_size_n": 64,
      "block_size_k": 32,
      "group_size_m": 8,
      "num_warps": 4,
      "num_stages": 3,
      "align_block_size": 64
    },
    {
      "block_size_m": 16,
      "block_size_n": 64,
      "block_size_k": 32,
      "group_size_m": 8,
      "num_warps": 8,
      "num_stages": 1,
      "align_block_size": 8
    },
    {
      "block_size_m": 16,
      "block_size_n": 64,
      "block_size_k": 32,
      "group_size_m": 8,
      "num_warps": 8,
      "num_stages": 1,
      "align_block_size": 16
    },
    {
      "block_size_m": 16,
      "block_size_n": 64,
      "block_size_k": 32,
      "group_size_m": 8,
      "num_warps": 8,
      "num_stages": 1,
      "align_block_size": 32
    },
    {
      "block_size_m": 16,
      "block_size_n": 64,
      "block_size_k": 32,
      "group_size_m": 8,
      "num_warps": 8,
      "num_stages": 1,
      "align_block_size": 64
    },
    {
      "block_size_m": 16,
      "block_size_n": 64,
      "block_size_k": 32,
      "group_size_m": 8,
      "num_warps": 8,
      "num_stages": 2,
      "align_block_size": 8
    },
    {
      "block_size_m": 16,
      "block_size_n": 64,
      "block_size_k": 32,
      "group_size_m": 8,
      "num_warps": 8,
      "num_stages": 2,
      "align_block_size": 16
    },
    {
      "block_size_m": 16,
      "block_size_n": 64,
      "block_size_k": 32,
      "group_size_m": 8,
      "num_warps": 8,
      "num_stages": 2,
      "align_block_size": 32
    },
    {
      "block_size_m": 16,
      "block_size_n": 64,
      "block_size_k": 32,
      "group_size_m": 8,
      "num_warps": 8,
      "num_stages": 2,
      "align_block_size": 64
    },
    {
      "block_size_m": 16,
      "block_size_n": 64,
      "block_size_k": 32,
      "group_size_m": 8,
      "num_warps": 8,
      "num_stages": 3,
      "align_block_size": 8
    },
    {
      "block_size_m": 16,
      "block_size_n": 64,
      "block_size_k": 32,
      "group_size_m": 8,
      "num_warps": 8,
      "num_stages": 3,
      "align_block_size": 16
    },
    {
      "block_size_m": 16,
      "block_size_n": 64,
      "block_size_k": 32,
      "group_size_m": 8,
      "num_warps": 8,
      "num_stages": 3,
      "align_block_size": 32
    },
    {
      "block_size_m": 16,
      "block_size_n": 64,
      "block_size_k": 32,
      "group_size_m": 8,
      "num_warps": 8,
      "num_stages": 3,
      "align_block_size": 64
    },
    {
      "block_size_m": 16,
      "block_size_n": 64,
      "block_size_k": 32,
      "group_size_m": 16,
      "num_warps": 2,
      "num_stages": 1,
      "align_block_size": 8
    },
    {
      "block_size_m": 16,
      "block_size_n": 64,
      "block_size_k": 32,
      "group_size_m": 16,
      "num_warps": 2,
      "num_stages": 1,
      "align_block_size": 16
    },
    {
      "block_size_m": 16,
      "block_size_n": 64,
      "block_size_k": 32,
      "group_size_m": 16,
      "num_warps": 2,
      "num_stages": 1,
      "align_block_size": 32
    },
    {
      "block_size_m": 16,
      "block_size_n": 64,
      "block_size_k": 32,
      "group_size_m": 16,
      "num_warps": 2,
      "num_stages": 1,
      "align_block_size": 64
    },
    {
      "block_size_m": 16,
      "block_size_n": 64,
      "block_size_k": 32,
      "group_size_m": 16,
      "num_warps": 2,
      "num_stages": 2,
      "align_block_size": 8
    },
    {
      "block_size_m": 16,
      "block_size_n": 64,
      "block_size_k": 32,
      "group_size_m": 16,
      "num_warps": 2,
      "num_stages": 2,
      "align_block_size": 16
    },
    {
      "block_size_m": 16,
      "block_size_n": 64,
      "block_size_k": 32,
      "group_size_m": 16,
      "num_warps": 2,
      "num_stages": 2,
      "align_block_size": 32
    },
    {
      "block_size_m": 16,
      "block_size_n": 64,
      "block_size_k": 32,
      "group_size_m": 16,
      "num_warps": 2,
      "num_stages": 2,
      "align_block_size": 64
    },
    {
      "block_size_m": 16,
      "block_size_n": 64,
      "block_size_k": 32,
      "group_size_m": 16,
      "num_warps": 2,
      "num_stages": 3,
      "align_block_size": 8
    },
    {
      "block_size_m": 16,
      "block_size_n": 64,
      "block_size_k": 32,
      "group_size_m": 16,
      "num_warps": 2,
      "num_stages": 3,
      "align_block_size": 16
    },
    {
      "block_size_m": 16,
      "block_size_n": 64,
      "block_size_k": 32,
      "group_size_m": 16,
      "num_warps": 2,
      "num_stages": 3,
      "align_block_size": 32
    },
    {
      "block_size_m": 16,
      "block_size_n": 64,
      "block_size_k": 32,
      "group_size_m": 16,
      "num_warps": 2,
      "num_stages": 3,
      "align_block_size": 64
    },
    {
      "block_size_m": 16,
      "block_size_n": 64,
      "block_size_k": 32,
      "group_size_m": 16,
      "num_warps": 4,
      "num_stages": 1,
      "align_block_size": 8
    },
    {
      "block_size_m": 16,
      "block_size_n": 64,
      "block_size_k": 32,
      "group_size_m": 16,
      "num_warps": 4,
      "num_stages": 1,
      "align_block_size": 16
    },
    {
      "block_size_m": 16,
      "block_size_n": 64,
      "block_size_k": 32,
      "group_size_m": 16,
      "num_warps": 4,
      "num_stages": 1,
      "align_block_size": 32
    },
    {
      "block_size_m": 16,
      "block_size_n": 64,
      "block_size_k": 32,
      "group_size_m": 16,
      "num_warps": 4,
      "num_stages": 1,
      "align_block_size": 64
    },
    {
      "block_size_m": 16,
      "block_size_n": 64,
      "block_size_k": 32,
      "group_size_m": 16,
      "num_warps": 4,
      "num_stages": 2,
      "align_block_size": 8
    },
    {
      "block_size_m": 16,
      "block_size_n": 64,
      "block_size_k": 32,
      "group_size_m": 16,
      "num_warps": 4,
      "num_stages": 2,
      "align_block_size": 16
    },
    {
      "block_size_m": 16,
      "block_size_n": 64,
      "block_size_k": 32,
      "group_size_m": 16,
      "num_warps": 4,
      "num_stages": 2,
      "align_block_size": 32
    },
    {
      "block_size_m": 16,
      "block_size_n": 64,
      "block_size_k": 32,
      "group_size_m": 16,
      "num_warps": 4,
      "num_stages": 2,
      "align_block_size": 64
    },
    {
      "block_size_m": 16,
      "block_size_n": 64,
      "block_size_k": 32,
      "group_size_m": 16,
      "num_warps": 4,
      "num_stages": 3,
      "align_block_size": 8
    },
    {
      "block_size_m": 16,
      "block_size_n": 64,
      "block_size_k": 32,
      "group_size_m": 16,
      "num_warps": 4,
      "num_stages": 3,
      "align_block_size": 16
    },
    {
      "block_size_m": 16,
      "block_size_n": 64,
      "block_size_k": 32,
      "group_size_m": 16,
      "num_warps": 4,
      "num_stages": 3,
      "align_block_size": 32
    },
    {
      "block_size_m": 16,
      "block_size_n": 64,
      "block_size_k": 32,
      "group_size_m": 16,
      "num_warps": 4,
      "num_stages": 3,
      "align_block_size": 64
    },
    {
      "block_size_m": 16,
      "block_size_n": 64,
      "block_size_k": 32,
      "group_size_m": 16,
      "num_warps": 8,
      "num_stages": 1,
      "align_block_size": 8
    },
    {
      "block_size_m": 16,
      "block_size_n": 64,
      "block_size_k": 32,
      "group_size_m": 16,
      "num_warps": 8,
      "num_stages": 1,
      "align_block_size": 16
    },
    {
      "block_size_m": 16,
      "block_size_n": 64,
      "block_size_k": 32,
      "group_size_m": 16,
      "num_warps": 8,
      "num_stages": 1,
      "align_block_size": 32
    },
    {
      "block_size_m": 16,
      "block_size_n": 64,
      "block_size_k": 32,
      "group_size_m": 16,
      "num_warps": 8,
      "num_stages": 1,
      "align_block_size": 64
    },
    {
      "block_size_m": 16,
      "block_size_n": 64,
      "block_size_k": 32,
      "group_size_m": 16,
      "num_warps": 8,
      "num_stages": 2,
      "align_block_size": 8
    },
    {
      "block_size_m": 16,
      "block_size_n": 64,
      "block_size_k": 32,
      "group_size_m": 16,
      "num_warps": 8,
      "num_stages": 2,
      "align_block_size": 16
    },
    {
      "block_size_m": 16,
      "block_size_n": 64,
      "block_size_k": 32,
      "group_size_m": 16,
      "num_warps": 8,
      "num_stages": 2,
      "align_block_size": 32
    },
    {
      "block_size_m": 16,
      "block_size_n": 64,
      "block_size_k": 32,
      "group_size_m": 16,
      "num_warps": 8,
      "num_stages": 2,
      "align_block_size": 64
    },
    {
      "block_size_m": 16,
      "block_size_n": 64,
      "block_size_k": 32,
      "group_size_m": 16,
      "num_warps": 8,
      "num_stages": 3,
      "align_block_size": 8
    },
    {
      "block_size_m": 16,
      "block_size_n": 64,
      "block_size_k": 32,
      "group_size_m": 16,
      "num_warps": 8,
      "num_stages": 3,
      "align_block_size": 16
    },
    {
      "block_size_m": 16,
      "block_size_n": 64,
      "block_size_k": 32,
      "group_size_m": 16,
      "num_warps": 8,
      "num_stages": 3,
      "align_block_size": 32
    },
    {
      "block_size_m": 16,
      "block_size_n": 64,
      "block_size_k": 32,
      "group_size_m": 16,
      "num_warps": 8,
      "num_stages": 3,
      "align_block_size": 64
    },
    {
      "block_size_m": 16,
      "block_size_n": 64,
      "block_size_k": 64,
      "group_size_m": 1,
      "num_warps": 2,
      "num_stages": 1,
      "align_block_size": 8
    },
    {
      "block_size_m": 16,
      "block_size_n": 64,
      "block_size_k": 64,
      "group_size_m": 1,
      "num_warps": 2,
      "num_stages": 1,
      "align_block_size": 16
    },
    {
      "block_size_m": 16,
      "block_size_n": 64,
      "block_size_k": 64,
      "group_size_m": 1,
      "num_warps": 2,
      "num_stages": 1,
      "align_block_size": 32
    },
    {
      "block_size_m": 16,
      "block_size_n": 64,
      "block_size_k": 64,
      "group_size_m": 1,
      "num_warps": 2,
      "num_stages": 1,
      "align_block_size": 64
    },
    {
      "block_size_m": 16,
      "block_size_n": 64,
      "block_size_k": 64,
      "group_size_m": 1,
      "num_warps": 2,
      "num_stages": 2,
      "align_block_size": 8
    },
    {
      "block_size_m": 16,
      "block_size_n": 64,
      "block_size_k": 64,
      "group_size_m": 1,
      "num_warps": 2,
      "num_stages": 2,
      "align_block_size": 16
    },
    {
      "block_size_m": 16,
      "block_size_n": 64,
      "block_size_k": 64,
      "group_size_m": 1,
      "num_warps": 2,
      "num_stages": 2,
      "align_block_size": 32
    },
    {
      "block_size_m": 16,
      "block_size_n": 64,
      "block_size_k": 64,
      "group_size_m": 1,
      "num_warps": 2,
      "num_stages": 2,
      "align_block_size": 64
    },
    {
      "block_size_m": 16,
      "block_size_n": 64,
      "block_size_k": 64,
      "group_size_m": 1,
      "num_warps": 2,
      "num_stages": 3,
      "align_block_size": 8
    },
    {
      "block_size_m": 16,
      "block_size_n": 64,
      "block_size_k": 64,
      "group_size_m": 1,
      "num_warps": 2,
      "num_stages": 3,
      "align_block_size": 16
    },
    {
      "block_size_m": 16,
      "block_size_n": 64,
      "block_size_k": 64,
      "group_size_m": 1,
      "num_warps": 2,
      "num_stages": 3,
      "align_block_size": 32
    },
    {
      "block_size_m": 16,
      "block_size_n": 64,
      "block_size_k": 64,
      "group_size_m": 1,
      "num_warps": 2,
      "num_stages": 3,
      "align_block_size": 64
    },
    {
      "block_size_m": 16,
      "block_size_n": 64,
      "block_size_k": 64,
      "group_size_m": 1,
      "num_warps": 4,
      "num_stages": 1,
      "align_block_size": 8
    },
    {
      "block_size_m": 16,
      "block_size_n": 64,
      "block_size_k": 64,
      "group_size_m": 1,
      "num_warps": 4,
      "num_stages": 1,
      "align_block_size": 16
    },
    {
      "block_size_m": 16,
      "block_size_n": 64,
      "block_size_k": 64,
      "group_size_m": 1,
      "num_warps": 4,
      "num_stages": 1,
      "align_block_size": 32
    },
    {
      "block_size_m": 16,
      "block_size_n": 64,
      "block_size_k": 64,
      "group_size_m": 1,
      "num_warps": 4,
      "num_stages": 1,
      "align_block_size": 64
    },
    {
      "block_size_m": 16,
      "block_size_n": 64,
      "block_size_k": 64,
      "group_size_m": 1,
      "num_warps": 4,
      "num_stages": 2,
      "align_block_size": 8
    },
    {
      "block_size_m": 16,
      "block_size_n": 64,
      "block_size_k": 64,
      "group_size_m": 1,
      "num_warps": 4,
      "num_stages": 2,
      "align_block_size": 16
    },
    {
      "block_size_m": 16,
      "block_size_n": 64,
      "block_size_k": 64,
      "group_size_m": 1,
      "num_warps": 4,
      "num_stages": 2,
      "align_block_size": 32
    },
    {
      "block_size_m": 16,
      "block_size_n": 64,
      "block_size_k": 64,
      "group_size_m": 1,
      "num_warps": 4,
      "num_stages": 2,
      "align_block_size": 64
    },
    {
      "block_size_m": 16,
      "block_size_n": 64,
      "block_size_k": 64,
      "group_size_m": 1,
      "num_warps": 4,
      "num_stages": 3,
      "align_block_size": 8
    },
    {
      "block_size_m": 16,
      "block_size_n": 64,
      "block_size_k": 64,
      "group_size_m": 1,
      "num_warps": 4,
      "num_stages": 3,
      "align_block_size": 16
    },
    {
      "block_size_m": 16,
      "block_size_n": 64,
      "block_size_k": 64,
      "group_size_m": 1,
      "num_warps": 4,
      "num_stages": 3,
      "align_block_size": 32
    },
    {
      "block_size_m": 16,
      "block_size_n": 64,
      "block_size_k": 64,
      "group_size_m": 1,
      "num_warps": 4,
      "num_stages": 3,
      "align_block_size": 64
    },
    {
      "block_size_m": 16,
      "block_size_n": 64,
      "block_size_k": 64,
      "group_size_m": 1,
      "num_warps": 8,
      "num_stages": 1,
      "align_block_size": 8
    },
    {
      "block_size_m": 16,
      "block_size_n": 64,
      "block_size_k": 64,
      "group_size_m": 1,
      "num_warps": 8,
      "num_stages": 1,
      "align_block_size": 16
    },
    {
      "block_size_m": 16,
      "block_size_n": 64,
      "block_size_k": 64,
      "group_size_m": 1,
      "num_warps": 8,
      "num_stages": 1,
      "align_block_size": 32
    },
    {
      "block_size_m": 16,
      "block_size_n": 64,
      "block_size_k": 64,
      "group_size_m": 1,
      "num_warps": 8,
      "num_stages": 1,
      "align_block_size": 64
    },
    {
      "block_size_m": 16,
      "block_size_n": 64,
      "block_size_k": 64,
      "group_size_m": 1,
      "num_warps": 8,
      "num_stages": 2,
      "align_block_size": 8
    },
    {
      "block_size_m": 16,
      "block_size_n": 64,
      "block_size_k": 64,
      "group_size_m": 1,
      "num_warps": 8,
      "num_stages": 2,
      "align_block_size": 16
    },
    {
      "block_size_m": 16,
      "block_size_n": 64,
      "block_size_k": 64,
      "group_size_m": 1,
      "num_warps": 8,
      "num_stages": 2,
      "align_block_size": 32
    },
    {
      "block_size_m": 16,
      "block_size_n": 64,
      "block_size_k": 64,
      "group_size_m": 1,
      "num_warps": 8,
      "num_stages": 2,
      "align_block_size": 64
    },
    {
      "block_size_m": 16,
      "block_size_n": 64,
      "block_size_k": 64,
      "group_size_m": 1,
      "num_warps": 8,
      "num_stages": 3,
      "align_block_size": 8
    },
    {
      "block_size_m": 16,
      "block_size_n": 64,
      "block_size_k": 64,
      "group_size_m": 1,
      "num_warps": 8,
      "num_stages": 3,
      "align_block_size": 16
    },
    {
      "block_size_m": 16,
      "block_size_n": 64,
      "block_size_k": 64,
      "group_size_m": 1,
      "num_warps": 8,
      "num_stages": 3,
      "align_block_size": 32
    },
    {
      "block_size_m": 16,
      "block_size_n": 64,
      "block_size_k": 64,
      "group_size_m": 1,
      "num_warps": 8,
      "num_stages": 3,
      "align_block_size": 64
    },
    {
      "block_size_m": 16,
      "block_size_n": 64,
      "block_size_k": 64,
      "group_size_m": 4,
      "num_warps": 2,
      "num_stages": 1,
      "align_block_size": 8
    },
    {
      "block_size_m": 16,
      "block_size_n": 64,
      "block_size_k": 64,
      "group_size_m": 4,
      "num_warps": 2,
      "num_stages": 1,
      "align_block_size": 16
    },
    {
      "block_size_m": 16,
      "block_size_n": 64,
      "block_size_k": 64,
      "group_size_m": 4,
      "num_warps": 2,
      "num_stages": 1,
      "align_block_size": 32
    },
    {
      "block_size_m": 16,
      "block_size_n": 64,
      "block_size_k": 64,
      "group_size_m": 4,
      "num_warps": 2,
      "num_stages": 1,
      "align_block_size": 64
    },
    {
      "block_size_m": 16,
      "block_size_n": 64,
      "block_size_k": 64,
      "group_size_m": 4,
      "num_warps": 2,
      "num_stages": 2,
      "align_block_size": 8
    },
    {
      "block_size_m": 16,
      "block_size_n": 64,
      "block_size_k": 64,
      "group_size_m": 4,
      "num_warps": 2,
      "num_stages": 2,
      "align_block_size": 16
    },
    {
      "block_size_m": 16,
      "block_size_n": 64,
      "block_size_k": 64,
      "group_size_m": 4,
      "num_warps": 2,
      "num_stages": 2,
      "align_block_size": 32
    },
    {
      "block_size_m": 16,
      "block_size_n": 64,
      "block_size_k": 64,
      "group_size_m": 4,
      "num_warps": 2,
      "num_stages": 2,
      "align_block_size": 64
    },
    {
      "block_size_m": 16,
      "block_size_n": 64,
      "block_size_k": 64,
      "group_size_m": 4,
      "num_warps": 2,
      "num_stages": 3,
      "align_block_size": 8
    },
    {
      "block_size_m": 16,
      "block_size_n": 64,
      "block_size_k": 64,
      "group_size_m": 4,
      "num_warps": 2,
      "num_stages": 3,
      "align_block_size": 16
    },
    {
      "block_size_m": 16,
      "block_size_n": 64,
      "block_size_k": 64,
      "group_size_m": 4,
      "num_warps": 2,
      "num_stages": 3,
      "align_block_size": 32
    },
    {
      "block_size_m": 16,
      "block_size_n": 64,
      "block_size_k": 64,
      "group_size_m": 4,
      "num_warps": 2,
      "num_stages": 3,
      "align_block_size": 64
    },
    {
      "block_size_m": 16,
      "block_size_n": 64,
      "block_size_k": 64,
      "group_size_m": 4,
      "num_warps": 4,
      "num_stages": 1,
      "align_block_size": 8
    },
    {
      "block_size_m": 16,
      "block_size_n": 64,
      "block_size_k": 64,
      "group_size_m": 4,
      "num_warps": 4,
      "num_stages": 1,
      "align_block_size": 16
    },
    {
      "block_size_m": 16,
      "block_size_n": 64,
      "block_size_k": 64,
      "group_size_m": 4,
      "num_warps": 4,
      "num_stages": 1,
      "align_block_size": 32
    },
    {
      "block_size_m": 16,
      "block_size_n": 64,
      "block_size_k": 64,
      "group_size_m": 4,
      "num_warps": 4,
      "num_stages": 1,
      "align_block_size": 64
    },
    {
      "block_size_m": 16,
      "block_size_n": 64,
      "block_size_k": 64,
      "group_size_m": 4,
      "num_warps": 4,
      "num_stages": 2,
      "align_block_size": 8
    },
    {
      "block_size_m": 16,
      "block_size_n": 64,
      "block_size_k": 64,
      "group_size_m": 4,
      "num_warps": 4,
      "num_stages": 2,
      "align_block_size": 16
    },
    {
      "block_size_m": 16,
      "block_size_n": 64,
      "block_size_k": 64,
      "group_size_m": 4,
      "num_warps": 4,
      "num_stages": 2,
      "align_block_size": 32
    },
    {
      "block_size_m": 16,
      "block_size_n": 64,
      "block_size_k": 64,
      "group_size_m": 4,
      "num_warps": 4,
      "num_stages": 2,
      "align_block_size": 64
    },
    {
      "block_size_m": 16,
      "block_size_n": 64,
      "block_size_k": 64,
      "group_size_m": 4,
      "num_warps": 4,
      "num_stages": 3,
      "align_block_size": 8
    },
    {
      "block_size_m": 16,
      "block_size_n": 64,
      "block_size_k": 64,
      "group_size_m": 4,
      "num_warps": 4,
      "num_stages": 3,
      "align_block_size": 16
    },
    {
      "block_size_m": 16,
      "block_size_n": 64,
      "block_size_k": 64,
      "group_size_m": 4,
      "num_warps": 4,
      "num_stages": 3,
      "align_block_size": 32
    },
    {
      "block_size_m": 16,
      "block_size_n": 64,
      "block_size_k": 64,
      "group_size_m": 4,
      "num_warps": 4,
      "num_stages": 3,
      "align_block_size": 64
    },
    {
      "block_size_m": 16,
      "block_size_n": 64,
      "block_size_k": 64,
      "group_size_m": 4,
      "num_warps": 8,
      "num_stages": 1,
      "align_block_size": 8
    },
    {
      "block_size_m": 16,
      "block_size_n": 64,
      "block_size_k": 64,
      "group_size_m": 4,
      "num_warps": 8,
      "num_stages": 1,
      "align_block_size": 16
    },
    {
      "block_size_m": 16,
      "block_size_n": 64,
      "block_size_k": 64,
      "group_size_m": 4,
      "num_warps": 8,
      "num_stages": 1,
      "align_block_size": 32
    },
    {
      "block_size_m": 16,
      "block_size_n": 64,
      "block_size_k": 64,
      "group_size_m": 4,
      "num_warps": 8,
      "num_stages": 1,
      "align_block_size": 64
    },
    {
      "block_size_m": 16,
      "block_size_n": 64,
      "block_size_k": 64,
      "group_size_m": 4,
      "num_warps": 8,
      "num_stages": 2,
      "align_block_size": 8
    },
    {
      "block_size_m": 16,
      "block_size_n": 64,
      "block_size_k": 64,
      "group_size_m": 4,
      "num_warps": 8,
      "num_stages": 2,
      "align_block_size": 16
    },
    {
      "block_size_m": 16,
      "block_size_n": 64,
      "block_size_k": 64,
      "group_size_m": 4,
      "num_warps": 8,
      "num_stages": 2,
      "align_block_size": 32
    },
    {
      "block_size_m": 16,
      "block_size_n": 64,
      "block_size_k": 64,
      "group_size_m": 4,
      "num_warps": 8,
      "num_stages": 2,
      "align_block_size": 64
    },
    {
      "block_size_m": 16,
      "block_size_n": 64,
      "block_size_k": 64,
      "group_size_m": 4,
      "num_warps": 8,
      "num_stages": 3,
      "align_block_size": 8
    },
    {
      "block_size_m": 16,
      "block_size_n": 64,
      "block_size_k": 64,
      "group_size_m": 4,
      "num_warps": 8,
      "num_stages": 3,
      "align_block_size": 16
    },
    {
      "block_size_m": 16,
      "block_size_n": 64,
      "block_size_k": 64,
      "group_size_m": 4,
      "num_warps": 8,
      "num_stages": 3,
      "align_block_size": 32
    },
    {
      "block_size_m": 16,
      "block_size_n": 64,
      "block_size_k": 64,
      "group_size_m": 4,
      "num_warps": 8,
      "num_stages": 3,
      "align_block_size": 64
    },
    {
      "block_size_m": 16,
      "block_size_n": 64,
      "block_size_k": 64,
      "group_size_m": 8,
      "num_warps": 2,
      "num_stages": 1,
      "align_block_size": 8
    },
    {
      "block_size_m": 16,
      "block_size_n": 64,
      "block_size_k": 64,
      "group_size_m": 8,
      "num_warps": 2,
      "num_stages": 1,
      "align_block_size": 16
    },
    {
      "block_size_m": 16,
      "block_size_n": 64,
      "block_size_k": 64,
      "group_size_m": 8,
      "num_warps": 2,
      "num_stages": 1,
      "align_block_size": 32
    },
    {
      "block_size_m": 16,
      "block_size_n": 64,
      "block_size_k": 64,
      "group_size_m": 8,
      "num_warps": 2,
      "num_stages": 1,
      "align_block_size": 64
    },
    {
      "block_size_m": 16,
      "block_size_n": 64,
      "block_size_k": 64,
      "group_size_m": 8,
      "num_warps": 2,
      "num_stages": 2,
      "align_block_size": 8
    },
    {
      "block_size_m": 16,
      "block_size_n": 64,
      "block_size_k": 64,
      "group_size_m": 8,
      "num_warps": 2,
      "num_stages": 2,
      "align_block_size": 16
    },
    {
      "block_size_m": 16,
      "block_size_n": 64,
      "block_size_k": 64,
      "group_size_m": 8,
      "num_warps": 2,
      "num_stages": 2,
      "align_block_size": 32
    },
    {
      "block_size_m": 16,
      "block_size_n": 64,
      "block_size_k": 64,
      "group_size_m": 8,
      "num_warps": 2,
      "num_stages": 2,
      "align_block_size": 64
    },
    {
      "block_size_m": 16,
      "block_size_n": 64,
      "block_size_k": 64,
      "group_size_m": 8,
      "num_warps": 2,
      "num_stages": 3,
      "align_block_size": 8
    },
    {
      "block_size_m": 16,
      "block_size_n": 64,
      "block_size_k": 64,
      "group_size_m": 8,
      "num_warps": 2,
      "num_stages": 3,
      "align_block_size": 16
    },
    {
      "block_size_m": 16,
      "block_size_n": 64,
      "block_size_k": 64,
      "group_size_m": 8,
      "num_warps": 2,
      "num_stages": 3,
      "align_block_size": 32
    },
    {
      "block_size_m": 16,
      "block_size_n": 64,
      "block_size_k": 64,
      "group_size_m": 8,
      "num_warps": 2,
      "num_stages": 3,
      "align_block_size": 64
    },
    {
      "block_size_m": 16,
      "block_size_n": 64,
      "block_size_k": 64,
      "group_size_m": 8,
      "num_warps": 4,
      "num_stages": 1,
      "align_block_size": 8
    },
    {
      "block_size_m": 16,
      "block_size_n": 64,
      "block_size_k": 64,
      "group_size_m": 8,
      "num_warps": 4,
      "num_stages": 1,
      "align_block_size": 16
    },
    {
      "block_size_m": 16,
      "block_size_n": 64,
      "block_size_k": 64,
      "group_size_m": 8,
      "num_warps": 4,
      "num_stages": 1,
      "align_block_size": 32
    },
    {
      "block_size_m": 16,
      "block_size_n": 64,
      "block_size_k": 64,
      "group_size_m": 8,
      "num_warps": 4,
      "num_stages": 1,
      "align_block_size": 64
    },
    {
      "block_size_m": 16,
      "block_size_n": 64,
      "block_size_k": 64,
      "group_size_m": 8,
      "num_warps": 4,
      "num_stages": 2,
      "align_block_size": 8
    },
    {
      "block_size_m": 16,
      "block_size_n": 64,
      "block_size_k": 64,
      "group_size_m": 8,
      "num_warps": 4,
      "num_stages": 2,
      "align_block_size": 16
    },
    {
      "block_size_m": 16,
      "block_size_n": 64,
      "block_size_k": 64,
      "group_size_m": 8,
      "num_warps": 4,
      "num_stages": 2,
      "align_block_size": 32
    },
    {
      "block_size_m": 16,
      "block_size_n": 64,
      "block_size_k": 64,
      "group_size_m": 8,
      "num_warps": 4,
      "num_stages": 2,
      "align_block_size": 64
    },
    {
      "block_size_m": 16,
      "block_size_n": 64,
      "block_size_k": 64,
      "group_size_m": 8,
      "num_warps": 4,
      "num_stages": 3,
      "align_block_size": 8
    },
    {
      "block_size_m": 16,
      "block_size_n": 64,
      "block_size_k": 64,
      "group_size_m": 8,
      "num_warps": 4,
      "num_stages": 3,
      "align_block_size": 16
    },
    {
      "block_size_m": 16,
      "block_size_n": 64,
      "block_size_k": 64,
      "group_size_m": 8,
      "num_warps": 4,
      "num_stages": 3,
      "align_block_size": 32
    },
    {
      "block_size_m": 16,
      "block_size_n": 64,
      "block_size_k": 64,
      "group_size_m": 8,
      "num_warps": 4,
      "num_stages": 3,
      "align_block_size": 64
    },
    {
      "block_size_m": 16,
      "block_size_n": 64,
      "block_size_k": 64,
      "group_size_m": 8,
      "num_warps": 8,
      "num_stages": 1,
      "align_block_size": 8
    },
    {
      "block_size_m": 16,
      "block_size_n": 64,
      "block_size_k": 64,
      "group_size_m": 8,
      "num_warps": 8,
      "num_stages": 1,
      "align_block_size": 16
    },
    {
      "block_size_m": 16,
      "block_size_n": 64,
      "block_size_k": 64,
      "group_size_m": 8,
      "num_warps": 8,
      "num_stages": 1,
      "align_block_size": 32
    },
    {
      "block_size_m": 16,
      "block_size_n": 64,
      "block_size_k": 64,
      "group_size_m": 8,
      "num_warps": 8,
      "num_stages": 1,
      "align_block_size": 64
    },
    {
      "block_size_m": 16,
      "block_size_n": 64,
      "block_size_k": 64,
      "group_size_m": 8,
      "num_warps": 8,
      "num_stages": 2,
      "align_block_size": 8
    },
    {
      "block_size_m": 16,
      "block_size_n": 64,
      "block_size_k": 64,
      "group_size_m": 8,
      "num_warps": 8,
      "num_stages": 2,
      "align_block_size": 16
    },
    {
      "block_size_m": 16,
      "block_size_n": 64,
      "block_size_k": 64,
      "group_size_m": 8,
      "num_warps": 8,
      "num_stages": 2,
      "align_block_size": 32
    },
    {
      "block_size_m": 16,
      "block_size_n": 64,
      "block_size_k": 64,
      "group_size_m": 8,
      "num_warps": 8,
      "num_stages": 2,
      "align_block_size": 64
    },
    {
      "block_size_m": 16,
      "block_size_n": 64,
      "block_size_k": 64,
      "group_size_m": 8,
      "num_warps": 8,
      "num_stages": 3,
      "align_block_size": 8
    },
    {
      "block_size_m": 16,
      "block_size_n": 64,
      "block_size_k": 64,
      "group_size_m": 8,
      "num_warps": 8,
      "num_stages": 3,
      "align_block_size": 16
    },
    {
      "block_size_m": 16,
      "block_size_n": 64,
      "block_size_k": 64,
      "group_size_m": 8,
      "num_warps": 8,
      "num_stages": 3,
      "align_block_size": 32
    },
    {
      "block_size_m": 16,
      "block_size_n": 64,
      "block_size_k": 64,
      "group_size_m": 8,
      "num_warps": 8,
      "num_stages": 3,
      "align_block_size": 64
    },
    {
      "block_size_m": 16,
      "block_size_n": 64,
      "block_size_k": 64,
      "group_size_m": 16,
      "num_warps": 2,
      "num_stages": 1,
      "align_block_size": 8
    },
    {
      "block_size_m": 16,
      "block_size_n": 64,
      "block_size_k": 64,
      "group_size_m": 16,
      "num_warps": 2,
      "num_stages": 1,
      "align_block_size": 16
    },
    {
      "block_size_m": 16,
      "block_size_n": 64,
      "block_size_k": 64,
      "group_size_m": 16,
      "num_warps": 2,
      "num_stages": 1,
      "align_block_size": 32
    },
    {
      "block_size_m": 16,
      "block_size_n": 64,
      "block_size_k": 64,
      "group_size_m": 16,
      "num_warps": 2,
      "num_stages": 1,
      "align_block_size": 64
    },
    {
      "block_size_m": 16,
      "block_size_n": 64,
      "block_size_k": 64,
      "group_size_m": 16,
      "num_warps": 2,
      "num_stages": 2,
      "align_block_size": 8
    },
    {
      "block_size_m": 16,
      "block_size_n": 64,
      "block_size_k": 64,
      "group_size_m": 16,
      "num_warps": 2,
      "num_stages": 2,
      "align_block_size": 16
    },
    {
      "block_size_m": 16,
      "block_size_n": 64,
      "block_size_k": 64,
      "group_size_m": 16,
      "num_warps": 2,
      "num_stages": 2,
      "align_block_size": 32
    },
    {
      "block_size_m": 16,
      "block_size_n": 64,
      "block_size_k": 64,
      "group_size_m": 16,
      "num_warps": 2,
      "num_stages": 2,
      "align_block_size": 64
    },
    {
      "block_size_m": 16,
      "block_size_n": 64,
      "block_size_k": 64,
      "group_size_m": 16,
      "num_warps": 2,
      "num_stages": 3,
      "align_block_size": 8
    },
    {
      "block_size_m": 16,
      "block_size_n": 64,
      "block_size_k": 64,
      "group_size_m": 16,
      "num_warps": 2,
      "num_stages": 3,
      "align_block_size": 16
    },
    {
      "block_size_m": 16,
      "block_size_n": 64,
      "block_size_k": 64,
      "group_size_m": 16,
      "num_warps": 2,
      "num_stages": 3,
      "align_block_size": 32
    },
    {
      "block_size_m": 16,
      "block_size_n": 64,
      "block_size_k": 64,
      "group_size_m": 16,
      "num_warps": 2,
      "num_stages": 3,
      "align_block_size": 64
    },
    {
      "block_size_m": 16,
      "block_size_n": 64,
      "block_size_k": 64,
      "group_size_m": 16,
      "num_warps": 4,
      "num_stages": 1,
      "align_block_size": 8
    },
    {
      "block_size_m": 16,
      "block_size_n": 64,
      "block_size_k": 64,
      "group_size_m": 16,
      "num_warps": 4,
      "num_stages": 1,
      "align_block_size": 16
    },
    {
      "block_size_m": 16,
      "block_size_n": 64,
      "block_size_k": 64,
      "group_size_m": 16,
      "num_warps": 4,
      "num_stages": 1,
      "align_block_size": 32
    },
    {
      "block_size_m": 16,
      "block_size_n": 64,
      "block_size_k": 64,
      "group_size_m": 16,
      "num_warps": 4,
      "num_stages": 1,
      "align_block_size": 64
    },
    {
      "block_size_m": 16,
      "block_size_n": 64,
      "block_size_k": 64,
      "group_size_m": 16,
      "num_warps": 4,
      "num_stages": 2,
      "align_block_size": 8
    },
    {
      "block_size_m": 16,
      "block_size_n": 64,
      "block_size_k": 64,
      "group_size_m": 16,
      "num_warps": 4,
      "num_stages": 2,
      "align_block_size": 16
    },
    {
      "block_size_m": 16,
      "block_size_n": 64,
      "block_size_k": 64,
      "group_size_m": 16,
      "num_warps": 4,
      "num_stages": 2,
      "align_block_size": 32
    },
    {
      "block_size_m": 16,
      "block_size_n": 64,
      "block_size_k": 64,
      "group_size_m": 16,
      "num_warps": 4,
      "num_stages": 2,
      "align_block_size": 64
    },
    {
      "block_size_m": 16,
      "block_size_n": 64,
      "block_size_k": 64,
      "group_size_m": 16,
      "num_warps": 4,
      "num_stages": 3,
      "align_block_size": 8
    },
    {
      "block_size_m": 16,
      "block_size_n": 64,
      "block_size_k": 64,
      "group_size_m": 16,
      "num_warps": 4,
      "num_stages": 3,
      "align_block_size": 16
    },
    {
      "block_size_m": 16,
      "block_size_n": 64,
      "block_size_k": 64,
      "group_size_m": 16,
      "num_warps": 4,
      "num_stages": 3,
      "align_block_size": 32
    },
    {
      "block_size_m": 16,
      "block_size_n": 64,
      "block_size_k": 64,
      "group_size_m": 16,
      "num_warps": 4,
      "num_stages": 3,
      "align_block_size": 64
    },
    {
      "block_size_m": 16,
      "block_size_n": 64,
      "block_size_k": 64,
      "group_size_m": 16,
      "num_warps": 8,
      "num_stages": 1,
      "align_block_size": 8
    },
    {
      "block_size_m": 16,
      "block_size_n": 64,
      "block_size_k": 64,
      "group_size_m": 16,
      "num_warps": 8,
      "num_stages": 1,
      "align_block_size": 16
    },
    {
      "block_size_m": 16,
      "block_size_n": 64,
      "block_size_k": 64,
      "group_size_m": 16,
      "num_warps": 8,
      "num_stages": 1,
      "align_block_size": 32
    },
    {
      "block_size_m": 16,
      "block_size_n": 64,
      "block_size_k": 64,
      "group_size_m": 16,
      "num_warps": 8,
      "num_stages": 1,
      "align_block_size": 64
    },
    {
      "block_size_m": 16,
      "block_size_n": 64,
      "block_size_k": 64,
      "group_size_m": 16,
      "num_warps": 8,
      "num_stages": 2,
      "align_block_size": 8
    },
    {
      "block_size_m": 16,
      "block_size_n": 64,
      "block_size_k": 64,
      "group_size_m": 16,
      "num_warps": 8,
      "num_stages": 2,
      "align_block_size": 16
    },
    {
      "block_size_m": 16,
      "block_size_n": 64,
      "block_size_k": 64,
      "group_size_m": 16,
      "num_warps": 8,
      "num_stages": 2,
      "align_block_size": 32
    },
    {
      "block_size_m": 16,
      "block_size_n": 64,
      "block_size_k": 64,
      "group_size_m": 16,
      "num_warps": 8,
      "num_stages": 2,
      "align_block_size": 64
    },
    {
      "block_size_m": 16,
      "block_size_n": 64,
      "block_size_k": 64,
      "group_size_m": 16,
      "num_warps": 8,
      "num_stages": 3,
      "align_block_size": 8
    },
    {
      "block_size_m": 16,
      "block_size_n": 64,
      "block_size_k": 64,
      "group_size_m": 16,
      "num_warps": 8,
      "num_stages": 3,
      "align_block_size": 16
    },
    {
      "block_size_m": 16,
      "block_size_n": 64,
      "block_size_k": 64,
      "group_size_m": 16,
      "num_warps": 8,
      "num_stages": 3,
      "align_block_size": 32
    },
    {
      "block_size_m": 16,
      "block_size_n": 64,
      "block_size_k": 64,
      "group_size_m": 16,
      "num_warps": 8,
      "num_stages": 3,
      "align_block_size": 64
    },
    {
      "block_size_m": 16,
      "block_size_n": 64,
      "block_size_k": 128,
      "group_size_m": 1,
      "num_warps": 2,
      "num_stages": 1,
      "align_block_size": 8
    },
    {
      "block_size_m": 16,
      "block_size_n": 64,
      "block_size_k": 128,
      "group_size_m": 1,
      "num_warps": 2,
      "num_stages": 1,
      "align_block_size": 16
    },
    {
      "block_size_m": 16,
      "block_size_n": 64,
      "block_size_k": 128,
      "group_size_m": 1,
      "num_warps": 2,
      "num_stages": 1,
      "align_block_size": 32
    },
    {
      "block_size_m": 16,
      "block_size_n": 64,
      "block_size_k": 128,
      "group_size_m": 1,
      "num_warps": 2,
      "num_stages": 1,
      "align_block_size": 64
    },
    {
      "block_size_m": 16,
      "block_size_n": 64,
      "block_size_k": 128,
      "group_size_m": 1,
      "num_warps": 2,
      "num_stages": 2,
      "align_block_size": 8
    },
    {
      "block_size_m": 16,
      "block_size_n": 64,
      "block_size_k": 128,
      "group_size_m": 1,
      "num_warps": 2,
      "num_stages": 2,
      "align_block_size": 16
    },
    {
      "block_size_m": 16,
      "block_size_n": 64,
      "block_size_k": 128,
      "group_size_m": 1,
      "num_warps": 2,
      "num_stages": 2,
      "align_block_size": 32
    },
    {
      "block_size_m": 16,
      "block_size_n": 64,
      "block_size_k": 128,
      "group_size_m": 1,
      "num_warps": 2,
      "num_stages": 2,
      "align_block_size": 64
    },
    {
      "block_size_m": 16,
      "block_size_n": 64,
      "block_size_k": 128,
      "group_size_m": 1,
      "num_warps": 2,
      "num_stages": 3,
      "align_block_size": 8
    },
    {
      "block_size_m": 16,
      "block_size_n": 64,
      "block_size_k": 128,
      "group_size_m": 1,
      "num_warps": 2,
      "num_stages": 3,
      "align_block_size": 16
    },
    {
      "block_size_m": 16,
      "block_size_n": 64,
      "block_size_k": 128,
      "group_size_m": 1,
      "num_warps": 2,
      "num_stages": 3,
      "align_block_size": 32
    },
    {
      "block_size_m": 16,
      "block_size_n": 64,
      "block_size_k": 128,
      "group_size_m": 1,
      "num_warps": 2,
      "num_stages": 3,
      "align_block_size": 64
    },
    {
      "block_size_m": 16,
      "block_size_n": 64,
      "block_size_k": 128,
      "group_size_m": 1,
      "num_warps": 4,
      "num_stages": 1,
      "align_block_size": 8
    },
    {
      "block_size_m": 16,
      "block_size_n": 64,
      "block_size_k": 128,
      "group_size_m": 1,
      "num_warps": 4,
      "num_stages": 1,
      "align_block_size": 16
    },
    {
      "block_size_m": 16,
      "block_size_n": 64,
      "block_size_k": 128,
      "group_size_m": 1,
      "num_warps": 4,
      "num_stages": 1,
      "align_block_size": 32
    },
    {
      "block_size_m": 16,
      "block_size_n": 64,
      "block_size_k": 128,
      "group_size_m": 1,
      "num_warps": 4,
      "num_stages": 1,
      "align_block_size": 64
    },
    {
      "block_size_m": 16,
      "block_size_n": 64,
      "block_size_k": 128,
      "group_size_m": 1,
      "num_warps": 4,
      "num_stages": 2,
      "align_block_size": 8
    },
    {
      "block_size_m": 16,
      "block_size_n": 64,
      "block_size_k": 128,
      "group_size_m": 1,
      "num_warps": 4,
      "num_stages": 2,
      "align_block_size": 16
    },
    {
      "block_size_m": 16,
      "block_size_n": 64,
      "block_size_k": 128,
      "group_size_m": 1,
      "num_warps": 4,
      "num_stages": 2,
      "align_block_size": 32
    },
    {
      "block_size_m": 16,
      "block_size_n": 64,
      "block_size_k": 128,
      "group_size_m": 1,
      "num_warps": 4,
      "num_stages": 2,
      "align_block_size": 64
    },
    {
      "block_size_m": 16,
      "block_size_n": 64,
      "block_size_k": 128,
      "group_size_m": 1,
      "num_warps": 4,
      "num_stages": 3,
      "align_block_size": 8
    },
    {
      "block_size_m": 16,
      "block_size_n": 64,
      "block_size_k": 128,
      "group_size_m": 1,
      "num_warps": 4,
      "num_stages": 3,
      "align_block_size": 16
    },
    {
      "block_size_m": 16,
      "block_size_n": 64,
      "block_size_k": 128,
      "group_size_m": 1,
      "num_warps": 4,
      "num_stages": 3,
      "align_block_size": 32
    },
    {
      "block_size_m": 16,
      "block_size_n": 64,
      "block_size_k": 128,
      "group_size_m": 1,
      "num_warps": 4,
      "num_stages": 3,
      "align_block_size": 64
    },
    {
      "block_size_m": 16,
      "block_size_n": 64,
      "block_size_k": 128,
      "group_size_m": 1,
      "num_warps": 8,
      "num_stages": 1,
      "align_block_size": 8
    },
    {
      "block_size_m": 16,
      "block_size_n": 64,
      "block_size_k": 128,
      "group_size_m": 1,
      "num_warps": 8,
      "num_stages": 1,
      "align_block_size": 16
    },
    {
      "block_size_m": 16,
      "block_size_n": 64,
      "block_size_k": 128,
      "group_size_m": 1,
      "num_warps": 8,
      "num_stages": 1,
      "align_block_size": 32
    },
    {
      "block_size_m": 16,
      "block_size_n": 64,
      "block_size_k": 128,
      "group_size_m": 1,
      "num_warps": 8,
      "num_stages": 1,
      "align_block_size": 64
    },
    {
      "block_size_m": 16,
      "block_size_n": 64,
      "block_size_k": 128,
      "group_size_m": 1,
      "num_warps": 8,
      "num_stages": 2,
      "align_block_size": 8
    },
    {
      "block_size_m": 16,
      "block_size_n": 64,
      "block_size_k": 128,
      "group_size_m": 1,
      "num_warps": 8,
      "num_stages": 2,
      "align_block_size": 16
    },
    {
      "block_size_m": 16,
      "block_size_n": 64,
      "block_size_k": 128,
      "group_size_m": 1,
      "num_warps": 8,
      "num_stages": 2,
      "align_block_size": 32
    },
    {
      "block_size_m": 16,
      "block_size_n": 64,
      "block_size_k": 128,
      "group_size_m": 1,
      "num_warps": 8,
      "num_stages": 2,
      "align_block_size": 64
    },
    {
      "block_size_m": 16,
      "block_size_n": 64,
      "block_size_k": 128,
      "group_size_m": 1,
      "num_warps": 8,
      "num_stages": 3,
      "align_block_size": 8
    },
    {
      "block_size_m": 16,
      "block_size_n": 64,
      "block_size_k": 128,
      "group_size_m": 1,
      "num_warps": 8,
      "num_stages": 3,
      "align_block_size": 16
    },
    {
      "block_size_m": 16,
      "block_size_n": 64,
      "block_size_k": 128,
      "group_size_m": 1,
      "num_warps": 8,
      "num_stages": 3,
      "align_block_size": 32
    },
    {
      "block_size_m": 16,
      "block_size_n": 64,
      "block_size_k": 128,
      "group_size_m": 1,
      "num_warps": 8,
      "num_stages": 3,
      "align_block_size": 64
    },
    {
      "block_size_m": 16,
      "block_size_n": 64,
      "block_size_k": 128,
      "group_size_m": 4,
      "num_warps": 2,
      "num_stages": 1,
      "align_block_size": 8
    },
    {
      "block_size_m": 16,
      "block_size_n": 64,
      "block_size_k": 128,
      "group_size_m": 4,
      "num_warps": 2,
      "num_stages": 1,
      "align_block_size": 16
    },
    {
      "block_size_m": 16,
      "block_size_n": 64,
      "block_size_k": 128,
      "group_size_m": 4,
      "num_warps": 2,
      "num_stages": 1,
      "align_block_size": 32
    },
    {
      "block_size_m": 16,
      "block_size_n": 64,
      "block_size_k": 128,
      "group_size_m": 4,
      "num_warps": 2,
      "num_stages": 1,
      "align_block_size": 64
    },
    {
      "block_size_m": 16,
      "block_size_n": 64,
      "block_size_k": 128,
      "group_size_m": 4,
      "num_warps": 2,
      "num_stages": 2,
      "align_block_size": 8
    },
    {
      "block_size_m": 16,
      "block_size_n": 64,
      "block_size_k": 128,
      "group_size_m": 4,
      "num_warps": 2,
      "num_stages": 2,
      "align_block_size": 16
    },
    {
      "block_size_m": 16,
      "block_size_n": 64,
      "block_size_k": 128,
      "group_size_m": 4,
      "num_warps": 2,
      "num_stages": 2,
      "align_block_size": 32
    },
    {
      "block_size_m": 16,
      "block_size_n": 64,
      "block_size_k": 128,
      "group_size_m": 4,
      "num_warps": 2,
      "num_stages": 2,
      "align_block_size": 64
    },
    {
      "block_size_m": 16,
      "block_size_n": 64,
      "block_size_k": 128,
      "group_size_m": 4,
      "num_warps": 2,
      "num_stages": 3,
      "align_block_size": 8
    },
    {
      "block_size_m": 16,
      "block_size_n": 64,
      "block_size_k": 128,
      "group_size_m": 4,
      "num_warps": 2,
      "num_stages": 3,
      "align_block_size": 16
    },
    {
      "block_size_m": 16,
      "block_size_n": 64,
      "block_size_k": 128,
      "group_size_m": 4,
      "num_warps": 2,
      "num_stages": 3,
      "align_block_size": 32
    },
    {
      "block_size_m": 16,
      "block_size_n": 64,
      "block_size_k": 128,
      "group_size_m": 4,
      "num_warps": 2,
      "num_stages": 3,
      "align_block_size": 64
    },
    {
      "block_size_m": 16,
      "block_size_n": 64,
      "block_size_k": 128,
      "group_size_m": 4,
      "num_warps": 4,
      "num_stages": 1,
      "align_block_size": 8
    },
    {
      "block_size_m": 16,
      "block_size_n": 64,
      "block_size_k": 128,
      "group_size_m": 4,
      "num_warps": 4,
      "num_stages": 1,
      "align_block_size": 16
    },
    {
      "block_size_m": 16,
      "block_size_n": 64,
      "block_size_k": 128,
      "group_size_m": 4,
      "num_warps": 4,
      "num_stages": 1,
      "align_block_size": 32
    },
    {
      "block_size_m": 16,
      "block_size_n": 64,
      "block_size_k": 128,
      "group_size_m": 4,
      "num_warps": 4,
      "num_stages": 1,
      "align_block_size": 64
    },
    {
      "block_size_m": 16,
      "block_size_n": 64,
      "block_size_k": 128,
      "group_size_m": 4,
      "num_warps": 4,
      "num_stages": 2,
      "align_block_size": 8
    },
    {
      "block_size_m": 16,
      "block_size_n": 64,
      "block_size_k": 128,
      "group_size_m": 4,
      "num_warps": 4,
      "num_stages": 2,
      "align_block_size": 16
    },
    {
      "block_size_m": 16,
      "block_size_n": 64,
      "block_size_k": 128,
      "group_size_m": 4,
      "num_warps": 4,
      "num_stages": 2,
      "align_block_size": 32
    },
    {
      "block_size_m": 16,
      "block_size_n": 64,
      "block_size_k": 128,
      "group_size_m": 4,
      "num_warps": 4,
      "num_stages": 2,
      "align_block_size": 64
    },
    {
      "block_size_m": 16,
      "block_size_n": 64,
      "block_size_k": 128,
      "group_size_m": 4,
      "num_warps": 4,
      "num_stages": 3,
      "align_block_size": 8
    },
    {
      "block_size_m": 16,
      "block_size_n": 64,
      "block_size_k": 128,
      "group_size_m": 4,
      "num_warps": 4,
      "num_stages": 3,
      "align_block_size": 16
    },
    {
      "block_size_m": 16,
      "block_size_n": 64,
      "block_size_k": 128,
      "group_size_m": 4,
      "num_warps": 4,
      "num_stages": 3,
      "align_block_size": 32
    },
    {
      "block_size_m": 16,
      "block_size_n": 64,
      "block_size_k": 128,
      "group_size_m": 4,
      "num_warps": 4,
      "num_stages": 3,
      "align_block_size": 64
    },
    {
      "block_size_m": 16,
      "block_size_n": 64,
      "block_size_k": 128,
      "group_size_m": 4,
      "num_warps": 8,
      "num_stages": 1,
      "align_block_size": 8
    },
    {
      "block_size_m": 16,
      "block_size_n": 64,
      "block_size_k": 128,
      "group_size_m": 4,
      "num_warps": 8,
      "num_stages": 1,
      "align_block_size": 16
    },
    {
      "block_size_m": 16,
      "block_size_n": 64,
      "block_size_k": 128,
      "group_size_m": 4,
      "num_warps": 8,
      "num_stages": 1,
      "align_block_size": 32
    },
    {
      "block_size_m": 16,
      "block_size_n": 64,
      "block_size_k": 128,
      "group_size_m": 4,
      "num_warps": 8,
      "num_stages": 1,
      "align_block_size": 64
    },
    {
      "block_size_m": 16,
      "block_size_n": 64,
      "block_size_k": 128,
      "group_size_m": 4,
      "num_warps": 8,
      "num_stages": 2,
      "align_block_size": 8
    },
    {
      "block_size_m": 16,
      "block_size_n": 64,
      "block_size_k": 128,
      "group_size_m": 4,
      "num_warps": 8,
      "num_stages": 2,
      "align_block_size": 16
    },
    {
      "block_size_m": 16,
      "block_size_n": 64,
      "block_size_k": 128,
      "group_size_m": 4,
      "num_warps": 8,
      "num_stages": 2,
      "align_block_size": 32
    },
    {
      "block_size_m": 16,
      "block_size_n": 64,
      "block_size_k": 128,
      "group_size_m": 4,
      "num_warps": 8,
      "num_stages": 2,
      "align_block_size": 64
    },
    {
      "block_size_m": 16,
      "block_size_n": 64,
      "block_size_k": 128,
      "group_size_m": 4,
      "num_warps": 8,
      "num_stages": 3,
      "align_block_size": 8
    },
    {
      "block_size_m": 16,
      "block_size_n": 64,
      "block_size_k": 128,
      "group_size_m": 4,
      "num_warps": 8,
      "num_stages": 3,
      "align_block_size": 16
    },
    {
      "block_size_m": 16,
      "block_size_n": 64,
      "block_size_k": 128,
      "group_size_m": 4,
      "num_warps": 8,
      "num_stages": 3,
      "align_block_size": 32
    },
    {
      "block_size_m": 16,
      "block_size_n": 64,
      "block_size_k": 128,
      "group_size_m": 4,
      "num_warps": 8,
      "num_stages": 3,
      "align_block_size": 64
    },
    {
      "block_size_m": 16,
      "block_size_n": 64,
      "block_size_k": 128,
      "group_size_m": 8,
      "num_warps": 2,
      "num_stages": 1,
      "align_block_size": 8
    },
    {
      "block_size_m": 16,
      "block_size_n": 64,
      "block_size_k": 128,
      "group_size_m": 8,
      "num_warps": 2,
      "num_stages": 1,
      "align_block_size": 16
    },
    {
      "block_size_m": 16,
      "block_size_n": 64,
      "block_size_k": 128,
      "group_size_m": 8,
      "num_warps": 2,
      "num_stages": 1,
      "align_block_size": 32
    },
    {
      "block_size_m": 16,
      "block_size_n": 64,
      "block_size_k": 128,
      "group_size_m": 8,
      "num_warps": 2,
      "num_stages": 1,
      "align_block_size": 64
    },
    {
      "block_size_m": 16,
      "block_size_n": 64,
      "block_size_k": 128,
      "group_size_m": 8,
      "num_warps": 2,
      "num_stages": 2,
      "align_block_size": 8
    },
    {
      "block_size_m": 16,
      "block_size_n": 64,
      "block_size_k": 128,
      "group_size_m": 8,
      "num_warps": 2,
      "num_stages": 2,
      "align_block_size": 16
    },
    {
      "block_size_m": 16,
      "block_size_n": 64,
      "block_size_k": 128,
      "group_size_m": 8,
      "num_warps": 2,
      "num_stages": 2,
      "align_block_size": 32
    },
    {
      "block_size_m": 16,
      "block_size_n": 64,
      "block_size_k": 128,
      "group_size_m": 8,
      "num_warps": 2,
      "num_stages": 2,
      "align_block_size": 64
    },
    {
      "block_size_m": 16,
      "block_size_n": 64,
      "block_size_k": 128,
      "group_size_m": 8,
      "num_warps": 2,
      "num_stages": 3,
      "align_block_size": 8
    },
    {
      "block_size_m": 16,
      "block_size_n": 64,
      "block_size_k": 128,
      "group_size_m": 8,
      "num_warps": 2,
      "num_stages": 3,
      "align_block_size": 16
    },
    {
      "block_size_m": 16,
      "block_size_n": 64,
      "block_size_k": 128,
      "group_size_m": 8,
      "num_warps": 2,
      "num_stages": 3,
      "align_block_size": 32
    },
    {
      "block_size_m": 16,
      "block_size_n": 64,
      "block_size_k": 128,
      "group_size_m": 8,
      "num_warps": 2,
      "num_stages": 3,
      "align_block_size": 64
    },
    {
      "block_size_m": 16,
      "block_size_n": 64,
      "block_size_k": 128,
      "group_size_m": 8,
      "num_warps": 4,
      "num_stages": 1,
      "align_block_size": 8
    },
    {
      "block_size_m": 16,
      "block_size_n": 64,
      "block_size_k": 128,
      "group_size_m": 8,
      "num_warps": 4,
      "num_stages": 1,
      "align_block_size": 16
    },
    {
      "block_size_m": 16,
      "block_size_n": 64,
      "block_size_k": 128,
      "group_size_m": 8,
      "num_warps": 4,
      "num_stages": 1,
      "align_block_size": 32
    },
    {
      "block_size_m": 16,
      "block_size_n": 64,
      "block_size_k": 128,
      "group_size_m": 8,
      "num_warps": 4,
      "num_stages": 1,
      "align_block_size": 64
    },
    {
      "block_size_m": 16,
      "block_size_n": 64,
      "block_size_k": 128,
      "group_size_m": 8,
      "num_warps": 4,
      "num_stages": 2,
      "align_block_size": 8
    },
    {
      "block_size_m": 16,
      "block_size_n": 64,
      "block_size_k": 128,
      "group_size_m": 8,
      "num_warps": 4,
      "num_stages": 2,
      "align_block_size": 16
    },
    {
      "block_size_m": 16,
      "block_size_n": 64,
      "block_size_k": 128,
      "group_size_m": 8,
      "num_warps": 4,
      "num_stages": 2,
      "align_block_size": 32
    },
    {
      "block_size_m": 16,
      "block_size_n": 64,
      "block_size_k": 128,
      "group_size_m": 8,
      "num_warps": 4,
      "num_stages": 2,
      "align_block_size": 64
    },
    {
      "block_size_m": 16,
      "block_size_n": 64,
      "block_size_k": 128,
      "group_size_m": 8,
      "num_warps": 4,
      "num_stages": 3,
      "align_block_size": 8
    },
    {
      "block_size_m": 16,
      "block_size_n": 64,
      "block_size_k": 128,
      "group_size_m": 8,
      "num_warps": 4,
      "num_stages": 3,
      "align_block_size": 16
    },
    {
      "block_size_m": 16,
      "block_size_n": 64,
      "block_size_k": 128,
      "group_size_m": 8,
      "num_warps": 4,
      "num_stages": 3,
      "align_block_size": 32
    },
    {
      "block_size_m": 16,
      "block_size_n": 64,
      "block_size_k": 128,
      "group_size_m": 8,
      "num_warps": 4,
      "num_stages": 3,
      "align_block_size": 64
    },
    {
      "block_size_m": 16,
      "block_size_n": 64,
      "block_size_k": 128,
      "group_size_m": 8,
      "num_warps": 8,
      "num_stages": 1,
      "align_block_size": 8
    },
    {
      "block_size_m": 16,
      "block_size_n": 64,
      "block_size_k": 128,
      "group_size_m": 8,
      "num_warps": 8,
      "num_stages": 1,
      "align_block_size": 16
    },
    {
      "block_size_m": 16,
      "block_size_n": 64,
      "block_size_k": 128,
      "group_size_m": 8,
      "num_warps": 8,
      "num_stages": 1,
      "align_block_size": 32
    },
    {
      "block_size_m": 16,
      "block_size_n": 64,
      "block_size_k": 128,
      "group_size_m": 8,
      "num_warps": 8,
      "num_stages": 1,
      "align_block_size": 64
    },
    {
      "block_size_m": 16,
      "block_size_n": 64,
      "block_size_k": 128,
      "group_size_m": 8,
      "num_warps": 8,
      "num_stages": 2,
      "align_block_size": 8
    },
    {
      "block_size_m": 16,
      "block_size_n": 64,
      "block_size_k": 128,
      "group_size_m": 8,
      "num_warps": 8,
      "num_stages": 2,
      "align_block_size": 16
    },
    {
      "block_size_m": 16,
      "block_size_n": 64,
      "block_size_k": 128,
      "group_size_m": 8,
      "num_warps": 8,
      "num_stages": 2,
      "align_block_size": 32
    },
    {
      "block_size_m": 16,
      "block_size_n": 64,
      "block_size_k": 128,
      "group_size_m": 8,
      "num_warps": 8,
      "num_stages": 2,
      "align_block_size": 64
    },
    {
      "block_size_m": 16,
      "block_size_n": 64,
      "block_size_k": 128,
      "group_size_m": 8,
      "num_warps": 8,
      "num_stages": 3,
      "align_block_size": 8
    },
    {
      "block_size_m": 16,
      "block_size_n": 64,
      "block_size_k": 128,
      "group_size_m": 8,
      "num_warps": 8,
      "num_stages": 3,
      "align_block_size": 16
    },
    {
      "block_size_m": 16,
      "block_size_n": 64,
      "block_size_k": 128,
      "group_size_m": 8,
      "num_warps": 8,
      "num_stages": 3,
      "align_block_size": 32
    },
    {
      "block_size_m": 16,
      "block_size_n": 64,
      "block_size_k": 128,
      "group_size_m": 8,
      "num_warps": 8,
      "num_stages": 3,
      "align_block_size": 64
    },
    {
      "block_size_m": 16,
      "block_size_n": 64,
      "block_size_k": 128,
      "group_size_m": 16,
      "num_warps": 2,
      "num_stages": 1,
      "align_block_size": 8
    },
    {
      "block_size_m": 16,
      "block_size_n": 64,
      "block_size_k": 128,
      "group_size_m": 16,
      "num_warps": 2,
      "num_stages": 1,
      "align_block_size": 16
    },
    {
      "block_size_m": 16,
      "block_size_n": 64,
      "block_size_k": 128,
      "group_size_m": 16,
      "num_warps": 2,
      "num_stages": 1,
      "align_block_size": 32
    },
    {
      "block_size_m": 16,
      "block_size_n": 64,
      "block_size_k": 128,
      "group_size_m": 16,
      "num_warps": 2,
      "num_stages": 1,
      "align_block_size": 64
    },
    {
      "block_size_m": 16,
      "block_size_n": 64,
      "block_size_k": 128,
      "group_size_m": 16,
      "num_warps": 2,
      "num_stages": 2,
      "align_block_size": 8
    },
    {
      "block_size_m": 16,
      "block_size_n": 64,
      "block_size_k": 128,
      "group_size_m": 16,
      "num_warps": 2,
      "num_stages": 2,
      "align_block_size": 16
    },
    {
      "block_size_m": 16,
      "block_size_n": 64,
      "block_size_k": 128,
      "group_size_m": 16,
      "num_warps": 2,
      "num_stages": 2,
      "align_block_size": 32
    },
    {
      "block_size_m": 16,
      "block_size_n": 64,
      "block_size_k": 128,
      "group_size_m": 16,
      "num_warps": 2,
      "num_stages": 2,
      "align_block_size": 64
    },
    {
      "block_size_m": 16,
      "block_size_n": 64,
      "block_size_k": 128,
      "group_size_m": 16,
      "num_warps": 2,
      "num_stages": 3,
      "align_block_size": 8
    },
    {
      "block_size_m": 16,
      "block_size_n": 64,
      "block_size_k": 128,
      "group_size_m": 16,
      "num_warps": 2,
      "num_stages": 3,
      "align_block_size": 16
    },
    {
      "block_size_m": 16,
      "block_size_n": 64,
      "block_size_k": 128,
      "group_size_m": 16,
      "num_warps": 2,
      "num_stages": 3,
      "align_block_size": 32
    },
    {
      "block_size_m": 16,
      "block_size_n": 64,
      "block_size_k": 128,
      "group_size_m": 16,
      "num_warps": 2,
      "num_stages": 3,
      "align_block_size": 64
    },
    {
      "block_size_m": 16,
      "block_size_n": 64,
      "block_size_k": 128,
      "group_size_m": 16,
      "num_warps": 4,
      "num_stages": 1,
      "align_block_size": 8
    },
    {
      "block_size_m": 16,
      "block_size_n": 64,
      "block_size_k": 128,
      "group_size_m": 16,
      "num_warps": 4,
      "num_stages": 1,
      "align_block_size": 16
    },
    {
      "block_size_m": 16,
      "block_size_n": 64,
      "block_size_k": 128,
      "group_size_m": 16,
      "num_warps": 4,
      "num_stages": 1,
      "align_block_size": 32
    },
    {
      "block_size_m": 16,
      "block_size_n": 64,
      "block_size_k": 128,
      "group_size_m": 16,
      "num_warps": 4,
      "num_stages": 1,
      "align_block_size": 64
    },
    {
      "block_size_m": 16,
      "block_size_n": 64,
      "block_size_k": 128,
      "group_size_m": 16,
      "num_warps": 4,
      "num_stages": 2,
      "align_block_size": 8
    },
    {
      "block_size_m": 16,
      "block_size_n": 64,
      "block_size_k": 128,
      "group_size_m": 16,
      "num_warps": 4,
      "num_stages": 2,
      "align_block_size": 16
    },
    {
      "block_size_m": 16,
      "block_size_n": 64,
      "block_size_k": 128,
      "group_size_m": 16,
      "num_warps": 4,
      "num_stages": 2,
      "align_block_size": 32
    },
    {
      "block_size_m": 16,
      "block_size_n": 64,
      "block_size_k": 128,
      "group_size_m": 16,
      "num_warps": 4,
      "num_stages": 2,
      "align_block_size": 64
    },
    {
      "block_size_m": 16,
      "block_size_n": 64,
      "block_size_k": 128,
      "group_size_m": 16,
      "num_warps": 4,
      "num_stages": 3,
      "align_block_size": 8
    },
    {
      "block_size_m": 16,
      "block_size_n": 64,
      "block_size_k": 128,
      "group_size_m": 16,
      "num_warps": 4,
      "num_stages": 3,
      "align_block_size": 16
    },
    {
      "block_size_m": 16,
      "block_size_n": 64,
      "block_size_k": 128,
      "group_size_m": 16,
      "num_warps": 4,
      "num_stages": 3,
      "align_block_size": 32
    },
    {
      "block_size_m": 16,
      "block_size_n": 64,
      "block_size_k": 128,
      "group_size_m": 16,
      "num_warps": 4,
      "num_stages": 3,
      "align_block_size": 64
    },
    {
      "block_size_m": 16,
      "block_size_n": 64,
      "block_size_k": 128,
      "group_size_m": 16,
      "num_warps": 8,
      "num_stages": 1,
      "align_block_size": 8
    },
    {
      "block_size_m": 16,
      "block_size_n": 64,
      "block_size_k": 128,
      "group_size_m": 16,
      "num_warps": 8,
      "num_stages": 1,
      "align_block_size": 16
    },
    {
      "block_size_m": 16,
      "block_size_n": 64,
      "block_size_k": 128,
      "group_size_m": 16,
      "num_warps": 8,
      "num_stages": 1,
      "align_block_size": 32
    },
    {
      "block_size_m": 16,
      "block_size_n": 64,
      "block_size_k": 128,
      "group_size_m": 16,
      "num_warps": 8,
      "num_stages": 1,
      "align_block_size": 64
    },
    {
      "block_size_m": 16,
      "block_size_n": 64,
      "block_size_k": 128,
      "group_size_m": 16,
      "num_warps": 8,
      "num_stages": 2,
      "align_block_size": 8
    },
    {
      "block_size_m": 16,
      "block_size_n": 64,
      "block_size_k": 128,
      "group_size_m": 16,
      "num_warps": 8,
      "num_stages": 2,
      "align_block_size": 16
    },
    {
      "block_size_m": 16,
      "block_size_n": 64,
      "block_size_k": 128,
      "group_size_m": 16,
      "num_warps": 8,
      "num_stages": 2,
      "align_block_size": 32
    },
    {
      "block_size_m": 16,
      "block_size_n": 64,
      "block_size_k": 128,
      "group_size_m": 16,
      "num_warps": 8,
      "num_stages": 2,
      "align_block_size": 64
    },
    {
      "block_size_m": 16,
      "block_size_n": 64,
      "block_size_k": 128,
      "group_size_m": 16,
      "num_warps": 8,
      "num_stages": 3,
      "align_block_size": 8
    },
    {
      "block_size_m": 16,
      "block_size_n": 64,
      "block_size_k": 128,
      "group_size_m": 16,
      "num_warps": 8,
      "num_stages": 3,
      "align_block_size": 16
    },
    {
      "block_size_m": 16,
      "block_size_n": 64,
      "block_size_k": 128,
      "group_size_m": 16,
      "num_warps": 8,
      "num_stages": 3,
      "align_block_size": 32
    },
    {
      "block_size_m": 16,
      "block_size_n": 64,
      "block_size_k": 128,
      "group_size_m": 16,
      "num_warps": 8,
      "num_stages": 3,
      "align_block_size": 64
    },
    {
      "block_size_m": 16,
      "block_size_n": 128,
      "block_size_k": 32,
      "group_size_m": 1,
      "num_warps": 2,
      "num_stages": 1,
      "align_block_size": 8
    },
    {
      "block_size_m": 16,
      "block_size_n": 128,
      "block_size_k": 32,
      "group_size_m": 1,
      "num_warps": 2,
      "num_stages": 1,
      "align_block_size": 16
    },
    {
      "block_size_m": 16,
      "block_size_n": 128,
      "block_size_k": 32,
      "group_size_m": 1,
      "num_warps": 2,
      "num_stages": 1,
      "align_block_size": 32
    },
    {
      "block_size_m": 16,
      "block_size_n": 128,
      "block_size_k": 32,
      "group_size_m": 1,
      "num_warps": 2,
      "num_stages": 1,
      "align_block_size": 64
    },
    {
      "block_size_m": 16,
      "block_size_n": 128,
      "block_size_k": 32,
      "group_size_m": 1,
      "num_warps": 2,
      "num_stages": 2,
      "align_block_size": 8
    },
    {
      "block_size_m": 16,
      "block_size_n": 128,
      "block_size_k": 32,
      "group_size_m": 1,
      "num_warps": 2,
      "num_stages": 2,
      "align_block_size": 16
    },
    {
      "block_size_m": 16,
      "block_size_n": 128,
      "block_size_k": 32,
      "group_size_m": 1,
      "num_warps": 2,
      "num_stages": 2,
      "align_block_size": 32
    },
    {
      "block_size_m": 16,
      "block_size_n": 128,
      "block_size_k": 32,
      "group_size_m": 1,
      "num_warps": 2,
      "num_stages": 2,
      "align_block_size": 64
    },
    {
      "block_size_m": 16,
      "block_size_n": 128,
      "block_size_k": 32,
      "group_size_m": 1,
      "num_warps": 2,
      "num_stages": 3,
      "align_block_size": 8
    },
    {
      "block_size_m": 16,
      "block_size_n": 128,
      "block_size_k": 32,
      "group_size_m": 1,
      "num_warps": 2,
      "num_stages": 3,
      "align_block_size": 16
    },
    {
      "block_size_m": 16,
      "block_size_n": 128,
      "block_size_k": 32,
      "group_size_m": 1,
      "num_warps": 2,
      "num_stages": 3,
      "align_block_size": 32
    },
    {
      "block_size_m": 16,
      "block_size_n": 128,
      "block_size_k": 32,
      "group_size_m": 1,
      "num_warps": 2,
      "num_stages": 3,
      "align_block_size": 64
    },
    {
      "block_size_m": 16,
      "block_size_n": 128,
      "block_size_k": 32,
      "group_size_m": 1,
      "num_warps": 4,
      "num_stages": 1,
      "align_block_size": 8
    },
    {
      "block_size_m": 16,
      "block_size_n": 128,
      "block_size_k": 32,
      "group_size_m": 1,
      "num_warps": 4,
      "num_stages": 1,
      "align_block_size": 16
    },
    {
      "block_size_m": 16,
      "block_size_n": 128,
      "block_size_k": 32,
      "group_size_m": 1,
      "num_warps": 4,
      "num_stages": 1,
      "align_block_size": 32
    },
    {
      "block_size_m": 16,
      "block_size_n": 128,
      "block_size_k": 32,
      "group_size_m": 1,
      "num_warps": 4,
      "num_stages": 1,
      "align_block_size": 64
    },
    {
      "block_size_m": 16,
      "block_size_n": 128,
      "block_size_k": 32,
      "group_size_m": 1,
      "num_warps": 4,
      "num_stages": 2,
      "align_block_size": 8
    },
    {
      "block_size_m": 16,
      "block_size_n": 128,
      "block_size_k": 32,
      "group_size_m": 1,
      "num_warps": 4,
      "num_stages": 2,
      "align_block_size": 16
    },
    {
      "block_size_m": 16,
      "block_size_n": 128,
      "block_size_k": 32,
      "group_size_m": 1,
      "num_warps": 4,
      "num_stages": 2,
      "align_block_size": 32
    },
    {
      "block_size_m": 16,
      "block_size_n": 128,
      "block_size_k": 32,
      "group_size_m": 1,
      "num_warps": 4,
      "num_stages": 2,
      "align_block_size": 64
    },
    {
      "block_size_m": 16,
      "block_size_n": 128,
      "block_size_k": 32,
      "group_size_m": 1,
      "num_warps": 4,
      "num_stages": 3,
      "align_block_size": 8
    },
    {
      "block_size_m": 16,
      "block_size_n": 128,
      "block_size_k": 32,
      "group_size_m": 1,
      "num_warps": 4,
      "num_stages": 3,
      "align_block_size": 16
    },
    {
      "block_size_m": 16,
      "block_size_n": 128,
      "block_size_k": 32,
      "group_size_m": 1,
      "num_warps": 4,
      "num_stages": 3,
      "align_block_size": 32
    },
    {
      "block_size_m": 16,
      "block_size_n": 128,
      "block_size_k": 32,
      "group_size_m": 1,
      "num_warps": 4,
      "num_stages": 3,
      "align_block_size": 64
    },
    {
      "block_size_m": 16,
      "block_size_n": 128,
      "block_size_k": 32,
      "group_size_m": 1,
      "num_warps": 8,
      "num_stages": 1,
      "align_block_size": 8
    },
    {
      "block_size_m": 16,
      "block_size_n": 128,
      "block_size_k": 32,
      "group_size_m": 1,
      "num_warps": 8,
      "num_stages": 1,
      "align_block_size": 16
    },
    {
      "block_size_m": 16,
      "block_size_n": 128,
      "block_size_k": 32,
      "group_size_m": 1,
      "num_warps": 8,
      "num_stages": 1,
      "align_block_size": 32
    },
    {
      "block_size_m": 16,
      "block_size_n": 128,
      "block_size_k": 32,
      "group_size_m": 1,
      "num_warps": 8,
      "num_stages": 1,
      "align_block_size": 64
    },
    {
      "block_size_m": 16,
      "block_size_n": 128,
      "block_size_k": 32,
      "group_size_m": 1,
      "num_warps": 8,
      "num_stages": 2,
      "align_block_size": 8
    },
    {
      "block_size_m": 16,
      "block_size_n": 128,
      "block_size_k": 32,
      "group_size_m": 1,
      "num_warps": 8,
      "num_stages": 2,
      "align_block_size": 16
    },
    {
      "block_size_m": 16,
      "block_size_n": 128,
      "block_size_k": 32,
      "group_size_m": 1,
      "num_warps": 8,
      "num_stages": 2,
      "align_block_size": 32
    },
    {
      "block_size_m": 16,
      "block_size_n": 128,
      "block_size_k": 32,
      "group_size_m": 1,
      "num_warps": 8,
      "num_stages": 2,
      "align_block_size": 64
    },
    {
      "block_size_m": 16,
      "block_size_n": 128,
      "block_size_k": 32,
      "group_size_m": 1,
      "num_warps": 8,
      "num_stages": 3,
      "align_block_size": 8
    },
    {
      "block_size_m": 16,
      "block_size_n": 128,
      "block_size_k": 32,
      "group_size_m": 1,
      "num_warps": 8,
      "num_stages": 3,
      "align_block_size": 16
    },
    {
      "block_size_m": 16,
      "block_size_n": 128,
      "block_size_k": 32,
      "group_size_m": 1,
      "num_warps": 8,
      "num_stages": 3,
      "align_block_size": 32
    },
    {
      "block_size_m": 16,
      "block_size_n": 128,
      "block_size_k": 32,
      "group_size_m": 1,
      "num_warps": 8,
      "num_stages": 3,
      "align_block_size": 64
    },
    {
      "block_size_m": 16,
      "block_size_n": 128,
      "block_size_k": 32,
      "group_size_m": 4,
      "num_warps": 2,
      "num_stages": 1,
      "align_block_size": 8
    },
    {
      "block_size_m": 16,
      "block_size_n": 128,
      "block_size_k": 32,
      "group_size_m": 4,
      "num_warps": 2,
      "num_stages": 1,
      "align_block_size": 16
    },
    {
      "block_size_m": 16,
      "block_size_n": 128,
      "block_size_k": 32,
      "group_size_m": 4,
      "num_warps": 2,
      "num_stages": 1,
      "align_block_size": 32
    },
    {
      "block_size_m": 16,
      "block_size_n": 128,
      "block_size_k": 32,
      "group_size_m": 4,
      "num_warps": 2,
      "num_stages": 1,
      "align_block_size": 64
    },
    {
      "block_size_m": 16,
      "block_size_n": 128,
      "block_size_k": 32,
      "group_size_m": 4,
      "num_warps": 2,
      "num_stages": 2,
      "align_block_size": 8
    },
    {
      "block_size_m": 16,
      "block_size_n": 128,
      "block_size_k": 32,
      "group_size_m": 4,
      "num_warps": 2,
      "num_stages": 2,
      "align_block_size": 16
    },
    {
      "block_size_m": 16,
      "block_size_n": 128,
      "block_size_k": 32,
      "group_size_m": 4,
      "num_warps": 2,
      "num_stages": 2,
      "align_block_size": 32
    },
    {
      "block_size_m": 16,
      "block_size_n": 128,
      "block_size_k": 32,
      "group_size_m": 4,
      "num_warps": 2,
      "num_stages": 2,
      "align_block_size": 64
    },
    {
      "block_size_m": 16,
      "block_size_n": 128,
      "block_size_k": 32,
      "group_size_m": 4,
      "num_warps": 2,
      "num_stages": 3,
      "align_block_size": 8
    },
    {
      "block_size_m": 16,
      "block_size_n": 128,
      "block_size_k": 32,
      "group_size_m": 4,
      "num_warps": 2,
      "num_stages": 3,
      "align_block_size": 16
    },
    {
      "block_size_m": 16,
      "block_size_n": 128,
      "block_size_k": 32,
      "group_size_m": 4,
      "num_warps": 2,
      "num_stages": 3,
      "align_block_size": 32
    },
    {
      "block_size_m": 16,
      "block_size_n": 128,
      "block_size_k": 32,
      "group_size_m": 4,
      "num_warps": 2,
      "num_stages": 3,
      "align_block_size": 64
    },
    {
      "block_size_m": 16,
      "block_size_n": 128,
      "block_size_k": 32,
      "group_size_m": 4,
      "num_warps": 4,
      "num_stages": 1,
      "align_block_size": 8
    },
    {
      "block_size_m": 16,
      "block_size_n": 128,
      "block_size_k": 32,
      "group_size_m": 4,
      "num_warps": 4,
      "num_stages": 1,
      "align_block_size": 16
    },
    {
      "block_size_m": 16,
      "block_size_n": 128,
      "block_size_k": 32,
      "group_size_m": 4,
      "num_warps": 4,
      "num_stages": 1,
      "align_block_size": 32
    },
    {
      "block_size_m": 16,
      "block_size_n": 128,
      "block_size_k": 32,
      "group_size_m": 4,
      "num_warps": 4,
      "num_stages": 1,
      "align_block_size": 64
    },
    {
      "block_size_m": 16,
      "block_size_n": 128,
      "block_size_k": 32,
      "group_size_m": 4,
      "num_warps": 4,
      "num_stages": 2,
      "align_block_size": 8
    },
    {
      "block_size_m": 16,
      "block_size_n": 128,
      "block_size_k": 32,
      "group_size_m": 4,
      "num_warps": 4,
      "num_stages": 2,
      "align_block_size": 16
    },
    {
      "block_size_m": 16,
      "block_size_n": 128,
      "block_size_k": 32,
      "group_size_m": 4,
      "num_warps": 4,
      "num_stages": 2,
      "align_block_size": 32
    },
    {
      "block_size_m": 16,
      "block_size_n": 128,
      "block_size_k": 32,
      "group_size_m": 4,
      "num_warps": 4,
      "num_stages": 2,
      "align_block_size": 64
    },
    {
      "block_size_m": 16,
      "block_size_n": 128,
      "block_size_k": 32,
      "group_size_m": 4,
      "num_warps": 4,
      "num_stages": 3,
      "align_block_size": 8
    },
    {
      "block_size_m": 16,
      "block_size_n": 128,
      "block_size_k": 32,
      "group_size_m": 4,
      "num_warps": 4,
      "num_stages": 3,
      "align_block_size": 16
    },
    {
      "block_size_m": 16,
      "block_size_n": 128,
      "block_size_k": 32,
      "group_size_m": 4,
      "num_warps": 4,
      "num_stages": 3,
      "align_block_size": 32
    },
    {
      "block_size_m": 16,
      "block_size_n": 128,
      "block_size_k": 32,
      "group_size_m": 4,
      "num_warps": 4,
      "num_stages": 3,
      "align_block_size": 64
    },
    {
      "block_size_m": 16,
      "block_size_n": 128,
      "block_size_k": 32,
      "group_size_m": 4,
      "num_warps": 8,
      "num_stages": 1,
      "align_block_size": 8
    },
    {
      "block_size_m": 16,
      "block_size_n": 128,
      "block_size_k": 32,
      "group_size_m": 4,
      "num_warps": 8,
      "num_stages": 1,
      "align_block_size": 16
    },
    {
      "block_size_m": 16,
      "block_size_n": 128,
      "block_size_k": 32,
      "group_size_m": 4,
      "num_warps": 8,
      "num_stages": 1,
      "align_block_size": 32
    },
    {
      "block_size_m": 16,
      "block_size_n": 128,
      "block_size_k": 32,
      "group_size_m": 4,
      "num_warps": 8,
      "num_stages": 1,
      "align_block_size": 64
    },
    {
      "block_size_m": 16,
      "block_size_n": 128,
      "block_size_k": 32,
      "group_size_m": 4,
      "num_warps": 8,
      "num_stages": 2,
      "align_block_size": 8
    },
    {
      "block_size_m": 16,
      "block_size_n": 128,
      "block_size_k": 32,
      "group_size_m": 4,
      "num_warps": 8,
      "num_stages": 2,
      "align_block_size": 16
    },
    {
      "block_size_m": 16,
      "block_size_n": 128,
      "block_size_k": 32,
      "group_size_m": 4,
      "num_warps": 8,
      "num_stages": 2,
      "align_block_size": 32
    },
    {
      "block_size_m": 16,
      "block_size_n": 128,
      "block_size_k": 32,
      "group_size_m": 4,
      "num_warps": 8,
      "num_stages": 2,
      "align_block_size": 64
    },
    {
      "block_size_m": 16,
      "block_size_n": 128,
      "block_size_k": 32,
      "group_size_m": 4,
      "num_warps": 8,
      "num_stages": 3,
      "align_block_size": 8
    },
    {
      "block_size_m": 16,
      "block_size_n": 128,
      "block_size_k": 32,
      "group_size_m": 4,
      "num_warps": 8,
      "num_stages": 3,
      "align_block_size": 16
    },
    {
      "block_size_m": 16,
      "block_size_n": 128,
      "block_size_k": 32,
      "group_size_m": 4,
      "num_warps": 8,
      "num_stages": 3,
      "align_block_size": 32
    },
    {
      "block_size_m": 16,
      "block_size_n": 128,
      "block_size_k": 32,
      "group_size_m": 4,
      "num_warps": 8,
      "num_stages": 3,
      "align_block_size": 64
    },
    {
      "block_size_m": 16,
      "block_size_n": 128,
      "block_size_k": 32,
      "group_size_m": 8,
      "num_warps": 2,
      "num_stages": 1,
      "align_block_size": 8
    },
    {
      "block_size_m": 16,
      "block_size_n": 128,
      "block_size_k": 32,
      "group_size_m": 8,
      "num_warps": 2,
      "num_stages": 1,
      "align_block_size": 16
    },
    {
      "block_size_m": 16,
      "block_size_n": 128,
      "block_size_k": 32,
      "group_size_m": 8,
      "num_warps": 2,
      "num_stages": 1,
      "align_block_size": 32
    },
    {
      "block_size_m": 16,
      "block_size_n": 128,
      "block_size_k": 32,
      "group_size_m": 8,
      "num_warps": 2,
      "num_stages": 1,
      "align_block_size": 64
    },
    {
      "block_size_m": 16,
      "block_size_n": 128,
      "block_size_k": 32,
      "group_size_m": 8,
      "num_warps": 2,
      "num_stages": 2,
      "align_block_size": 8
    },
    {
      "block_size_m": 16,
      "block_size_n": 128,
      "block_size_k": 32,
      "group_size_m": 8,
      "num_warps": 2,
      "num_stages": 2,
      "align_block_size": 16
    },
    {
      "block_size_m": 16,
      "block_size_n": 128,
      "block_size_k": 32,
      "group_size_m": 8,
      "num_warps": 2,
      "num_stages": 2,
      "align_block_size": 32
    },
    {
      "block_size_m": 16,
      "block_size_n": 128,
      "block_size_k": 32,
      "group_size_m": 8,
      "num_warps": 2,
      "num_stages": 2,
      "align_block_size": 64
    },
    {
      "block_size_m": 16,
      "block_size_n": 128,
      "block_size_k": 32,
      "group_size_m": 8,
      "num_warps": 2,
      "num_stages": 3,
      "align_block_size": 8
    },
    {
      "block_size_m": 16,
      "block_size_n": 128,
      "block_size_k": 32,
      "group_size_m": 8,
      "num_warps": 2,
      "num_stages": 3,
      "align_block_size": 16
    },
    {
      "block_size_m": 16,
      "block_size_n": 128,
      "block_size_k": 32,
      "group_size_m": 8,
      "num_warps": 2,
      "num_stages": 3,
      "align_block_size": 32
    },
    {
      "block_size_m": 16,
      "block_size_n": 128,
      "block_size_k": 32,
      "group_size_m": 8,
      "num_warps": 2,
      "num_stages": 3,
      "align_block_size": 64
    },
    {
      "block_size_m": 16,
      "block_size_n": 128,
      "block_size_k": 32,
      "group_size_m": 8,
      "num_warps": 4,
      "num_stages": 1,
      "align_block_size": 8
    },
    {
      "block_size_m": 16,
      "block_size_n": 128,
      "block_size_k": 32,
      "group_size_m": 8,
      "num_warps": 4,
      "num_stages": 1,
      "align_block_size": 16
    },
    {
      "block_size_m": 16,
      "block_size_n": 128,
      "block_size_k": 32,
      "group_size_m": 8,
      "num_warps": 4,
      "num_stages": 1,
      "align_block_size": 32
    },
    {
      "block_size_m": 16,
      "block_size_n": 128,
      "block_size_k": 32,
      "group_size_m": 8,
      "num_warps": 4,
      "num_stages": 1,
      "align_block_size": 64
    },
    {
      "block_size_m": 16,
      "block_size_n": 128,
      "block_size_k": 32,
      "group_size_m": 8,
      "num_warps": 4,
      "num_stages": 2,
      "align_block_size": 8
    },
    {
      "block_size_m": 16,
      "block_size_n": 128,
      "block_size_k": 32,
      "group_size_m": 8,
      "num_warps": 4,
      "num_stages": 2,
      "align_block_size": 16
    },
    {
      "block_size_m": 16,
      "block_size_n": 128,
      "block_size_k": 32,
      "group_size_m": 8,
      "num_warps": 4,
      "num_stages": 2,
      "align_block_size": 32
    },
    {
      "block_size_m": 16,
      "block_size_n": 128,
      "block_size_k": 32,
      "group_size_m": 8,
      "num_warps": 4,
      "num_stages": 2,
      "align_block_size": 64
    },
    {
      "block_size_m": 16,
      "block_size_n": 128,
      "block_size_k": 32,
      "group_size_m": 8,
      "num_warps": 4,
      "num_stages": 3,
      "align_block_size": 8
    },
    {
      "block_size_m": 16,
      "block_size_n": 128,
      "block_size_k": 32,
      "group_size_m": 8,
      "num_warps": 4,
      "num_stages": 3,
      "align_block_size": 16
    },
    {
      "block_size_m": 16,
      "block_size_n": 128,
      "block_size_k": 32,
      "group_size_m": 8,
      "num_warps": 4,
      "num_stages": 3,
      "align_block_size": 32
    },
    {
      "block_size_m": 16,
      "block_size_n": 128,
      "block_size_k": 32,
      "group_size_m": 8,
      "num_warps": 4,
      "num_stages": 3,
      "align_block_size": 64
    },
    {
      "block_size_m": 16,
      "block_size_n": 128,
      "block_size_k": 32,
      "group_size_m": 8,
      "num_warps": 8,
      "num_stages": 1,
      "align_block_size": 8
    },
    {
      "block_size_m": 16,
      "block_size_n": 128,
      "block_size_k": 32,
      "group_size_m": 8,
      "num_warps": 8,
      "num_stages": 1,
      "align_block_size": 16
    },
    {
      "block_size_m": 16,
      "block_size_n": 128,
      "block_size_k": 32,
      "group_size_m": 8,
      "num_warps": 8,
      "num_stages": 1,
      "align_block_size": 32
    },
    {
      "block_size_m": 16,
      "block_size_n": 128,
      "block_size_k": 32,
      "group_size_m": 8,
      "num_warps": 8,
      "num_stages": 1,
      "align_block_size": 64
    },
    {
      "block_size_m": 16,
      "block_size_n": 128,
      "block_size_k": 32,
      "group_size_m": 8,
      "num_warps": 8,
      "num_stages": 2,
      "align_block_size": 8
    },
    {
      "block_size_m": 16,
      "block_size_n": 128,
      "block_size_k": 32,
      "group_size_m": 8,
      "num_warps": 8,
      "num_stages": 2,
      "align_block_size": 16
    },
    {
      "block_size_m": 16,
      "block_size_n": 128,
      "block_size_k": 32,
      "group_size_m": 8,
      "num_warps": 8,
      "num_stages": 2,
      "align_block_size": 32
    },
    {
      "block_size_m": 16,
      "block_size_n": 128,
      "block_size_k": 32,
      "group_size_m": 8,
      "num_warps": 8,
      "num_stages": 2,
      "align_block_size": 64
    },
    {
      "block_size_m": 16,
      "block_size_n": 128,
      "block_size_k": 32,
      "group_size_m": 8,
      "num_warps": 8,
      "num_stages": 3,
      "align_block_size": 8
    },
    {
      "block_size_m": 16,
      "block_size_n": 128,
      "block_size_k": 32,
      "group_size_m": 8,
      "num_warps": 8,
      "num_stages": 3,
      "align_block_size": 16
    },
    {
      "block_size_m": 16,
      "block_size_n": 128,
      "block_size_k": 32,
      "group_size_m": 8,
      "num_warps": 8,
      "num_stages": 3,
      "align_block_size": 32
    },
    {
      "block_size_m": 16,
      "block_size_n": 128,
      "block_size_k": 32,
      "group_size_m": 8,
      "num_warps": 8,
      "num_stages": 3,
      "align_block_size": 64
    },
    {
      "block_size_m": 16,
      "block_size_n": 128,
      "block_size_k": 32,
      "group_size_m": 16,
      "num_warps": 2,
      "num_stages": 1,
      "align_block_size": 8
    },
    {
      "block_size_m": 16,
      "block_size_n": 128,
      "block_size_k": 32,
      "group_size_m": 16,
      "num_warps": 2,
      "num_stages": 1,
      "align_block_size": 16
    },
    {
      "block_size_m": 16,
      "block_size_n": 128,
      "block_size_k": 32,
      "group_size_m": 16,
      "num_warps": 2,
      "num_stages": 1,
      "align_block_size": 32
    },
    {
      "block_size_m": 16,
      "block_size_n": 128,
      "block_size_k": 32,
      "group_size_m": 16,
      "num_warps": 2,
      "num_stages": 1,
      "align_block_size": 64
    },
    {
      "block_size_m": 16,
      "block_size_n": 128,
      "block_size_k": 32,
      "group_size_m": 16,
      "num_warps": 2,
      "num_stages": 2,
      "align_block_size": 8
    },
    {
      "block_size_m": 16,
      "block_size_n": 128,
      "block_size_k": 32,
      "group_size_m": 16,
      "num_warps": 2,
      "num_stages": 2,
      "align_block_size": 16
    },
    {
      "block_size_m": 16,
      "block_size_n": 128,
      "block_size_k": 32,
      "group_size_m": 16,
      "num_warps": 2,
      "num_stages": 2,
      "align_block_size": 32
    },
    {
      "block_size_m": 16,
      "block_size_n": 128,
      "block_size_k": 32,
      "group_size_m": 16,
      "num_warps": 2,
      "num_stages": 2,
      "align_block_size": 64
    },
    {
      "block_size_m": 16,
      "block_size_n": 128,
      "block_size_k": 32,
      "group_size_m": 16,
      "num_warps": 2,
      "num_stages": 3,
      "align_block_size": 8
    },
    {
      "block_size_m": 16,
      "block_size_n": 128,
      "block_size_k": 32,
      "group_size_m": 16,
      "num_warps": 2,
      "num_stages": 3,
      "align_block_size": 16
    },
    {
      "block_size_m": 16,
      "block_size_n": 128,
      "block_size_k": 32,
      "group_size_m": 16,
      "num_warps": 2,
      "num_stages": 3,
      "align_block_size": 32
    },
    {
      "block_size_m": 16,
      "block_size_n": 128,
      "block_size_k": 32,
      "group_size_m": 16,
      "num_warps": 2,
      "num_stages": 3,
      "align_block_size": 64
    },
    {
      "block_size_m": 16,
      "block_size_n": 128,
      "block_size_k": 32,
      "group_size_m": 16,
      "num_warps": 4,
      "num_stages": 1,
      "align_block_size": 8
    },
    {
      "block_size_m": 16,
      "block_size_n": 128,
      "block_size_k": 32,
      "group_size_m": 16,
      "num_warps": 4,
      "num_stages": 1,
      "align_block_size": 16
    },
    {
      "block_size_m": 16,
      "block_size_n": 128,
      "block_size_k": 32,
      "group_size_m": 16,
      "num_warps": 4,
      "num_stages": 1,
      "align_block_size": 32
    },
    {
      "block_size_m": 16,
      "block_size_n": 128,
      "block_size_k": 32,
      "group_size_m": 16,
      "num_warps": 4,
      "num_stages": 1,
      "align_block_size": 64
    },
    {
      "block_size_m": 16,
      "block_size_n": 128,
      "block_size_k": 32,
      "group_size_m": 16,
      "num_warps": 4,
      "num_stages": 2,
      "align_block_size": 8
    },
    {
      "block_size_m": 16,
      "block_size_n": 128,
      "block_size_k": 32,
      "group_size_m": 16,
      "num_warps": 4,
      "num_stages": 2,
      "align_block_size": 16
    },
    {
      "block_size_m": 16,
      "block_size_n": 128,
      "block_size_k": 32,
      "group_size_m": 16,
      "num_warps": 4,
      "num_stages": 2,
      "align_block_size": 32
    },
    {
      "block_size_m": 16,
      "block_size_n": 128,
      "block_size_k": 32,
      "group_size_m": 16,
      "num_warps": 4,
      "num_stages": 2,
      "align_block_size": 64
    },
    {
      "block_size_m": 16,
      "block_size_n": 128,
      "block_size_k": 32,
      "group_size_m": 16,
      "num_warps": 4,
      "num_stages": 3,
      "align_block_size": 8
    },
    {
      "block_size_m": 16,
      "block_size_n": 128,
      "block_size_k": 32,
      "group_size_m": 16,
      "num_warps": 4,
      "num_stages": 3,
      "align_block_size": 16
    },
    {
      "block_size_m": 16,
      "block_size_n": 128,
      "block_size_k": 32,
      "group_size_m": 16,
      "num_warps": 4,
      "num_stages": 3,
      "align_block_size": 32
    },
    {
      "block_size_m": 16,
      "block_size_n": 128,
      "block_size_k": 32,
      "group_size_m": 16,
      "num_warps": 4,
      "num_stages": 3,
      "align_block_size": 64
    },
    {
      "block_size_m": 16,
      "block_size_n": 128,
      "block_size_k": 32,
      "group_size_m": 16,
      "num_warps": 8,
      "num_stages": 1,
      "align_block_size": 8
    },
    {
      "block_size_m": 16,
      "block_size_n": 128,
      "block_size_k": 32,
      "group_size_m": 16,
      "num_warps": 8,
      "num_stages": 1,
      "align_block_size": 16
    },
    {
      "block_size_m": 16,
      "block_size_n": 128,
      "block_size_k": 32,
      "group_size_m": 16,
      "num_warps": 8,
      "num_stages": 1,
      "align_block_size": 32
    },
    {
      "block_size_m": 16,
      "block_size_n": 128,
      "block_size_k": 32,
      "group_size_m": 16,
      "num_warps": 8,
      "num_stages": 1,
      "align_block_size": 64
    },
    {
      "block_size_m": 16,
      "block_size_n": 128,
      "block_size_k": 32,
      "group_size_m": 16,
      "num_warps": 8,
      "num_stages": 2,
      "align_block_size": 8
    },
    {
      "block_size_m": 16,
      "block_size_n": 128,
      "block_size_k": 32,
      "group_size_m": 16,
      "num_warps": 8,
      "num_stages": 2,
      "align_block_size": 16
    },
    {
      "block_size_m": 16,
      "block_size_n": 128,
      "block_size_k": 32,
      "group_size_m": 16,
      "num_warps": 8,
      "num_stages": 2,
      "align_block_size": 32
    },
    {
      "block_size_m": 16,
      "block_size_n": 128,
      "block_size_k": 32,
      "group_size_m": 16,
      "num_warps": 8,
      "num_stages": 2,
      "align_block_size": 64
    },
    {
      "block_size_m": 16,
      "block_size_n": 128,
      "block_size_k": 32,
      "group_size_m": 16,
      "num_warps": 8,
      "num_stages": 3,
      "align_block_size": 8
    },
    {
      "block_size_m": 16,
      "block_size_n": 128,
      "block_size_k": 32,
      "group_size_m": 16,
      "num_warps": 8,
      "num_stages": 3,
      "align_block_size": 16
    },
    {
      "block_size_m": 16,
      "block_size_n": 128,
      "block_size_k": 32,
      "group_size_m": 16,
      "num_warps": 8,
      "num_stages": 3,
      "align_block_size": 32
    },
    {
      "block_size_m": 16,
      "block_size_n": 128,
      "block_size_k": 32,
      "group_size_m": 16,
      "num_warps": 8,
      "num_stages": 3,
      "align_block_size": 64
    },
    {
      "block_size_m": 16,
      "block_size_n": 128,
      "block_size_k": 64,
      "group_size_m": 1,
      "num_warps": 2,
      "num_stages": 1,
      "align_block_size": 8
    },
    {
      "block_size_m": 16,
      "block_size_n": 128,
      "block_size_k": 64,
      "group_size_m": 1,
      "num_warps": 2,
      "num_stages": 1,
      "align_block_size": 16
    },
    {
      "block_size_m": 16,
      "block_size_n": 128,
      "block_size_k": 64,
      "group_size_m": 1,
      "num_warps": 2,
      "num_stages": 1,
      "align_block_size": 32
    },
    {
      "block_size_m": 16,
      "block_size_n": 128,
      "block_size_k": 64,
      "group_size_m": 1,
      "num_warps": 2,
      "num_stages": 1,
      "align_block_size": 64
    },
    {
      "block_size_m": 16,
      "block_size_n": 128,
      "block_size_k": 64,
      "group_size_m": 1,
      "num_warps": 2,
      "num_stages": 2,
      "align_block_size": 8
    },
    {
      "block_size_m": 16,
      "block_size_n": 128,
      "block_size_k": 64,
      "group_size_m": 1,
      "num_warps": 2,
      "num_stages": 2,
      "align_block_size": 16
    },
    {
      "block_size_m": 16,
      "block_size_n": 128,
      "block_size_k": 64,
      "group_size_m": 1,
      "num_warps": 2,
      "num_stages": 2,
      "align_block_size": 32
    },
    {
      "block_size_m": 16,
      "block_size_n": 128,
      "block_size_k": 64,
      "group_size_m": 1,
      "num_warps": 2,
      "num_stages": 2,
      "align_block_size": 64
    },
    {
      "block_size_m": 16,
      "block_size_n": 128,
      "block_size_k": 64,
      "group_size_m": 1,
      "num_warps": 2,
      "num_stages": 3,
      "align_block_size": 8
    },
    {
      "block_size_m": 16,
      "block_size_n": 128,
      "block_size_k": 64,
      "group_size_m": 1,
      "num_warps": 2,
      "num_stages": 3,
      "align_block_size": 16
    },
    {
      "block_size_m": 16,
      "block_size_n": 128,
      "block_size_k": 64,
      "group_size_m": 1,
      "num_warps": 2,
      "num_stages": 3,
      "align_block_size": 32
    },
    {
      "block_size_m": 16,
      "block_size_n": 128,
      "block_size_k": 64,
      "group_size_m": 1,
      "num_warps": 2,
      "num_stages": 3,
      "align_block_size": 64
    },
    {
      "block_size_m": 16,
      "block_size_n": 128,
      "block_size_k": 64,
      "group_size_m": 1,
      "num_warps": 4,
      "num_stages": 1,
      "align_block_size": 8
    },
    {
      "block_size_m": 16,
      "block_size_n": 128,
      "block_size_k": 64,
      "group_size_m": 1,
      "num_warps": 4,
      "num_stages": 1,
      "align_block_size": 16
    },
    {
      "block_size_m": 16,
      "block_size_n": 128,
      "block_size_k": 64,
      "group_size_m": 1,
      "num_warps": 4,
      "num_stages": 1,
      "align_block_size": 32
    },
    {
      "block_size_m": 16,
      "block_size_n": 128,
      "block_size_k": 64,
      "group_size_m": 1,
      "num_warps": 4,
      "num_stages": 1,
      "align_block_size": 64
    },
    {
      "block_size_m": 16,
      "block_size_n": 128,
      "block_size_k": 64,
      "group_size_m": 1,
      "num_warps": 4,
      "num_stages": 2,
      "align_block_size": 8
    },
    {
      "block_size_m": 16,
      "block_size_n": 128,
      "block_size_k": 64,
      "group_size_m": 1,
      "num_warps": 4,
      "num_stages": 2,
      "align_block_size": 16
    },
    {
      "block_size_m": 16,
      "block_size_n": 128,
      "block_size_k": 64,
      "group_size_m": 1,
      "num_warps": 4,
      "num_stages": 2,
      "align_block_size": 32
    },
    {
      "block_size_m": 16,
      "block_size_n": 128,
      "block_size_k": 64,
      "group_size_m": 1,
      "num_warps": 4,
      "num_stages": 2,
      "align_block_size": 64
    },
    {
      "block_size_m": 16,
      "block_size_n": 128,
      "block_size_k": 64,
      "group_size_m": 1,
      "num_warps": 4,
      "num_stages": 3,
      "align_block_size": 8
    },
    {
      "block_size_m": 16,
      "block_size_n": 128,
      "block_size_k": 64,
      "group_size_m": 1,
      "num_warps": 4,
      "num_stages": 3,
      "align_block_size": 16
    },
    {
      "block_size_m": 16,
      "block_size_n": 128,
      "block_size_k": 64,
      "group_size_m": 1,
      "num_warps": 4,
      "num_stages": 3,
      "align_block_size": 32
    },
    {
      "block_size_m": 16,
      "block_size_n": 128,
      "block_size_k": 64,
      "group_size_m": 1,
      "num_warps": 4,
      "num_stages": 3,
      "align_block_size": 64
    },
    {
      "block_size_m": 16,
      "block_size_n": 128,
      "block_size_k": 64,
      "group_size_m": 1,
      "num_warps": 8,
      "num_stages": 1,
      "align_block_size": 8
    },
    {
      "block_size_m": 16,
      "block_size_n": 128,
      "block_size_k": 64,
      "group_size_m": 1,
      "num_warps": 8,
      "num_stages": 1,
      "align_block_size": 16
    },
    {
      "block_size_m": 16,
      "block_size_n": 128,
      "block_size_k": 64,
      "group_size_m": 1,
      "num_warps": 8,
      "num_stages": 1,
      "align_block_size": 32
    },
    {
      "block_size_m": 16,
      "block_size_n": 128,
      "block_size_k": 64,
      "group_size_m": 1,
      "num_warps": 8,
      "num_stages": 1,
      "align_block_size": 64
    },
    {
      "block_size_m": 16,
      "block_size_n": 128,
      "block_size_k": 64,
      "group_size_m": 1,
      "num_warps": 8,
      "num_stages": 2,
      "align_block_size": 8
    },
    {
      "block_size_m": 16,
      "block_size_n": 128,
      "block_size_k": 64,
      "group_size_m": 1,
      "num_warps": 8,
      "num_stages": 2,
      "align_block_size": 16
    },
    {
      "block_size_m": 16,
      "block_size_n": 128,
      "block_size_k": 64,
      "group_size_m": 1,
      "num_warps": 8,
      "num_stages": 2,
      "align_block_size": 32
    },
    {
      "block_size_m": 16,
      "block_size_n": 128,
      "block_size_k": 64,
      "group_size_m": 1,
      "num_warps": 8,
      "num_stages": 2,
      "align_block_size": 64
    },
    {
      "block_size_m": 16,
      "block_size_n": 128,
      "block_size_k": 64,
      "group_size_m": 1,
      "num_warps": 8,
      "num_stages": 3,
      "align_block_size": 8
    },
    {
      "block_size_m": 16,
      "block_size_n": 128,
      "block_size_k": 64,
      "group_size_m": 1,
      "num_warps": 8,
      "num_stages": 3,
      "align_block_size": 16
    },
    {
      "block_size_m": 16,
      "block_size_n": 128,
      "block_size_k": 64,
      "group_size_m": 1,
      "num_warps": 8,
      "num_stages": 3,
      "align_block_size": 32
    },
    {
      "block_size_m": 16,
      "block_size_n": 128,
      "block_size_k": 64,
      "group_size_m": 1,
      "num_warps": 8,
      "num_stages": 3,
      "align_block_size": 64
    },
    {
      "block_size_m": 16,
      "block_size_n": 128,
      "block_size_k": 64,
      "group_size_m": 4,
      "num_warps": 2,
      "num_stages": 1,
      "align_block_size": 8
    },
    {
      "block_size_m": 16,
      "block_size_n": 128,
      "block_size_k": 64,
      "group_size_m": 4,
      "num_warps": 2,
      "num_stages": 1,
      "align_block_size": 16
    },
    {
      "block_size_m": 16,
      "block_size_n": 128,
      "block_size_k": 64,
      "group_size_m": 4,
      "num_warps": 2,
      "num_stages": 1,
      "align_block_size": 32
    },
    {
      "block_size_m": 16,
      "block_size_n": 128,
      "block_size_k": 64,
      "group_size_m": 4,
      "num_warps": 2,
      "num_stages": 1,
      "align_block_size": 64
    },
    {
      "block_size_m": 16,
      "block_size_n": 128,
      "block_size_k": 64,
      "group_size_m": 4,
      "num_warps": 2,
      "num_stages": 2,
      "align_block_size": 8
    },
    {
      "block_size_m": 16,
      "block_size_n": 128,
      "block_size_k": 64,
      "group_size_m": 4,
      "num_warps": 2,
      "num_stages": 2,
      "align_block_size": 16
    },
    {
      "block_size_m": 16,
      "block_size_n": 128,
      "block_size_k": 64,
      "group_size_m": 4,
      "num_warps": 2,
      "num_stages": 2,
      "align_block_size": 32
    },
    {
      "block_size_m": 16,
      "block_size_n": 128,
      "block_size_k": 64,
      "group_size_m": 4,
      "num_warps": 2,
      "num_stages": 2,
      "align_block_size": 64
    },
    {
      "block_size_m": 16,
      "block_size_n": 128,
      "block_size_k": 64,
      "group_size_m": 4,
      "num_warps": 2,
      "num_stages": 3,
      "align_block_size": 8
    },
    {
      "block_size_m": 16,
      "block_size_n": 128,
      "block_size_k": 64,
      "group_size_m": 4,
      "num_warps": 2,
      "num_stages": 3,
      "align_block_size": 16
    },
    {
      "block_size_m": 16,
      "block_size_n": 128,
      "block_size_k": 64,
      "group_size_m": 4,
      "num_warps": 2,
      "num_stages": 3,
      "align_block_size": 32
    },
    {
      "block_size_m": 16,
      "block_size_n": 128,
      "block_size_k": 64,
      "group_size_m": 4,
      "num_warps": 2,
      "num_stages": 3,
      "align_block_size": 64
    },
    {
      "block_size_m": 16,
      "block_size_n": 128,
      "block_size_k": 64,
      "group_size_m": 4,
      "num_warps": 4,
      "num_stages": 1,
      "align_block_size": 8
    },
    {
      "block_size_m": 16,
      "block_size_n": 128,
      "block_size_k": 64,
      "group_size_m": 4,
      "num_warps": 4,
      "num_stages": 1,
      "align_block_size": 16
    },
    {
      "block_size_m": 16,
      "block_size_n": 128,
      "block_size_k": 64,
      "group_size_m": 4,
      "num_warps": 4,
      "num_stages": 1,
      "align_block_size": 32
    },
    {
      "block_size_m": 16,
      "block_size_n": 128,
      "block_size_k": 64,
      "group_size_m": 4,
      "num_warps": 4,
      "num_stages": 1,
      "align_block_size": 64
    },
    {
      "block_size_m": 16,
      "block_size_n": 128,
      "block_size_k": 64,
      "group_size_m": 4,
      "num_warps": 4,
      "num_stages": 2,
      "align_block_size": 8
    },
    {
      "block_size_m": 16,
      "block_size_n": 128,
      "block_size_k": 64,
      "group_size_m": 4,
      "num_warps": 4,
      "num_stages": 2,
      "align_block_size": 16
    },
    {
      "block_size_m": 16,
      "block_size_n": 128,
      "block_size_k": 64,
      "group_size_m": 4,
      "num_warps": 4,
      "num_stages": 2,
      "align_block_size": 32
    },
    {
      "block_size_m": 16,
      "block_size_n": 128,
      "block_size_k": 64,
      "group_size_m": 4,
      "num_warps": 4,
      "num_stages": 2,
      "align_block_size": 64
    },
    {
      "block_size_m": 16,
      "block_size_n": 128,
      "block_size_k": 64,
      "group_size_m": 4,
      "num_warps": 4,
      "num_stages": 3,
      "align_block_size": 8
    },
    {
      "block_size_m": 16,
      "block_size_n": 128,
      "block_size_k": 64,
      "group_size_m": 4,
      "num_warps": 4,
      "num_stages": 3,
      "align_block_size": 16
    },
    {
      "block_size_m": 16,
      "block_size_n": 128,
      "block_size_k": 64,
      "group_size_m": 4,
      "num_warps": 4,
      "num_stages": 3,
      "align_block_size": 32
    },
    {
      "block_size_m": 16,
      "block_size_n": 128,
      "block_size_k": 64,
      "group_size_m": 4,
      "num_warps": 4,
      "num_stages": 3,
      "align_block_size": 64
    },
    {
      "block_size_m": 16,
      "block_size_n": 128,
      "block_size_k": 64,
      "group_size_m": 4,
      "num_warps": 8,
      "num_stages": 1,
      "align_block_size": 8
    },
    {
      "block_size_m": 16,
      "block_size_n": 128,
      "block_size_k": 64,
      "group_size_m": 4,
      "num_warps": 8,
      "num_stages": 1,
      "align_block_size": 16
    },
    {
      "block_size_m": 16,
      "block_size_n": 128,
      "block_size_k": 64,
      "group_size_m": 4,
      "num_warps": 8,
      "num_stages": 1,
      "align_block_size": 32
    },
    {
      "block_size_m": 16,
      "block_size_n": 128,
      "block_size_k": 64,
      "group_size_m": 4,
      "num_warps": 8,
      "num_stages": 1,
      "align_block_size": 64
    },
    {
      "block_size_m": 16,
      "block_size_n": 128,
      "block_size_k": 64,
      "group_size_m": 4,
      "num_warps": 8,
      "num_stages": 2,
      "align_block_size": 8
    },
    {
      "block_size_m": 16,
      "block_size_n": 128,
      "block_size_k": 64,
      "group_size_m": 4,
      "num_warps": 8,
      "num_stages": 2,
      "align_block_size": 16
    },
    {
      "block_size_m": 16,
      "block_size_n": 128,
      "block_size_k": 64,
      "group_size_m": 4,
      "num_warps": 8,
      "num_stages": 2,
      "align_block_size": 32
    },
    {
      "block_size_m": 16,
      "block_size_n": 128,
      "block_size_k": 64,
      "group_size_m": 4,
      "num_warps": 8,
      "num_stages": 2,
      "align_block_size": 64
    },
    {
      "block_size_m": 16,
      "block_size_n": 128,
      "block_size_k": 64,
      "group_size_m": 4,
      "num_warps": 8,
      "num_stages": 3,
      "align_block_size": 8
    },
    {
      "block_size_m": 16,
      "block_size_n": 128,
      "block_size_k": 64,
      "group_size_m": 4,
      "num_warps": 8,
      "num_stages": 3,
      "align_block_size": 16
    },
    {
      "block_size_m": 16,
      "block_size_n": 128,
      "block_size_k": 64,
      "group_size_m": 4,
      "num_warps": 8,
      "num_stages": 3,
      "align_block_size": 32
    },
    {
      "block_size_m": 16,
      "block_size_n": 128,
      "block_size_k": 64,
      "group_size_m": 4,
      "num_warps": 8,
      "num_stages": 3,
      "align_block_size": 64
    },
    {
      "block_size_m": 16,
      "block_size_n": 128,
      "block_size_k": 64,
      "group_size_m": 8,
      "num_warps": 2,
      "num_stages": 1,
      "align_block_size": 8
    },
    {
      "block_size_m": 16,
      "block_size_n": 128,
      "block_size_k": 64,
      "group_size_m": 8,
      "num_warps": 2,
      "num_stages": 1,
      "align_block_size": 16
    },
    {
      "block_size_m": 16,
      "block_size_n": 128,
      "block_size_k": 64,
      "group_size_m": 8,
      "num_warps": 2,
      "num_stages": 1,
      "align_block_size": 32
    },
    {
      "block_size_m": 16,
      "block_size_n": 128,
      "block_size_k": 64,
      "group_size_m": 8,
      "num_warps": 2,
      "num_stages": 1,
      "align_block_size": 64
    },
    {
      "block_size_m": 16,
      "block_size_n": 128,
      "block_size_k": 64,
      "group_size_m": 8,
      "num_warps": 2,
      "num_stages": 2,
      "align_block_size": 8
    },
    {
      "block_size_m": 16,
      "block_size_n": 128,
      "block_size_k": 64,
      "group_size_m": 8,
      "num_warps": 2,
      "num_stages": 2,
      "align_block_size": 16
    },
    {
      "block_size_m": 16,
      "block_size_n": 128,
      "block_size_k": 64,
      "group_size_m": 8,
      "num_warps": 2,
      "num_stages": 2,
      "align_block_size": 32
    },
    {
      "block_size_m": 16,
      "block_size_n": 128,
      "block_size_k": 64,
      "group_size_m": 8,
      "num_warps": 2,
      "num_stages": 2,
      "align_block_size": 64
    },
    {
      "block_size_m": 16,
      "block_size_n": 128,
      "block_size_k": 64,
      "group_size_m": 8,
      "num_warps": 2,
      "num_stages": 3,
      "align_block_size": 8
    },
    {
      "block_size_m": 16,
      "block_size_n": 128,
      "block_size_k": 64,
      "group_size_m": 8,
      "num_warps": 2,
      "num_stages": 3,
      "align_block_size": 16
    },
    {
      "block_size_m": 16,
      "block_size_n": 128,
      "block_size_k": 64,
      "group_size_m": 8,
      "num_warps": 2,
      "num_stages": 3,
      "align_block_size": 32
    },
    {
      "block_size_m": 16,
      "block_size_n": 128,
      "block_size_k": 64,
      "group_size_m": 8,
      "num_warps": 2,
      "num_stages": 3,
      "align_block_size": 64
    },
    {
      "block_size_m": 16,
      "block_size_n": 128,
      "block_size_k": 64,
      "group_size_m": 8,
      "num_warps": 4,
      "num_stages": 1,
      "align_block_size": 8
    },
    {
      "block_size_m": 16,
      "block_size_n": 128,
      "block_size_k": 64,
      "group_size_m": 8,
      "num_warps": 4,
      "num_stages": 1,
      "align_block_size": 16
    },
    {
      "block_size_m": 16,
      "block_size_n": 128,
      "block_size_k": 64,
      "group_size_m": 8,
      "num_warps": 4,
      "num_stages": 1,
      "align_block_size": 32
    },
    {
      "block_size_m": 16,
      "block_size_n": 128,
      "block_size_k": 64,
      "group_size_m": 8,
      "num_warps": 4,
      "num_stages": 1,
      "align_block_size": 64
    },
    {
      "block_size_m": 16,
      "block_size_n": 128,
      "block_size_k": 64,
      "group_size_m": 8,
      "num_warps": 4,
      "num_stages": 2,
      "align_block_size": 8
    },
    {
      "block_size_m": 16,
      "block_size_n": 128,
      "block_size_k": 64,
      "group_size_m": 8,
      "num_warps": 4,
      "num_stages": 2,
      "align_block_size": 16
    },
    {
      "block_size_m": 16,
      "block_size_n": 128,
      "block_size_k": 64,
      "group_size_m": 8,
      "num_warps": 4,
      "num_stages": 2,
      "align_block_size": 32
    },
    {
      "block_size_m": 16,
      "block_size_n": 128,
      "block_size_k": 64,
      "group_size_m": 8,
      "num_warps": 4,
      "num_stages": 2,
      "align_block_size": 64
    },
    {
      "block_size_m": 16,
      "block_size_n": 128,
      "block_size_k": 64,
      "group_size_m": 8,
      "num_warps": 4,
      "num_stages": 3,
      "align_block_size": 8
    },
    {
      "block_size_m": 16,
      "block_size_n": 128,
      "block_size_k": 64,
      "group_size_m": 8,
      "num_warps": 4,
      "num_stages": 3,
      "align_block_size": 16
    },
    {
      "block_size_m": 16,
      "block_size_n": 128,
      "block_size_k": 64,
      "group_size_m": 8,
      "num_warps": 4,
      "num_stages": 3,
      "align_block_size": 32
    },
    {
      "block_size_m": 16,
      "block_size_n": 128,
      "block_size_k": 64,
      "group_size_m": 8,
      "num_warps": 4,
      "num_stages": 3,
      "align_block_size": 64
    },
    {
      "block_size_m": 16,
      "block_size_n": 128,
      "block_size_k": 64,
      "group_size_m": 8,
      "num_warps": 8,
      "num_stages": 1,
      "align_block_size": 8
    },
    {
      "block_size_m": 16,
      "block_size_n": 128,
      "block_size_k": 64,
      "group_size_m": 8,
      "num_warps": 8,
      "num_stages": 1,
      "align_block_size": 16
    },
    {
      "block_size_m": 16,
      "block_size_n": 128,
      "block_size_k": 64,
      "group_size_m": 8,
      "num_warps": 8,
      "num_stages": 1,
      "align_block_size": 32
    },
    {
      "block_size_m": 16,
      "block_size_n": 128,
      "block_size_k": 64,
      "group_size_m": 8,
      "num_warps": 8,
      "num_stages": 1,
      "align_block_size": 64
    },
    {
      "block_size_m": 16,
      "block_size_n": 128,
      "block_size_k": 64,
      "group_size_m": 8,
      "num_warps": 8,
      "num_stages": 2,
      "align_block_size": 8
    },
    {
      "block_size_m": 16,
      "block_size_n": 128,
      "block_size_k": 64,
      "group_size_m": 8,
      "num_warps": 8,
      "num_stages": 2,
      "align_block_size": 16
    },
    {
      "block_size_m": 16,
      "block_size_n": 128,
      "block_size_k": 64,
      "group_size_m": 8,
      "num_warps": 8,
      "num_stages": 2,
      "align_block_size": 32
    },
    {
      "block_size_m": 16,
      "block_size_n": 128,
      "block_size_k": 64,
      "group_size_m": 8,
      "num_warps": 8,
      "num_stages": 2,
      "align_block_size": 64
    },
    {
      "block_size_m": 16,
      "block_size_n": 128,
      "block_size_k": 64,
      "group_size_m": 8,
      "num_warps": 8,
      "num_stages": 3,
      "align_block_size": 8
    },
    {
      "block_size_m": 16,
      "block_size_n": 128,
      "block_size_k": 64,
      "group_size_m": 8,
      "num_warps": 8,
      "num_stages": 3,
      "align_block_size": 16
    },
    {
      "block_size_m": 16,
      "block_size_n": 128,
      "block_size_k": 64,
      "group_size_m": 8,
      "num_warps": 8,
      "num_stages": 3,
      "align_block_size": 32
    },
    {
      "block_size_m": 16,
      "block_size_n": 128,
      "block_size_k": 64,
      "group_size_m": 8,
      "num_warps": 8,
      "num_stages": 3,
      "align_block_size": 64
    },
    {
      "block_size_m": 16,
      "block_size_n": 128,
      "block_size_k": 64,
      "group_size_m": 16,
      "num_warps": 2,
      "num_stages": 1,
      "align_block_size": 8
    },
    {
      "block_size_m": 16,
      "block_size_n": 128,
      "block_size_k": 64,
      "group_size_m": 16,
      "num_warps": 2,
      "num_stages": 1,
      "align_block_size": 16
    },
    {
      "block_size_m": 16,
      "block_size_n": 128,
      "block_size_k": 64,
      "group_size_m": 16,
      "num_warps": 2,
      "num_stages": 1,
      "align_block_size": 32
    },
    {
      "block_size_m": 16,
      "block_size_n": 128,
      "block_size_k": 64,
      "group_size_m": 16,
      "num_warps": 2,
      "num_stages": 1,
      "align_block_size": 64
    },
    {
      "block_size_m": 16,
      "block_size_n": 128,
      "block_size_k": 64,
      "group_size_m": 16,
      "num_warps": 2,
      "num_stages": 2,
      "align_block_size": 8
    },
    {
      "block_size_m": 16,
      "block_size_n": 128,
      "block_size_k": 64,
      "group_size_m": 16,
      "num_warps": 2,
      "num_stages": 2,
      "align_block_size": 16
    },
    {
      "block_size_m": 16,
      "block_size_n": 128,
      "block_size_k": 64,
      "group_size_m": 16,
      "num_warps": 2,
      "num_stages": 2,
      "align_block_size": 32
    },
    {
      "block_size_m": 16,
      "block_size_n": 128,
      "block_size_k": 64,
      "group_size_m": 16,
      "num_warps": 2,
      "num_stages": 2,
      "align_block_size": 64
    },
    {
      "block_size_m": 16,
      "block_size_n": 128,
      "block_size_k": 64,
      "group_size_m": 16,
      "num_warps": 2,
      "num_stages": 3,
      "align_block_size": 8
    },
    {
      "block_size_m": 16,
      "block_size_n": 128,
      "block_size_k": 64,
      "group_size_m": 16,
      "num_warps": 2,
      "num_stages": 3,
      "align_block_size": 16
    },
    {
      "block_size_m": 16,
      "block_size_n": 128,
      "block_size_k": 64,
      "group_size_m": 16,
      "num_warps": 2,
      "num_stages": 3,
      "align_block_size": 32
    },
    {
      "block_size_m": 16,
      "block_size_n": 128,
      "block_size_k": 64,
      "group_size_m": 16,
      "num_warps": 2,
      "num_stages": 3,
      "align_block_size": 64
    },
    {
      "block_size_m": 16,
      "block_size_n": 128,
      "block_size_k": 64,
      "group_size_m": 16,
      "num_warps": 4,
      "num_stages": 1,
      "align_block_size": 8
    },
    {
      "block_size_m": 16,
      "block_size_n": 128,
      "block_size_k": 64,
      "group_size_m": 16,
      "num_warps": 4,
      "num_stages": 1,
      "align_block_size": 16
    },
    {
      "block_size_m": 16,
      "block_size_n": 128,
      "block_size_k": 64,
      "group_size_m": 16,
      "num_warps": 4,
      "num_stages": 1,
      "align_block_size": 32
    },
    {
      "block_size_m": 16,
      "block_size_n": 128,
      "block_size_k": 64,
      "group_size_m": 16,
      "num_warps": 4,
      "num_stages": 1,
      "align_block_size": 64
    },
    {
      "block_size_m": 16,
      "block_size_n": 128,
      "block_size_k": 64,
      "group_size_m": 16,
      "num_warps": 4,
      "num_stages": 2,
      "align_block_size": 8
    },
    {
      "block_size_m": 16,
      "block_size_n": 128,
      "block_size_k": 64,
      "group_size_m": 16,
      "num_warps": 4,
      "num_stages": 2,
      "align_block_size": 16
    },
    {
      "block_size_m": 16,
      "block_size_n": 128,
      "block_size_k": 64,
      "group_size_m": 16,
      "num_warps": 4,
      "num_stages": 2,
      "align_block_size": 32
    },
    {
      "block_size_m": 16,
      "block_size_n": 128,
      "block_size_k": 64,
      "group_size_m": 16,
      "num_warps": 4,
      "num_stages": 2,
      "align_block_size": 64
    },
    {
      "block_size_m": 16,
      "block_size_n": 128,
      "block_size_k": 64,
      "group_size_m": 16,
      "num_warps": 4,
      "num_stages": 3,
      "align_block_size": 8
    },
    {
      "block_size_m": 16,
      "block_size_n": 128,
      "block_size_k": 64,
      "group_size_m": 16,
      "num_warps": 4,
      "num_stages": 3,
      "align_block_size": 16
    },
    {
      "block_size_m": 16,
      "block_size_n": 128,
      "block_size_k": 64,
      "group_size_m": 16,
      "num_warps": 4,
      "num_stages": 3,
      "align_block_size": 32
    },
    {
      "block_size_m": 16,
      "block_size_n": 128,
      "block_size_k": 64,
      "group_size_m": 16,
      "num_warps": 4,
      "num_stages": 3,
      "align_block_size": 64
    },
    {
      "block_size_m": 16,
      "block_size_n": 128,
      "block_size_k": 64,
      "group_size_m": 16,
      "num_warps": 8,
      "num_stages": 1,
      "align_block_size": 8
    },
    {
      "block_size_m": 16,
      "block_size_n": 128,
      "block_size_k": 64,
      "group_size_m": 16,
      "num_warps": 8,
      "num_stages": 1,
      "align_block_size": 16
    },
    {
      "block_size_m": 16,
      "block_size_n": 128,
      "block_size_k": 64,
      "group_size_m": 16,
      "num_warps": 8,
      "num_stages": 1,
      "align_block_size": 32
    },
    {
      "block_size_m": 16,
      "block_size_n": 128,
      "block_size_k": 64,
      "group_size_m": 16,
      "num_warps": 8,
      "num_stages": 1,
      "align_block_size": 64
    },
    {
      "block_size_m": 16,
      "block_size_n": 128,
      "block_size_k": 64,
      "group_size_m": 16,
      "num_warps": 8,
      "num_stages": 2,
      "align_block_size": 8
    },
    {
      "block_size_m": 16,
      "block_size_n": 128,
      "block_size_k": 64,
      "group_size_m": 16,
      "num_warps": 8,
      "num_stages": 2,
      "align_block_size": 16
    },
    {
      "block_size_m": 16,
      "block_size_n": 128,
      "block_size_k": 64,
      "group_size_m": 16,
      "num_warps": 8,
      "num_stages": 2,
      "align_block_size": 32
    },
    {
      "block_size_m": 16,
      "block_size_n": 128,
      "block_size_k": 64,
      "group_size_m": 16,
      "num_warps": 8,
      "num_stages": 2,
      "align_block_size": 64
    },
    {
      "block_size_m": 16,
      "block_size_n": 128,
      "block_size_k": 64,
      "group_size_m": 16,
      "num_warps": 8,
      "num_stages": 3,
      "align_block_size": 8
    },
    {
      "block_size_m": 16,
      "block_size_n": 128,
      "block_size_k": 64,
      "group_size_m": 16,
      "num_warps": 8,
      "num_stages": 3,
      "align_block_size": 16
    },
    {
      "block_size_m": 16,
      "block_size_n": 128,
      "block_size_k": 64,
      "group_size_m": 16,
      "num_warps": 8,
      "num_stages": 3,
      "align_block_size": 32
    },
    {
      "block_size_m": 16,
      "block_size_n": 128,
      "block_size_k": 64,
      "group_size_m": 16,
      "num_warps": 8,
      "num_stages": 3,
      "align_block_size": 64
    },
    {
      "block_size_m": 16,
      "block_size_n": 128,
      "block_size_k": 128,
      "group_size_m": 1,
      "num_warps": 2,
      "num_stages": 1,
      "align_block_size": 8
    },
    {
      "block_size_m": 16,
      "block_size_n": 128,
      "block_size_k": 128,
      "group_size_m": 1,
      "num_warps": 2,
      "num_stages": 1,
      "align_block_size": 16
    },
    {
      "block_size_m": 16,
      "block_size_n": 128,
      "block_size_k": 128,
      "group_size_m": 1,
      "num_warps": 2,
      "num_stages": 1,
      "align_block_size": 32
    },
    {
      "block_size_m": 16,
      "block_size_n": 128,
      "block_size_k": 128,
      "group_size_m": 1,
      "num_warps": 2,
      "num_stages": 1,
      "align_block_size": 64
    },
    {
      "block_size_m": 16,
      "block_size_n": 128,
      "block_size_k": 128,
      "group_size_m": 1,
      "num_warps": 4,
      "num_stages": 1,
      "align_block_size": 8
    },
    {
      "block_size_m": 16,
      "block_size_n": 128,
      "block_size_k": 128,
      "group_size_m": 1,
      "num_warps": 4,
      "num_stages": 1,
      "align_block_size": 16
    },
    {
      "block_size_m": 16,
      "block_size_n": 128,
      "block_size_k": 128,
      "group_size_m": 1,
      "num_warps": 4,
      "num_stages": 1,
      "align_block_size": 32
    },
    {
      "block_size_m": 16,
      "block_size_n": 128,
      "block_size_k": 128,
      "group_size_m": 1,
      "num_warps": 4,
      "num_stages": 1,
      "align_block_size": 64
    },
    {
      "block_size_m": 16,
      "block_size_n": 128,
      "block_size_k": 128,
      "group_size_m": 1,
      "num_warps": 8,
      "num_stages": 1,
      "align_block_size": 8
    },
    {
      "block_size_m": 16,
      "block_size_n": 128,
      "block_size_k": 128,
      "group_size_m": 1,
      "num_warps": 8,
      "num_stages": 1,
      "align_block_size": 16
    },
    {
      "block_size_m": 16,
      "block_size_n": 128,
      "block_size_k": 128,
      "group_size_m": 1,
      "num_warps": 8,
      "num_stages": 1,
      "align_block_size": 32
    },
    {
      "block_size_m": 16,
      "block_size_n": 128,
      "block_size_k": 128,
      "group_size_m": 1,
      "num_warps": 8,
      "num_stages": 1,
      "align_block_size": 64
    },
    {
      "block_size_m": 16,
      "block_size_n": 128,
      "block_size_k": 128,
      "group_size_m": 4,
      "num_warps": 2,
      "num_stages": 1,
      "align_block_size": 8
    },
    {
      "block_size_m": 16,
      "block_size_n": 128,
      "block_size_k": 128,
      "group_size_m": 4,
      "num_warps": 2,
      "num_stages": 1,
      "align_block_size": 16
    },
    {
      "block_size_m": 16,
      "block_size_n": 128,
      "block_size_k": 128,
      "group_size_m": 4,
      "num_warps": 2,
      "num_stages": 1,
      "align_block_size": 32
    },
    {
      "block_size_m": 16,
      "block_size_n": 128,
      "block_size_k": 128,
      "group_size_m": 4,
      "num_warps": 2,
      "num_stages": 1,
      "align_block_size": 64
    },
    {
      "block_size_m": 16,
      "block_size_n": 128,
      "block_size_k": 128,
      "group_size_m": 4,
      "num_warps": 4,
      "num_stages": 1,
      "align_block_size": 8
    },
    {
      "block_size_m": 16,
      "block_size_n": 128,
      "block_size_k": 128,
      "group_size_m": 4,
      "num_warps": 4,
      "num_stages": 1,
      "align_block_size": 16
    },
    {
      "block_size_m": 16,
      "block_size_n": 128,
      "block_size_k": 128,
      "group_size_m": 4,
      "num_warps": 4,
      "num_stages": 1,
      "align_block_size": 32
    },
    {
      "block_size_m": 16,
      "block_size_n": 128,
      "block_size_k": 128,
      "group_size_m": 4,
      "num_warps": 4,
      "num_stages": 1,
      "align_block_size": 64
    },
    {
      "block_size_m": 16,
      "block_size_n": 128,
      "block_size_k": 128,
      "group_size_m": 4,
      "num_warps": 8,
      "num_stages": 1,
      "align_block_size": 8
    },
    {
      "block_size_m": 16,
      "block_size_n": 128,
      "block_size_k": 128,
      "group_size_m": 4,
      "num_warps": 8,
      "num_stages": 1,
      "align_block_size": 16
    },
    {
      "block_size_m": 16,
      "block_size_n": 128,
      "block_size_k": 128,
      "group_size_m": 4,
      "num_warps": 8,
      "num_stages": 1,
      "align_block_size": 32
    },
    {
      "block_size_m": 16,
      "block_size_n": 128,
      "block_size_k": 128,
      "group_size_m": 4,
      "num_warps": 8,
      "num_stages": 1,
      "align_block_size": 64
    },
    {
      "block_size_m": 16,
      "block_size_n": 128,
      "block_size_k": 128,
      "group_size_m": 8,
      "num_warps": 2,
      "num_stages": 1,
      "align_block_size": 8
    },
    {
      "block_size_m": 16,
      "block_size_n": 128,
      "block_size_k": 128,
      "group_size_m": 8,
      "num_warps": 2,
      "num_stages": 1,
      "align_block_size": 16
    },
    {
      "block_size_m": 16,
      "block_size_n": 128,
      "block_size_k": 128,
      "group_size_m": 8,
      "num_warps": 2,
      "num_stages": 1,
      "align_block_size": 32
    },
    {
      "block_size_m": 16,
      "block_size_n": 128,
      "block_size_k": 128,
      "group_size_m": 8,
      "num_warps": 2,
      "num_stages": 1,
      "align_block_size": 64
    },
    {
      "block_size_m": 16,
      "block_size_n": 128,
      "block_size_k": 128,
      "group_size_m": 8,
      "num_warps": 4,
      "num_stages": 1,
      "align_block_size": 8
    },
    {
      "block_size_m": 16,
      "block_size_n": 128,
      "block_size_k": 128,
      "group_size_m": 8,
      "num_warps": 4,
      "num_stages": 1,
      "align_block_size": 16
    },
    {
      "block_size_m": 16,
      "block_size_n": 128,
      "block_size_k": 128,
      "group_size_m": 8,
      "num_warps": 4,
      "num_stages": 1,
      "align_block_size": 32
    },
    {
      "block_size_m": 16,
      "block_size_n": 128,
      "block_size_k": 128,
      "group_size_m": 8,
      "num_warps": 4,
      "num_stages": 1,
      "align_block_size": 64
    },
    {
      "block_size_m": 16,
      "block_size_n": 128,
      "block_size_k": 128,
      "group_size_m": 8,
      "num_warps": 8,
      "num_stages": 1,
      "align_block_size": 8
    },
    {
      "block_size_m": 16,
      "block_size_n": 128,
      "block_size_k": 128,
      "group_size_m": 8,
      "num_warps": 8,
      "num_stages": 1,
      "align_block_size": 16
    },
    {
      "block_size_m": 16,
      "block_size_n": 128,
      "block_size_k": 128,
      "group_size_m": 8,
      "num_warps": 8,
      "num_stages": 1,
      "align_block_size": 32
    },
    {
      "block_size_m": 16,
      "block_size_n": 128,
      "block_size_k": 128,
      "group_size_m": 8,
      "num_warps": 8,
      "num_stages": 1,
      "align_block_size": 64
    },
    {
      "block_size_m": 16,
      "block_size_n": 128,
      "block_size_k": 128,
      "group_size_m": 16,
      "num_warps": 2,
      "num_stages": 1,
      "align_block_size": 8
    },
    {
      "block_size_m": 16,
      "block_size_n": 128,
      "block_size_k": 128,
      "group_size_m": 16,
      "num_warps": 2,
      "num_stages": 1,
      "align_block_size": 16
    },
    {
      "block_size_m": 16,
      "block_size_n": 128,
      "block_size_k": 128,
      "group_size_m": 16,
      "num_warps": 2,
      "num_stages": 1,
      "align_block_size": 32
    },
    {
      "block_size_m": 16,
      "block_size_n": 128,
      "block_size_k": 128,
      "group_size_m": 16,
      "num_warps": 2,
      "num_stages": 1,
      "align_block_size": 64
    },
    {
      "block_size_m": 16,
      "block_size_n": 128,
      "block_size_k": 128,
      "group_size_m": 16,
      "num_warps": 4,
      "num_stages": 1,
      "align_block_size": 8
    },
    {
      "block_size_m": 16,
      "block_size_n": 128,
      "block_size_k": 128,
      "group_size_m": 16,
      "num_warps": 4,
      "num_stages": 1,
      "align_block_size": 16
    },
    {
      "block_size_m": 16,
      "block_size_n": 128,
      "block_size_k": 128,
      "group_size_m": 16,
      "num_warps": 4,
      "num_stages": 1,
      "align_block_size": 32
    },
    {
      "block_size_m": 16,
      "block_size_n": 128,
      "block_size_k": 128,
      "group_size_m": 16,
      "num_warps": 4,
      "num_stages": 1,
      "align_block_size": 64
    },
    {
      "block_size_m": 16,
      "block_size_n": 128,
      "block_size_k": 128,
      "group_size_m": 16,
      "num_warps": 8,
      "num_stages": 1,
      "align_block_size": 8
    },
    {
      "block_size_m": 16,
      "block_size_n": 128,
      "block_size_k": 128,
      "group_size_m": 16,
      "num_warps": 8,
      "num_stages": 1,
      "align_block_size": 16
    },
    {
      "block_size_m": 16,
      "block_size_n": 128,
      "block_size_k": 128,
      "group_size_m": 16,
      "num_warps": 8,
      "num_stages": 1,
      "align_block_size": 32
    },
    {
      "block_size_m": 16,
      "block_size_n": 128,
      "block_size_k": 128,
      "group_size_m": 16,
      "num_warps": 8,
      "num_stages": 1,
      "align_block_size": 64
    },
    {
      "block_size_m": 16,
      "block_size_n": 256,
      "block_size_k": 32,
      "group_size_m": 1,
      "num_warps": 2,
      "num_stages": 1,
      "align_block_size": 8
    },
    {
      "block_size_m": 16,
      "block_size_n": 256,
      "block_size_k": 32,
      "group_size_m": 1,
      "num_warps": 2,
      "num_stages": 1,
      "align_block_size": 16
    },
    {
      "block_size_m": 16,
      "block_size_n": 256,
      "block_size_k": 32,
      "group_size_m": 1,
      "num_warps": 2,
      "num_stages": 1,
      "align_block_size": 32
    },
    {
      "block_size_m": 16,
      "block_size_n": 256,
      "block_size_k": 32,
      "group_size_m": 1,
      "num_warps": 2,
      "num_stages": 1,
      "align_block_size": 64
    },
    {
      "block_size_m": 16,
      "block_size_n": 256,
      "block_size_k": 32,
      "group_size_m": 1,
      "num_warps": 2,
      "num_stages": 2,
      "align_block_size": 8
    },
    {
      "block_size_m": 16,
      "block_size_n": 256,
      "block_size_k": 32,
      "group_size_m": 1,
      "num_warps": 2,
      "num_stages": 2,
      "align_block_size": 16
    },
    {
      "block_size_m": 16,
      "block_size_n": 256,
      "block_size_k": 32,
      "group_size_m": 1,
      "num_warps": 2,
      "num_stages": 2,
      "align_block_size": 32
    },
    {
      "block_size_m": 16,
      "block_size_n": 256,
      "block_size_k": 32,
      "group_size_m": 1,
      "num_warps": 2,
      "num_stages": 2,
      "align_block_size": 64
    },
    {
      "block_size_m": 16,
      "block_size_n": 256,
      "block_size_k": 32,
      "group_size_m": 1,
      "num_warps": 2,
      "num_stages": 3,
      "align_block_size": 8
    },
    {
      "block_size_m": 16,
      "block_size_n": 256,
      "block_size_k": 32,
      "group_size_m": 1,
      "num_warps": 2,
      "num_stages": 3,
      "align_block_size": 16
    },
    {
      "block_size_m": 16,
      "block_size_n": 256,
      "block_size_k": 32,
      "group_size_m": 1,
      "num_warps": 2,
      "num_stages": 3,
      "align_block_size": 32
    },
    {
      "block_size_m": 16,
      "block_size_n": 256,
      "block_size_k": 32,
      "group_size_m": 1,
      "num_warps": 2,
      "num_stages": 3,
      "align_block_size": 64
    },
    {
      "block_size_m": 16,
      "block_size_n": 256,
      "block_size_k": 32,
      "group_size_m": 1,
      "num_warps": 4,
      "num_stages": 1,
      "align_block_size": 8
    },
    {
      "block_size_m": 16,
      "block_size_n": 256,
      "block_size_k": 32,
      "group_size_m": 1,
      "num_warps": 4,
      "num_stages": 1,
      "align_block_size": 16
    },
    {
      "block_size_m": 16,
      "block_size_n": 256,
      "block_size_k": 32,
      "group_size_m": 1,
      "num_warps": 4,
      "num_stages": 1,
      "align_block_size": 32
    },
    {
      "block_size_m": 16,
      "block_size_n": 256,
      "block_size_k": 32,
      "group_size_m": 1,
      "num_warps": 4,
      "num_stages": 1,
      "align_block_size": 64
    },
    {
      "block_size_m": 16,
      "block_size_n": 256,
      "block_size_k": 32,
      "group_size_m": 1,
      "num_warps": 4,
      "num_stages": 2,
      "align_block_size": 8
    },
    {
      "block_size_m": 16,
      "block_size_n": 256,
      "block_size_k": 32,
      "group_size_m": 1,
      "num_warps": 4,
      "num_stages": 2,
      "align_block_size": 16
    },
    {
      "block_size_m": 16,
      "block_size_n": 256,
      "block_size_k": 32,
      "group_size_m": 1,
      "num_warps": 4,
      "num_stages": 2,
      "align_block_size": 32
    },
    {
      "block_size_m": 16,
      "block_size_n": 256,
      "block_size_k": 32,
      "group_size_m": 1,
      "num_warps": 4,
      "num_stages": 2,
      "align_block_size": 64
    },
    {
      "block_size_m": 16,
      "block_size_n": 256,
      "block_size_k": 32,
      "group_size_m": 1,
      "num_warps": 4,
      "num_stages": 3,
      "align_block_size": 8
    },
    {
      "block_size_m": 16,
      "block_size_n": 256,
      "block_size_k": 32,
      "group_size_m": 1,
      "num_warps": 4,
      "num_stages": 3,
      "align_block_size": 16
    },
    {
      "block_size_m": 16,
      "block_size_n": 256,
      "block_size_k": 32,
      "group_size_m": 1,
      "num_warps": 4,
      "num_stages": 3,
      "align_block_size": 32
    },
    {
      "block_size_m": 16,
      "block_size_n": 256,
      "block_size_k": 32,
      "group_size_m": 1,
      "num_warps": 4,
      "num_stages": 3,
      "align_block_size": 64
    },
    {
      "block_size_m": 16,
      "block_size_n": 256,
      "block_size_k": 32,
      "group_size_m": 1,
      "num_warps": 8,
      "num_stages": 1,
      "align_block_size": 8
    },
    {
      "block_size_m": 16,
      "block_size_n": 256,
      "block_size_k": 32,
      "group_size_m": 1,
      "num_warps": 8,
      "num_stages": 1,
      "align_block_size": 16
    },
    {
      "block_size_m": 16,
      "block_size_n": 256,
      "block_size_k": 32,
      "group_size_m": 1,
      "num_warps": 8,
      "num_stages": 1,
      "align_block_size": 32
    },
    {
      "block_size_m": 16,
      "block_size_n": 256,
      "block_size_k": 32,
      "group_size_m": 1,
      "num_warps": 8,
      "num_stages": 1,
      "align_block_size": 64
    },
    {
      "block_size_m": 16,
      "block_size_n": 256,
      "block_size_k": 32,
      "group_size_m": 1,
      "num_warps": 8,
      "num_stages": 2,
      "align_block_size": 8
    },
    {
      "block_size_m": 16,
      "block_size_n": 256,
      "block_size_k": 32,
      "group_size_m": 1,
      "num_warps": 8,
      "num_stages": 2,
      "align_block_size": 16
    },
    {
      "block_size_m": 16,
      "block_size_n": 256,
      "block_size_k": 32,
      "group_size_m": 1,
      "num_warps": 8,
      "num_stages": 2,
      "align_block_size": 32
    },
    {
      "block_size_m": 16,
      "block_size_n": 256,
      "block_size_k": 32,
      "group_size_m": 1,
      "num_warps": 8,
      "num_stages": 2,
      "align_block_size": 64
    },
    {
      "block_size_m": 16,
      "block_size_n": 256,
      "block_size_k": 32,
      "group_size_m": 1,
      "num_warps": 8,
      "num_stages": 3,
      "align_block_size": 8
    },
    {
      "block_size_m": 16,
      "block_size_n": 256,
      "block_size_k": 32,
      "group_size_m": 1,
      "num_warps": 8,
      "num_stages": 3,
      "align_block_size": 16
    },
    {
      "block_size_m": 16,
      "block_size_n": 256,
      "block_size_k": 32,
      "group_size_m": 1,
      "num_warps": 8,
      "num_stages": 3,
      "align_block_size": 32
    },
    {
      "block_size_m": 16,
      "block_size_n": 256,
      "block_size_k": 32,
      "group_size_m": 1,
      "num_warps": 8,
      "num_stages": 3,
      "align_block_size": 64
    },
    {
      "block_size_m": 16,
      "block_size_n": 256,
      "block_size_k": 32,
      "group_size_m": 4,
      "num_warps": 2,
      "num_stages": 1,
      "align_block_size": 8
    },
    {
      "block_size_m": 16,
      "block_size_n": 256,
      "block_size_k": 32,
      "group_size_m": 4,
      "num_warps": 2,
      "num_stages": 1,
      "align_block_size": 16
    },
    {
      "block_size_m": 16,
      "block_size_n": 256,
      "block_size_k": 32,
      "group_size_m": 4,
      "num_warps": 2,
      "num_stages": 1,
      "align_block_size": 32
    },
    {
      "block_size_m": 16,
      "block_size_n": 256,
      "block_size_k": 32,
      "group_size_m": 4,
      "num_warps": 2,
      "num_stages": 1,
      "align_block_size": 64
    },
    {
      "block_size_m": 16,
      "block_size_n": 256,
      "block_size_k": 32,
      "group_size_m": 4,
      "num_warps": 2,
      "num_stages": 2,
      "align_block_size": 8
    },
    {
      "block_size_m": 16,
      "block_size_n": 256,
      "block_size_k": 32,
      "group_size_m": 4,
      "num_warps": 2,
      "num_stages": 2,
      "align_block_size": 16
    },
    {
      "block_size_m": 16,
      "block_size_n": 256,
      "block_size_k": 32,
      "group_size_m": 4,
      "num_warps": 2,
      "num_stages": 2,
      "align_block_size": 32
    },
    {
      "block_size_m": 16,
      "block_size_n": 256,
      "block_size_k": 32,
      "group_size_m": 4,
      "num_warps": 2,
      "num_stages": 2,
      "align_block_size": 64
    },
    {
      "block_size_m": 16,
      "block_size_n": 256,
      "block_size_k": 32,
      "group_size_m": 4,
      "num_warps": 2,
      "num_stages": 3,
      "align_block_size": 8
    },
    {
      "block_size_m": 16,
      "block_size_n": 256,
      "block_size_k": 32,
      "group_size_m": 4,
      "num_warps": 2,
      "num_stages": 3,
      "align_block_size": 16
    },
    {
      "block_size_m": 16,
      "block_size_n": 256,
      "block_size_k": 32,
      "group_size_m": 4,
      "num_warps": 2,
      "num_stages": 3,
      "align_block_size": 32
    },
    {
      "block_size_m": 16,
      "block_size_n": 256,
      "block_size_k": 32,
      "group_size_m": 4,
      "num_warps": 2,
      "num_stages": 3,
      "align_block_size": 64
    },
    {
      "block_size_m": 16,
      "block_size_n": 256,
      "block_size_k": 32,
      "group_size_m": 4,
      "num_warps": 4,
      "num_stages": 1,
      "align_block_size": 8
    },
    {
      "block_size_m": 16,
      "block_size_n": 256,
      "block_size_k": 32,
      "group_size_m": 4,
      "num_warps": 4,
      "num_stages": 1,
      "align_block_size": 16
    },
    {
      "block_size_m": 16,
      "block_size_n": 256,
      "block_size_k": 32,
      "group_size_m": 4,
      "num_warps": 4,
      "num_stages": 1,
      "align_block_size": 32
    },
    {
      "block_size_m": 16,
      "block_size_n": 256,
      "block_size_k": 32,
      "group_size_m": 4,
      "num_warps": 4,
      "num_stages": 1,
      "align_block_size": 64
    },
    {
      "block_size_m": 16,
      "block_size_n": 256,
      "block_size_k": 32,
      "group_size_m": 4,
      "num_warps": 4,
      "num_stages": 2,
      "align_block_size": 8
    },
    {
      "block_size_m": 16,
      "block_size_n": 256,
      "block_size_k": 32,
      "group_size_m": 4,
      "num_warps": 4,
      "num_stages": 2,
      "align_block_size": 16
    },
    {
      "block_size_m": 16,
      "block_size_n": 256,
      "block_size_k": 32,
      "group_size_m": 4,
      "num_warps": 4,
      "num_stages": 2,
      "align_block_size": 32
    },
    {
      "block_size_m": 16,
      "block_size_n": 256,
      "block_size_k": 32,
      "group_size_m": 4,
      "num_warps": 4,
      "num_stages": 2,
      "align_block_size": 64
    },
    {
      "block_size_m": 16,
      "block_size_n": 256,
      "block_size_k": 32,
      "group_size_m": 4,
      "num_warps": 4,
      "num_stages": 3,
      "align_block_size": 8
    },
    {
      "block_size_m": 16,
      "block_size_n": 256,
      "block_size_k": 32,
      "group_size_m": 4,
      "num_warps": 4,
      "num_stages": 3,
      "align_block_size": 16
    },
    {
      "block_size_m": 16,
      "block_size_n": 256,
      "block_size_k": 32,
      "group_size_m": 4,
      "num_warps": 4,
      "num_stages": 3,
      "align_block_size": 32
    },
    {
      "block_size_m": 16,
      "block_size_n": 256,
      "block_size_k": 32,
      "group_size_m": 4,
      "num_warps": 4,
      "num_stages": 3,
      "align_block_size": 64
    },
    {
      "block_size_m": 16,
      "block_size_n": 256,
      "block_size_k": 32,
      "group_size_m": 4,
      "num_warps": 8,
      "num_stages": 1,
      "align_block_size": 8
    },
    {
      "block_size_m": 16,
      "block_size_n": 256,
      "block_size_k": 32,
      "group_size_m": 4,
      "num_warps": 8,
      "num_stages": 1,
      "align_block_size": 16
    },
    {
      "block_size_m": 16,
      "block_size_n": 256,
      "block_size_k": 32,
      "group_size_m": 4,
      "num_warps": 8,
      "num_stages": 1,
      "align_block_size": 32
    },
    {
      "block_size_m": 16,
      "block_size_n": 256,
      "block_size_k": 32,
      "group_size_m": 4,
      "num_warps": 8,
      "num_stages": 1,
      "align_block_size": 64
    },
    {
      "block_size_m": 16,
      "block_size_n": 256,
      "block_size_k": 32,
      "group_size_m": 4,
      "num_warps": 8,
      "num_stages": 2,
      "align_block_size": 8
    },
    {
      "block_size_m": 16,
      "block_size_n": 256,
      "block_size_k": 32,
      "group_size_m": 4,
      "num_warps": 8,
      "num_stages": 2,
      "align_block_size": 16
    },
    {
      "block_size_m": 16,
      "block_size_n": 256,
      "block_size_k": 32,
      "group_size_m": 4,
      "num_warps": 8,
      "num_stages": 2,
      "align_block_size": 32
    },
    {
      "block_size_m": 16,
      "block_size_n": 256,
      "block_size_k": 32,
      "group_size_m": 4,
      "num_warps": 8,
      "num_stages": 2,
      "align_block_size": 64
    },
    {
      "block_size_m": 16,
      "block_size_n": 256,
      "block_size_k": 32,
      "group_size_m": 4,
      "num_warps": 8,
      "num_stages": 3,
      "align_block_size": 8
    },
    {
      "block_size_m": 16,
      "block_size_n": 256,
      "block_size_k": 32,
      "group_size_m": 4,
      "num_warps": 8,
      "num_stages": 3,
      "align_block_size": 16
    },
    {
      "block_size_m": 16,
      "block_size_n": 256,
      "block_size_k": 32,
      "group_size_m": 4,
      "num_warps": 8,
      "num_stages": 3,
      "align_block_size": 32
    },
    {
      "block_size_m": 16,
      "block_size_n": 256,
      "block_size_k": 32,
      "group_size_m": 4,
      "num_warps": 8,
      "num_stages": 3,
      "align_block_size": 64
    },
    {
      "block_size_m": 16,
      "block_size_n": 256,
      "block_size_k": 32,
      "group_size_m": 8,
      "num_warps": 2,
      "num_stages": 1,
      "align_block_size": 8
    },
    {
      "block_size_m": 16,
      "block_size_n": 256,
      "block_size_k": 32,
      "group_size_m": 8,
      "num_warps": 2,
      "num_stages": 1,
      "align_block_size": 16
    },
    {
      "block_size_m": 16,
      "block_size_n": 256,
      "block_size_k": 32,
      "group_size_m": 8,
      "num_warps": 2,
      "num_stages": 1,
      "align_block_size": 32
    },
    {
      "block_size_m": 16,
      "block_size_n": 256,
      "block_size_k": 32,
      "group_size_m": 8,
      "num_warps": 2,
      "num_stages": 1,
      "align_block_size": 64
    },
    {
      "block_size_m": 16,
      "block_size_n": 256,
      "block_size_k": 32,
      "group_size_m": 8,
      "num_warps": 2,
      "num_stages": 2,
      "align_block_size": 8
    },
    {
      "block_size_m": 16,
      "block_size_n": 256,
      "block_size_k": 32,
      "group_size_m": 8,
      "num_warps": 2,
      "num_stages": 2,
      "align_block_size": 16
    },
    {
      "block_size_m": 16,
      "block_size_n": 256,
      "block_size_k": 32,
      "group_size_m": 8,
      "num_warps": 2,
      "num_stages": 2,
      "align_block_size": 32
    },
    {
      "block_size_m": 16,
      "block_size_n": 256,
      "block_size_k": 32,
      "group_size_m": 8,
      "num_warps": 2,
      "num_stages": 2,
      "align_block_size": 64
    },
    {
      "block_size_m": 16,
      "block_size_n": 256,
      "block_size_k": 32,
      "group_size_m": 8,
      "num_warps": 2,
      "num_stages": 3,
      "align_block_size": 8
    },
    {
      "block_size_m": 16,
      "block_size_n": 256,
      "block_size_k": 32,
      "group_size_m": 8,
      "num_warps": 2,
      "num_stages": 3,
      "align_block_size": 16
    },
    {
      "block_size_m": 16,
      "block_size_n": 256,
      "block_size_k": 32,
      "group_size_m": 8,
      "num_warps": 2,
      "num_stages": 3,
      "align_block_size": 32
    },
    {
      "block_size_m": 16,
      "block_size_n": 256,
      "block_size_k": 32,
      "group_size_m": 8,
      "num_warps": 2,
      "num_stages": 3,
      "align_block_size": 64
    },
    {
      "block_size_m": 16,
      "block_size_n": 256,
      "block_size_k": 32,
      "group_size_m": 8,
      "num_warps": 4,
      "num_stages": 1,
      "align_block_size": 8
    },
    {
      "block_size_m": 16,
      "block_size_n": 256,
      "block_size_k": 32,
      "group_size_m": 8,
      "num_warps": 4,
      "num_stages": 1,
      "align_block_size": 16
    },
    {
      "block_size_m": 16,
      "block_size_n": 256,
      "block_size_k": 32,
      "group_size_m": 8,
      "num_warps": 4,
      "num_stages": 1,
      "align_block_size": 32
    },
    {
      "block_size_m": 16,
      "block_size_n": 256,
      "block_size_k": 32,
      "group_size_m": 8,
      "num_warps": 4,
      "num_stages": 1,
      "align_block_size": 64
    },
    {
      "block_size_m": 16,
      "block_size_n": 256,
      "block_size_k": 32,
      "group_size_m": 8,
      "num_warps": 4,
      "num_stages": 2,
      "align_block_size": 8
    },
    {
      "block_size_m": 16,
      "block_size_n": 256,
      "block_size_k": 32,
      "group_size_m": 8,
      "num_warps": 4,
      "num_stages": 2,
      "align_block_size": 16
    },
    {
      "block_size_m": 16,
      "block_size_n": 256,
      "block_size_k": 32,
      "group_size_m": 8,
      "num_warps": 4,
      "num_stages": 2,
      "align_block_size": 32
    },
    {
      "block_size_m": 16,
      "block_size_n": 256,
      "block_size_k": 32,
      "group_size_m": 8,
      "num_warps": 4,
      "num_stages": 2,
      "align_block_size": 64
    },
    {
      "block_size_m": 16,
      "block_size_n": 256,
      "block_size_k": 32,
      "group_size_m": 8,
      "num_warps": 4,
      "num_stages": 3,
      "align_block_size": 8
    },
    {
      "block_size_m": 16,
      "block_size_n": 256,
      "block_size_k": 32,
      "group_size_m": 8,
      "num_warps": 4,
      "num_stages": 3,
      "align_block_size": 16
    },
    {
      "block_size_m": 16,
      "block_size_n": 256,
      "block_size_k": 32,
      "group_size_m": 8,
      "num_warps": 4,
      "num_stages": 3,
      "align_block_size": 32
    },
    {
      "block_size_m": 16,
      "block_size_n": 256,
      "block_size_k": 32,
      "group_size_m": 8,
      "num_warps": 4,
      "num_stages": 3,
      "align_block_size": 64
    },
    {
      "block_size_m": 16,
      "block_size_n": 256,
      "block_size_k": 32,
      "group_size_m": 8,
      "num_warps": 8,
      "num_stages": 1,
      "align_block_size": 8
    },
    {
      "block_size_m": 16,
      "block_size_n": 256,
      "block_size_k": 32,
      "group_size_m": 8,
      "num_warps": 8,
      "num_stages": 1,
      "align_block_size": 16
    },
    {
      "block_size_m": 16,
      "block_size_n": 256,
      "block_size_k": 32,
      "group_size_m": 8,
      "num_warps": 8,
      "num_stages": 1,
      "align_block_size": 32
    },
    {
      "block_size_m": 16,
      "block_size_n": 256,
      "block_size_k": 32,
      "group_size_m": 8,
      "num_warps": 8,
      "num_stages": 1,
      "align_block_size": 64
    },
    {
      "block_size_m": 16,
      "block_size_n": 256,
      "block_size_k": 32,
      "group_size_m": 8,
      "num_warps": 8,
      "num_stages": 2,
      "align_block_size": 8
    },
    {
      "block_size_m": 16,
      "block_size_n": 256,
      "block_size_k": 32,
      "group_size_m": 8,
      "num_warps": 8,
      "num_stages": 2,
      "align_block_size": 16
    },
    {
      "block_size_m": 16,
      "block_size_n": 256,
      "block_size_k": 32,
      "group_size_m": 8,
      "num_warps": 8,
      "num_stages": 2,
      "align_block_size": 32
    },
    {
      "block_size_m": 16,
      "block_size_n": 256,
      "block_size_k": 32,
      "group_size_m": 8,
      "num_warps": 8,
      "num_stages": 2,
      "align_block_size": 64
    },
    {
      "block_size_m": 16,
      "block_size_n": 256,
      "block_size_k": 32,
      "group_size_m": 8,
      "num_warps": 8,
      "num_stages": 3,
      "align_block_size": 8
    },
    {
      "block_size_m": 16,
      "block_size_n": 256,
      "block_size_k": 32,
      "group_size_m": 8,
      "num_warps": 8,
      "num_stages": 3,
      "align_block_size": 16
    },
    {
      "block_size_m": 16,
      "block_size_n": 256,
      "block_size_k": 32,
      "group_size_m": 8,
      "num_warps": 8,
      "num_stages": 3,
      "align_block_size": 32
    },
    {
      "block_size_m": 16,
      "block_size_n": 256,
      "block_size_k": 32,
      "group_size_m": 8,
      "num_warps": 8,
      "num_stages": 3,
      "align_block_size": 64
    },
    {
      "block_size_m": 16,
      "block_size_n": 256,
      "block_size_k": 32,
      "group_size_m": 16,
      "num_warps": 2,
      "num_stages": 1,
      "align_block_size": 8
    },
    {
      "block_size_m": 16,
      "block_size_n": 256,
      "block_size_k": 32,
      "group_size_m": 16,
      "num_warps": 2,
      "num_stages": 1,
      "align_block_size": 16
    },
    {
      "block_size_m": 16,
      "block_size_n": 256,
      "block_size_k": 32,
      "group_size_m": 16,
      "num_warps": 2,
      "num_stages": 1,
      "align_block_size": 32
    },
    {
      "block_size_m": 16,
      "block_size_n": 256,
      "block_size_k": 32,
      "group_size_m": 16,
      "num_warps": 2,
      "num_stages": 1,
      "align_block_size": 64
    },
    {
      "block_size_m": 16,
      "block_size_n": 256,
      "block_size_k": 32,
      "group_size_m": 16,
      "num_warps": 2,
      "num_stages": 2,
      "align_block_size": 8
    },
    {
      "block_size_m": 16,
      "block_size_n": 256,
      "block_size_k": 32,
      "group_size_m": 16,
      "num_warps": 2,
      "num_stages": 2,
      "align_block_size": 16
    },
    {
      "block_size_m": 16,
      "block_size_n": 256,
      "block_size_k": 32,
      "group_size_m": 16,
      "num_warps": 2,
      "num_stages": 2,
      "align_block_size": 32
    },
    {
      "block_size_m": 16,
      "block_size_n": 256,
      "block_size_k": 32,
      "group_size_m": 16,
      "num_warps": 2,
      "num_stages": 2,
      "align_block_size": 64
    },
    {
      "block_size_m": 16,
      "block_size_n": 256,
      "block_size_k": 32,
      "group_size_m": 16,
      "num_warps": 2,
      "num_stages": 3,
      "align_block_size": 8
    },
    {
      "block_size_m": 16,
      "block_size_n": 256,
      "block_size_k": 32,
      "group_size_m": 16,
      "num_warps": 2,
      "num_stages": 3,
      "align_block_size": 16
    },
    {
      "block_size_m": 16,
      "block_size_n": 256,
      "block_size_k": 32,
      "group_size_m": 16,
      "num_warps": 2,
      "num_stages": 3,
      "align_block_size": 32
    },
    {
      "block_size_m": 16,
      "block_size_n": 256,
      "block_size_k": 32,
      "group_size_m": 16,
      "num_warps": 2,
      "num_stages": 3,
      "align_block_size": 64
    },
    {
      "block_size_m": 16,
      "block_size_n": 256,
      "block_size_k": 32,
      "group_size_m": 16,
      "num_warps": 4,
      "num_stages": 1,
      "align_block_size": 8
    },
    {
      "block_size_m": 16,
      "block_size_n": 256,
      "block_size_k": 32,
      "group_size_m": 16,
      "num_warps": 4,
      "num_stages": 1,
      "align_block_size": 16
    },
    {
      "block_size_m": 16,
      "block_size_n": 256,
      "block_size_k": 32,
      "group_size_m": 16,
      "num_warps": 4,
      "num_stages": 1,
      "align_block_size": 32
    },
    {
      "block_size_m": 16,
      "block_size_n": 256,
      "block_size_k": 32,
      "group_size_m": 16,
      "num_warps": 4,
      "num_stages": 1,
      "align_block_size": 64
    },
    {
      "block_size_m": 16,
      "block_size_n": 256,
      "block_size_k": 32,
      "group_size_m": 16,
      "num_warps": 4,
      "num_stages": 2,
      "align_block_size": 8
    },
    {
      "block_size_m": 16,
      "block_size_n": 256,
      "block_size_k": 32,
      "group_size_m": 16,
      "num_warps": 4,
      "num_stages": 2,
      "align_block_size": 16
    },
    {
      "block_size_m": 16,
      "block_size_n": 256,
      "block_size_k": 32,
      "group_size_m": 16,
      "num_warps": 4,
      "num_stages": 2,
      "align_block_size": 32
    },
    {
      "block_size_m": 16,
      "block_size_n": 256,
      "block_size_k": 32,
      "group_size_m": 16,
      "num_warps": 4,
      "num_stages": 2,
      "align_block_size": 64
    },
    {
      "block_size_m": 16,
      "block_size_n": 256,
      "block_size_k": 32,
      "group_size_m": 16,
      "num_warps": 4,
      "num_stages": 3,
      "align_block_size": 8
    },
    {
      "block_size_m": 16,
      "block_size_n": 256,
      "block_size_k": 32,
      "group_size_m": 16,
      "num_warps": 4,
      "num_stages": 3,
      "align_block_size": 16
    },
    {
      "block_size_m": 16,
      "block_size_n": 256,
      "block_size_k": 32,
      "group_size_m": 16,
      "num_warps": 4,
      "num_stages": 3,
      "align_block_size": 32
    },
    {
      "block_size_m": 16,
      "block_size_n": 256,
      "block_size_k": 32,
      "group_size_m": 16,
      "num_warps": 4,
      "num_stages": 3,
      "align_block_size": 64
    },
    {
      "block_size_m": 16,
      "block_size_n": 256,
      "block_size_k": 32,
      "group_size_m": 16,
      "num_warps": 8,
      "num_stages": 1,
      "align_block_size": 8
    },
    {
      "block_size_m": 16,
      "block_size_n": 256,
      "block_size_k": 32,
      "group_size_m": 16,
      "num_warps": 8,
      "num_stages": 1,
      "align_block_size": 16
    },
    {
      "block_size_m": 16,
      "block_size_n": 256,
      "block_size_k": 32,
      "group_size_m": 16,
      "num_warps": 8,
      "num_stages": 1,
      "align_block_size": 32
    },
    {
      "block_size_m": 16,
      "block_size_n": 256,
      "block_size_k": 32,
      "group_size_m": 16,
      "num_warps": 8,
      "num_stages": 1,
      "align_block_size": 64
    },
    {
      "block_size_m": 16,
      "block_size_n": 256,
      "block_size_k": 32,
      "group_size_m": 16,
      "num_warps": 8,
      "num_stages": 2,
      "align_block_size": 8
    },
    {
      "block_size_m": 16,
      "block_size_n": 256,
      "block_size_k": 32,
      "group_size_m": 16,
      "num_warps": 8,
      "num_stages": 2,
      "align_block_size": 16
    },
    {
      "block_size_m": 16,
      "block_size_n": 256,
      "block_size_k": 32,
      "group_size_m": 16,
      "num_warps": 8,
      "num_stages": 2,
      "align_block_size": 32
    },
    {
      "block_size_m": 16,
      "block_size_n": 256,
      "block_size_k": 32,
      "group_size_m": 16,
      "num_warps": 8,
      "num_stages": 2,
      "align_block_size": 64
    },
    {
      "block_size_m": 16,
      "block_size_n": 256,
      "block_size_k": 32,
      "group_size_m": 16,
      "num_warps": 8,
      "num_stages": 3,
      "align_block_size": 8
    },
    {
      "block_size_m": 16,
      "block_size_n": 256,
      "block_size_k": 32,
      "group_size_m": 16,
